US6365390B1,"Phenolic acid esterases, coding sequences and methods ","University Of Georgia Research Foundation, Inc.","David L. Blum, Irina Kataeva, Xin-Liang Li, Lars G. Ljungdahl",1998-09-04,1999-09-03,2002-04-02,2002-04-02,https://patents.google.com/patent/US6365390B1/en
US6340572B1,"Kit for the isolation, identification and quantitation of toxicants ","Board Of Regents, The University Of Texas System","James E. Becvar, Laura E. Becvar",1991-04-04,1999-09-03,2002-01-22,2002-01-22,https://patents.google.com/patent/US6340572B1/en
US6353658B1,Miniature x-ray source ,The Regents Of The University Of California,"James E. Trebes, Gary F. Stone, Perry M. Bell, Ronald B. Robinson, Victor I. Chornenky",1999-09-08,1999-09-08,2002-03-05,2002-03-05,https://patents.google.com/patent/US6353658B1/en
US6387621B1,Automated analysis of real-time nucleic acid amplification ,University Of Utah Research Foundation,Cart T. Wittwer,1999-04-27,1999-09-08,2002-05-14,2002-05-14,https://patents.google.com/patent/US6387621B1/en
US6363632B1,System for autonomous excavation and truck loading ,Carnegie Mellon University,"Anthony Stentz, John Bares, Sanjiv Singh, Patrick Rowe, Patrick C. Leger, Norman Keith Lay",1998-10-09,1999-09-09,2002-04-02,2002-04-02,https://patents.google.com/patent/US6363632B1/en
US6380371B1,Endoglycan: a novel protein having selectin ligand and chemokine presentation activity ,The Regents Of The University Of California,"Christopher M. Sassetti, Steven D. Rosen",1998-12-10,1999-09-13,2002-04-30,2002-04-30,https://patents.google.com/patent/US6380371B1/en
US6375944B1,Methods and compositions for enhancing the immunostimulatory effect of interleukin-12 ,"The Wistar Institute Of Anatomy And Biology, The Trustees Of The University Of Pennsylvania","Giorgio Trinchieri, William M. F. Lee, Holly Koblish",1998-09-25,1999-09-13,2002-04-23,2002-04-23,https://patents.google.com/patent/US6375944B1/en
US6396590B1,Process and system for determination of layer thickness swell of wood composites ,The University Of Tennessee Research Corporation,"Siqun Wang, Paul Michael Winistorfer",1999-09-13,1999-09-13,2002-05-28,2002-05-28,https://patents.google.com/patent/US6396590B1/en
US6343305B1,"Methods and apparatus for multiplication in a galois field GF (2m), encoders and decoders using same ",The State Of Oregon Acting By And Through The State Board Of Higher Education On Behalf Of Oregon State University,"etin Kaya Koç, Berk Sunar",1999-09-14,1999-09-14,2002-01-29,2002-01-29,https://patents.google.com/patent/US6343305B1/en
US6379393B1,"Prosthetic, orthotic, and other rehabilitative robotic assistive devices actuated by smart materials ","Rutgers, The State University Of New Jersey","Constantinos Mavroidis, Charles Pfeiffer, Kathryn J. DeLaurentis, Michael J. Mosley",1998-09-14,1999-09-14,2002-04-30,2002-04-30,https://patents.google.com/patent/US6379393B1/en
US6343512B1,Ultrasound probe including a hydrophilic couplant ,Cranfield University,"Simon Bourne, Donald James Highgate, Wayne Woodhead, Marcus Newborough",1998-09-15,1999-09-15,2002-02-05,2002-02-05,https://patents.google.com/patent/US6343512B1/en
US6364845B1,Methods for diagnosing visuospatial disorientation or assessing visuospatial orientation capacity ,University Of Rochester,"Charles J. Duffy, Sheldon J. Tetewsky",1998-09-17,1999-09-16,2002-04-02,2002-04-02,https://patents.google.com/patent/US6364845B1/en
US6372461B1,Synthesis of vanillin from a carbon source ,Board Of Directors Operating Michigan State University,John W. Frost,1998-09-18,1999-09-16,2002-04-16,2002-04-16,https://patents.google.com/patent/US6372461B1/en
US6355863B1,Seed plants exhibiting inducible early reproductive development and methods of making same ,The Regents Of The University Of California,Martin F. Yanofsky,1996-06-05,1999-09-16,2002-03-12,2002-03-12,https://patents.google.com/patent/US6355863B1/en
US6339450B1,Error resilient transcoding for video over wireless channels ,"At&T Corp, Columbia University","Shih-Fu Chang, Justin Che-I Chuang, Gustavo De Los Reyes, Amy Ruth Reibman",1999-09-21,1999-09-21,2002-01-15,2002-01-15,https://patents.google.com/patent/US6339450B1/en
US6348311B1,ATM kinase modulation for screening and therapies ,"St. Jude Childre's Research Hospital, Johns-Hopkins University","Michael Kastan, Christine Canman, Seong-tae Kim, Dae-sik Lim",1999-02-10,1999-09-21,2002-02-19,2002-02-19,https://patents.google.com/patent/US6348311B1/en
US6391316B1,Vaccine compositions comprising Haemophilus somnus transferrin-binding proteins and methods of use ,University Of Saskatchewan,"Andrew A. Potter, Clement Rioux, Anthony B. Schryvers",1999-03-10,1999-09-24,2002-05-21,2002-05-21,https://patents.google.com/patent/US6391316B1/en
US6396061B1,Actively driven thermal radiation shield ,The Regents Of The University Of California,"Norman W. Madden, Christopher P. Cork, John A. Becker, David A. Knapp",1999-09-24,1999-09-24,2002-05-28,2002-05-28,https://patents.google.com/patent/US6396061B1/en
US6350515B1,Biomolecular synthesis of quantum dot composites ,University Of Massachussetts Lowell,"Carl Lawton, Suzanne Conroy",1994-12-01,1999-09-28,2002-02-26,2002-02-26,https://patents.google.com/patent/US6350515B1/en
US6335011B1,Methods for delivering DNA to muscle cells using recombinant adeno-associated virus virions to treat lysosomal storage disease ,"Avigen, Inc., Johns Hopkins University","Gregory M. Podsakoff, Paul D. Kessler, Barry J. Byrne, Gary J. Kurtzman",1996-01-18,1999-09-28,2002-01-01,2002-01-01,https://patents.google.com/patent/US6335011B1/en
US6372208B1,Method of reducing an immune response to a recombinant virus ,"The Trustees Of The University Of Pennsylvania, The Wistar Institute Of Anatomy And Biology","James M. Wilson, Yiping Yang, Giorgio Trinchieri",1999-09-28,1999-09-28,2002-04-16,2002-04-16,https://patents.google.com/patent/US6372208B1/en
US6337097B1,Biodegradable and edible feed packaging materials ,Kansas State University Research Foundation,"Xiuzhi S. Sun, Paul Seib, Greggory S. Karr",1999-09-29,1999-09-29,2002-01-08,2002-01-08,https://patents.google.com/patent/US6337097B1/en
US6368569B1,Method of solubilizing unshortened carbon nanotubes in organic solutions ,University Of Kentucky Research Foundation,"Robert C. Haddon, Jian Chen, Mark A. Hamon",1998-10-02,1999-09-30,2002-04-09,2002-04-09,https://patents.google.com/patent/US6368569B1/en
US6382526B1,Process and apparatus for the production of nanofibers ,The University Of Akron,"Darrell H. Reneker, Iksoo Chun, Dale Ertley",1998-10-01,1999-10-01,2002-05-07,2002-05-07,https://patents.google.com/patent/US6382526B1/en
US6395892B1,Floral homeotic genes for manipulation of flowering in poplar and other plant species ,The State Of Oregon Acting By And Through The State Board Of Higher Education On Behalf Of Oregon State University,"Steven H. Strauss, William Rottmann, Amy Brunner, Lorraine Sheppard",1998-04-06,1999-10-01,2002-05-28,2002-05-28,https://patents.google.com/patent/US6395892B1/en
US6359914B1,Tunable pulsed narrow bandwidth light source ,University Of Dayton,"Peter E. Powers, Thomas J. Kulp",1999-10-04,1999-10-04,2002-03-19,2002-03-19,https://patents.google.com/patent/US6359914B1/en
US6348175B1,Membrane apparatus with enhanced mass transfer via active mixing ,University Of Pittsburgh,"Harvey S. Borovetz, Philip Litwak, Mark Gartner, Gary D. Reeder, Patricia Sawzik",1997-04-11,1999-10-05,2002-02-19,2002-02-19,https://patents.google.com/patent/US6348175B1/en
US6350413B1,Integrated optic waveguide immunosensor ,University Of Utah Research Foundation,"W. Monty Reichert, James N. Herron, Douglas A. Christensen, Hsu-Kun Wang",1995-02-23,1999-10-05,2002-02-26,2002-02-26,https://patents.google.com/patent/US6350413B1/en
US6355225B1,Fullerene contrast agent for magnetic resonance imaging and spectroscopy ,"Wm. Marsh Rice University Tda Research, Inc.","John M. Alford, Lon J. Wilson",1999-10-05,1999-10-05,2002-03-12,2002-03-12,https://patents.google.com/patent/US6355225B1/en
US6380364B1,Chimeric biotin-binding papillomavirus protein ,Loyola University Of Chicago,"Martin Mueller, John D. Nieland, Markwin P. Velders, W. Martin Kast",1998-11-23,1999-10-06,2002-04-30,2002-04-30,https://patents.google.com/patent/US6380364B1/en
US6391049B1,Solid biodegradable device for use in tissue repair ,Board Of Regents The University Of Texas System,"Karen M. McNally, Brian S. Sorg, Ashley J. Welch",1999-10-06,1999-10-06,2002-05-21,2002-05-21,https://patents.google.com/patent/US6391049B1/en
US6369295B1,Uses of transgenic mouse containing a type X collagen mutant ,University Of Hong Kong,"Kathryn S. E. Cheah, Kenneth M. C. Cheung",1998-10-08,1999-10-08,2002-04-09,2002-04-09,https://patents.google.com/patent/US6369295B1/en
US6391632B1,Recombinant alphavirus-based vectors with reduced inhibition of cellular macromolecular synthesis ,"Chiron Corporation, Washington University","Thomas W. Dubensky, Jr., John M. Polo, Barbara A. Belli, Sondra Schlesinger, Sergey A. Dryga, Ilya Frolov",1996-04-05,1999-10-08,2002-05-21,2002-05-21,https://patents.google.com/patent/US6391632B1/en
US6372178B1,Method for freeform fabrication of a three-dimensional object ,Arizona Board Of Regents Acting For And On Behalf Of Arizona State University,Ampere A. Tseng,1998-02-09,1999-10-12,2002-04-16,2002-04-16,https://patents.google.com/patent/US6372178B1/en
US6334968B1,Method of forming polysaccharide sponges for cell culture and transplantation ,Ben Gurion University Of The Negev,"Lilia Shapiro, Rachel Glicklis, Smadar Cohen",1996-05-22,1999-10-13,2002-01-01,2002-01-01,https://patents.google.com/patent/US6334968B1/en
US6391614B1,Auxiliary gene and protein of methicillin resistant bacteria and antagonists thereof ,The Rockefeller University,"Alexander Tomasz, Herminia De Lencastre",1995-07-10,1999-10-15,2002-05-21,2002-05-21,https://patents.google.com/patent/US6391614B1/en
US6382025B1,Rotational rate sensor ,The Regents Of The University Of California,Steven L. Hunter,1999-10-15,1999-10-15,2002-05-07,2002-05-07,https://patents.google.com/patent/US6382025B1/en
US6350326B1,Method for practicing a feedback controlled laser induced surface modification ,The University Of Tennessee Research Corporation,"T. Dwayne McCay, Mary Helen McCay, Narendra B. Dahotre",1996-01-15,1999-10-19,2002-02-26,2002-02-26,https://patents.google.com/patent/US6350326B1/en
US6343228B1,Method and apparatus for fluorescence imaging of tissue ,The Hong Kong University Of Science And Technology,Jianan Qu,1999-10-19,1999-10-19,2002-01-29,2002-01-29,https://patents.google.com/patent/US6343228B1/en
US6356748B1,Spectrum control for direct conversion radio frequency reception ,The Board Of Trustees Of The Leland Stanford Junior University,"Won Namgoong, Teresa H. Y. Meng",1996-07-19,1999-10-21,2002-03-12,2002-03-12,https://patents.google.com/patent/US6356748B1/en
US6385376B1,"Fused vertical coupler for switches, filters and other electro-optic devices ",The Regents Of The University Of California,"John E. Bowers, Bin Liu, Patrick Abraham, Boo-Gyoun Kim, Ali Shakouri",1998-10-30,1999-10-22,2002-05-07,2002-05-07,https://patents.google.com/patent/US6385376B1/en
US6348315B1,Polysome display in the absence of functional ssrA-RNA ,"University of Zürich, Assignee for Josef Hanes","Andreas Plückthun, Jozef Hanes, Lutz Jermutus",1997-04-23,1999-10-22,2002-02-19,2002-02-19,https://patents.google.com/patent/US6348315B1/en
US6352669B1,Method for sintering mechanisms ,The Board Of Trustees Of The Leland Stanford Junior University,"Alexander Cooper, Friedrich Prinz",1998-10-22,1999-10-22,2002-03-05,2002-03-05,https://patents.google.com/patent/US6352669B1/en
US6344475B1,Conductance of improperly folded proteins through the secretory pathway ,Yale University,"Michael J. Caplan, Marie E. Egan",1998-10-27,1999-10-27,2002-02-05,2002-02-05,https://patents.google.com/patent/US6344475B1/en
US6362624B1,Apparatus and method for high pressure NMR spectroscopy ,The Research Foundation Of State University Of New York,"Andrew J. Wand, Mark R. Ehrhardt, Jeffrey L. Urbauer",1997-11-12,1999-10-27,2002-03-26,2002-03-26,https://patents.google.com/patent/US6362624B1/en
US6395895B1,Butenyl substituted β-lactams ,Florida State University,"Robert A. Holton, Ki-byung Chai, Hossain Nadizadeh",1991-09-23,1999-10-27,2002-05-28,2002-05-28,https://patents.google.com/patent/US6395895B1/en
US6376636B1,"Modular, energy-dissipating material and method for using it ",The Regents Of The University Of California,"Paul K. Hansma, Johannes Kindt, Timothy J. Deming, Daniel E. Morse, Galen D. Stucky",1998-10-28,1999-10-28,2002-04-23,2002-04-23,https://patents.google.com/patent/US6376636B1/en
US6358259B1,Device for use in tying knots ,University College London,"Paul Swain, Feng Gong, Geoffrey John Brown, Timothy Noel Mills",1992-09-04,1999-10-28,2002-03-19,2002-03-19,https://patents.google.com/patent/US6358259B1/en
US6338560B1,Self-cleaning rotating mirrors ,Tufts University,"Behrouz Abedian, Michael C. Swarden",1999-10-28,1999-10-28,2002-01-15,2002-01-15,https://patents.google.com/patent/US6338560B1/en
US6355166B1,Magnetically enhanced composite materials and methods for making and using the same ,The University Of Iowa Research Foundation,"Sudath Amarasinghe, Shelley Minteer, Lois Anne Zook, Drew C. Dunwoody, Catherine Spolar, Hachull Chung, Johna Leddy",1994-08-25,1999-10-29,2002-03-12,2002-03-12,https://patents.google.com/patent/US6355166B1/en
US6355786B1,Purified and isolated protein zero related (PZR) and therapeutic and screening methods using same ,Vanderbilt University,Zhizhuang Zhao,1998-10-30,1999-10-29,2002-03-12,2002-03-12,https://patents.google.com/patent/US6355786B1/en
US6366873B1,Dopant profile modeling by rare event enhanced domain-following molecular dynamics ,The Regents Of The University Of California,"Keith M. Beardmore, Niels G. Jensen",1999-01-20,1999-10-29,2002-04-02,2002-04-02,https://patents.google.com/patent/US6366873B1/en
US6344404B1,Method of separation films from bulk substrates by plasma immersion ion implantation ,The Regents Of The University Of California,"Nathan W. Cheung, Xiang Lu, Chenming Hu",1997-05-28,1999-11-01,2002-02-05,2002-02-05,https://patents.google.com/patent/US6344404B1/en
US6349477B1,Self adjusting inclinometer ,The Regents Of The University Of California,Steven L. Hunter,1999-11-01,1999-11-01,2002-02-26,2002-02-26,https://patents.google.com/patent/US6349477B1/en
US6370784B1,Tiltmeter leveling mechanism ,The Regents Of The University Of California,"Steven L. Hunter, Carl O. Boro, Alvis Farris",1999-11-01,1999-11-01,2002-04-16,2002-04-16,https://patents.google.com/patent/US6370784B1/en
US6348569B1,"Spruce budworm antifreeze proteins, genes and method of using same ",Queen's University At Kingston,"Virginia K. Walker, Peter L. Davies, Mitra Rahavard, Michael G. Tyshenko",1996-06-03,1999-11-04,2002-02-19,2002-02-19,https://patents.google.com/patent/US6348569B1/en
US6377919B1,"System and method for characterizing voiced excitations of speech and acoustic signals, removing acoustic noise from speech, and synthesizing speech ",The Regents Of The University Of California,"Greg C. Burnett, John F. Holzrichter, Lawrence C. Ng",1996-02-06,1999-11-04,2002-04-23,2002-04-23,https://patents.google.com/patent/US6377919B1/en
US6365171B1,"Amphiphilic networks, implantable immunoisolatory devices and methods of preparation ",The University Of Akron,"Joseph P. Kennedy, Balazs Keszler, Györgyi Fenyvesi",1999-11-04,1999-11-04,2002-04-02,2002-04-02,https://patents.google.com/patent/US6365171B1/en
US6379944B1,Mammalian cell lines expressing bovine adenovirus functions ,University Of Saskatchewan,"Suresh K. Mittal, Frank L. Graham, Ludvik Prevec, Lorne A. Babiuk, Suresh Kumar Tikoo",1993-12-09,1999-11-05,2002-04-30,2002-04-30,https://patents.google.com/patent/US6379944B1/en
US6346607B1,APAF-1 an activator of caspase-3 ,"Board Of Regents, The University Of Texas System",Xiaodong Wang,1997-06-05,1999-11-05,2002-02-12,2002-02-12,https://patents.google.com/patent/US6346607B1/en
US6362000B1,Fusion protein delivery system and uses thereof ,University Of Alabama Research Foundation,"John Christopher Kappes, Xiaoyun Wu",1995-04-14,1999-11-05,2002-03-26,2002-03-26,https://patents.google.com/patent/US6362000B1/en
US6358954B1,"PDGF receptor kinase inhibitory compounds, their preparation, purification and pharmaceutical compositions including same ",Yissum Research Development Company Of The Hebrew University Of Jerusalem,"Alexander Levitzki, Aviv Gazit, Shmuel Banai, S. David Gertz, Gershon Golomb, Frank D. Boehmer, Johannes Waltenberger",1999-11-09,1999-11-09,2002-03-19,2002-03-19,https://patents.google.com/patent/US6358954B1/en
US6383816B1,Probing of surface roughness ,University Of Delaware,"Mary J. Wirth, Cozette Cuppett, Leon Doneski",1998-11-10,1999-11-09,2002-05-07,2002-05-07,https://patents.google.com/patent/US6383816B1/en
US6345203B1,"System and method for powering, controlling, and communicating with multiple inductively-powered devices ",North Carolina State University,"Jeffrey S. Mueller, H. Troy Nagle, Ronald S. Gyurcsik, Arthur W. Kelley",1998-06-09,1999-11-09,2002-02-05,2002-02-05,https://patents.google.com/patent/US6345203B1/en
US6363153B1,Method and apparatus for secure digital chaotic communication ,University Of New Hampshire,"Andrew T. Parker, Kevin M. Short",1998-11-12,1999-11-09,2002-03-26,2002-03-26,https://patents.google.com/patent/US6363153B1/en
US6372259B1,"Palatable, sustained release drug granules ",University Of Iowa Research Foundation,Vijay Kumar,1999-11-10,1999-11-10,2002-04-16,2002-04-16,https://patents.google.com/patent/US6372259B1/en
US6387907B1,Use of serotonin agonists to alleviate disordered breathing episodes in a mammal ,The Trustees Of The University Of Pennsylvania,"Joan C. Hendricks, Leszek Kubin, Allan I. Pack, Sigrid C. Veasey",1997-05-16,1999-11-12,2002-05-14,2002-05-14,https://patents.google.com/patent/US6387907B1/en
US6342313B1,Oxide films and process for preparing same ,The Curators Of The University Of Missouri,"Henry W. White, Shen Zhu, Yungryel Ryu",1998-08-03,1999-11-12,2002-01-29,2002-01-29,https://patents.google.com/patent/US6342313B1/en
US6383493B1,Methods and compositions for eliciting an immune response with hsp70-peptide complexes ,Fordham University,"Pramod K. Srivastava, Rajiv Y. Chandawarkar",1997-02-07,1999-11-15,2002-05-07,2002-05-07,https://patents.google.com/patent/US6383493B1/en
US6387493B1,Bundles of fibers useful for moving liquids at high fluxes and acquisition/distribution structures that use the bundles ,Clemson University Research Foundation,"Bobby Mal Phillips, Jackson Lee Nelson, Shriram Bagrodia",1996-08-22,1999-11-15,2002-05-14,2002-05-14,https://patents.google.com/patent/US6387493B1/en
US6358392B1,Bismuth thin films structure and method of construction ,The Johns Hopkins University,"Fengyuan Yang, Kai Liu, Chia-Ling Chien, Peter C. Searson",1998-11-18,1999-11-18,2002-03-19,2002-03-19,https://patents.google.com/patent/US6358392B1/en
US6366794B1,Generic integrated implantable potentiostat telemetry unit for electrochemical sensors ,The University Of Connecticut,"Francis Moussy, Robert W. Conlan, Markham C. Godwin, Richard D. Beach",1998-11-20,1999-11-19,2002-04-02,2002-04-02,https://patents.google.com/patent/US6366794B1/en
US6395214B1,High pressure and low temperature sintering of nanophase ceramic powders ,"Rutgers, The State University Of New Jersey","Bernard H. Kear, Shih-Chieh Liao, William E. Mayo",1998-11-30,1999-11-19,2002-05-28,2002-05-28,https://patents.google.com/patent/US6395214B1/en
US6379708B1,Method for enhancing immune responses in mammals ,"Cytologic, Llc, Colorado State University Research Foundation","Mark Douglas Howell, Cheryl Lynn Selinsky, Leland Charles Leber",1999-11-20,1999-11-20,2002-04-30,2002-04-30,https://patents.google.com/patent/US6379708B1/en
US6352671B1,Aluminum alloy ,"University Of New Orleans Foundation, The Board Of Supervisors Of Louisiana State University And Agricultural And Mechanical College","Alfred F. Daech, Nikhil K. Sarkar",1998-11-30,1999-11-20,2002-03-05,2002-03-05,https://patents.google.com/patent/US6352671B1/en
US6342654B1,"Use of HrmA proteins and their genes for broad range protection of plants against bacterial, fungal and viral pathogens ",University Of Kentucky Research University,"Qingshun Li, Songhai Shen, Arthur G. Hunt, Sheng Yang He",1999-11-22,1999-11-22,2002-01-29,2002-01-29,https://patents.google.com/patent/US6342654B1/en
US6397205B1,Document categorization and evaluation via cross-entrophy ,Duquesne University Of The Holy Ghost,Patrick Juola,1998-11-24,1999-11-22,2002-05-28,2002-05-28,https://patents.google.com/patent/US6397205B1/en
US6370964B1,Diagnostic layer and methods for detecting structural integrity of composite and metallic materials ,The Board Of Trustees Of The Leland Stanford Junior University,"Fu-Kuo Chang, Mark Lin",1998-11-23,1999-11-23,2002-04-16,2002-04-16,https://patents.google.com/patent/US6370964B1/en
US6355235B1,Topical application of antibodies for contraception and for prophylaxis against sexually transmitted diseases ,Johns Hopkins University,"Richard A. Cone, Kevin J. Whaley",1989-02-01,1999-11-23,2002-03-12,2002-03-12,https://patents.google.com/patent/US6355235B1/en
US6385486B1,Brain function scan system ,New York University,"Erwin Roy John, Michael Sasha John",1997-08-07,1999-11-23,2002-05-07,2002-05-07,https://patents.google.com/patent/US6385486B1/en
US6391554B1,Detecting cancerous conditions by assaying for telomerase activity ,"Geron Corporation And Board Of Regents, The University Of Texas Systems","Michael D. West, Jerry W. Shay, Woodring E. Wright, Nam Woo Kim, Calvin B. Harley, Scott L. Weinrich",1992-05-13,1999-11-23,2002-05-21,2002-05-21,https://patents.google.com/patent/US6391554B1/en
US6365798B1,Method for enhancement of naturally occurring cytoplasmic male sterility and for restoration of male fertility and uses thereof in hybrid crop production ,Mcgill University,Gregory G. Brown,1997-05-30,1999-11-23,2002-04-02,2002-04-02,https://patents.google.com/patent/US6365798B1/en
US6372422B1,Multiple sexed embryo production system for mammals ,"Colorado State University Through Its Agent Colorado State University Research Foundation And Xy, Inc.","George Seidel, Lisa Herickhoff, John Schenk",1997-12-31,1999-11-24,2002-04-16,2002-04-16,https://patents.google.com/patent/US6372422B1/en
US6344121B1,Preparative chiral separations ,University Of Cincinnati,"Apryll Marie Stalcup, Richard Matthew Charles Sutton",1998-11-25,1999-11-24,2002-02-05,2002-02-05,https://patents.google.com/patent/US6344121B1/en
US6377383B1,Optical switching by controllable frustration of total internal reflection ,The University Of British Columbia,"Lorne A. Whitehead, Robin John Noel Coope, Andrzej Kotlicki",1997-09-04,1999-11-26,2002-04-23,2002-04-23,https://patents.google.com/patent/US6377383B1/en
US6390878B1,Shape memory alloy actuators for toy vehicles ,The Hong Kong Polytechnic University,"Li-Min Zhou, Boon-Wai Shiu, Andrew Meng-Cheung Young",1999-11-26,1999-11-26,2002-05-21,2002-05-21,https://patents.google.com/patent/US6390878B1/en
US6369030B1,Inhibitors of histone acetyltransferases (HATs) and uses thereof ,The Rockfeller University,"Philip A. Cole, Raymond E. Soccio, Ontario D. Lau, Ehab M. Khalil, Tapas K. Kundu, Robert G. Roeder",1999-11-29,1999-11-29,2002-04-09,2002-04-09,https://patents.google.com/patent/US6369030B1/en
US6379741B1,Plasma-assisted surface modification of polymers for medical device applications ,The Regents Of The University Of California,"Kyriakos Komvopoulos, Catherine M. Klapperich, Lisa A. Pruitt, Stephen L. Kaplan",1998-11-30,1999-11-29,2002-04-30,2002-04-30,https://patents.google.com/patent/US6379741B1/en
US6360021B1,Apparatus and methods of image and signal processing ,The Regents Of The University Of California,"Sean T. McCarthy, William G. Owen",1998-07-30,1999-11-30,2002-03-19,2002-03-19,https://patents.google.com/patent/US6360021B1/en
US6380531B1,Wavelength tunable narrow linewidth resonant cavity light detectors ,The Board Of Trustees Of The Leland Stanford Junior University,"Fred Sugihwo, James S. Harris, Jr.",1998-12-04,1999-11-30,2002-04-30,2002-04-30,https://patents.google.com/patent/US6380531B1/en
US6358922B1,"Positively charged non-natural amino acids, methods of making thereof, and use thereof in peptides ",Medical University Of South Carolina,Thomas A. Dix,1996-10-22,1999-12-01,2002-03-19,2002-03-19,https://patents.google.com/patent/US6358922B1/en
US6337065B1,Method for enhancing protective cellular responses to genotoxic stress in skin ,University Of Kentucky Research Foundation,"Elaine L. Jacobson, Myron K. Jacobson",1998-12-01,1999-12-01,2002-01-08,2002-01-08,https://patents.google.com/patent/US6337065B1/en
US6365385B1,Methods of culturing and encapsulating pancreatic islet cells ,Duke University,Emmanuel C. Opara,1999-03-22,1999-12-01,2002-04-02,2002-04-02,https://patents.google.com/patent/US6365385B1/en
US6380358B1,Guanidinylation reagents ,The Regents Of The University Of California,"Murray Goodman, Konrad Feichtinger, Todd T. Romoff",1997-05-22,1999-12-01,2002-04-30,2002-04-30,https://patents.google.com/patent/US6380358B1/en
US6368827B1,Kinetoplastid protein expression system and methods ,"The University Of Georgia Research Foundation, Inc.","Rick L. Tarleton, Nisha Garg",1998-12-02,1999-12-02,2002-04-09,2002-04-09,https://patents.google.com/patent/US6368827B1/en
US6381391B1,Method and system for generating a broadband spectral continuum and continuous wave-generating system utilizing same ,The Regents Of The University Of Michigan,"Mohammed N. Islam, Ozdal Boyraz, Jaeyoun Kim",1999-02-19,1999-12-03,2002-04-30,2002-04-30,https://patents.google.com/patent/US6381391B1/en
