US6358523B1,Macromolecule-lipid complexes and methods for making and regulating ,The Regents Of The University Of California,"Cyrus R. Safinya, Joachim Oskar Raedler, Ilya Koltover",1996-12-06,1998-06-26,2002-03-19,2002-03-19,https://patents.google.com/patent/US6358523B1/en
US6380627B1,"Low resistance barrier layer for isolating, adhering, and passivating copper metal in semiconductor fabrication ",The Regents Of The University Of California,"Timothy P. Weihs, Troy W. Barbee, Jr.",1998-06-26,1998-06-26,2002-04-30,2002-04-30,https://patents.google.com/patent/US6380627B1/en
US6342196B2,Synthesis of hydrogen peroxide ,University Of Pittsburgh,"Eric J. Beckman, Dan Hâncu",1998-06-29,1998-06-29,2002-01-29,2002-01-29,https://patents.google.com/patent/US6342196B2/en
US6383743B1,Method for serial analysis of gene expression ,The John Hopkins University School Of Medicine,"Kenneth W. Kinzler, Bert Vogelstein, Victor E. Velculescu, Lin Zhang",1995-09-12,1998-06-30,2002-05-07,2002-05-07,https://patents.google.com/patent/US6383743B1/en
US6340497B2,Method for improving performance of highly stressed electrical insulating structures ,The Regents Of The University Of California,"Michael J. Wilson, David A. Goerz",1997-07-02,1998-07-02,2002-01-22,2002-01-22,https://patents.google.com/patent/US6340497B2/en
US6368596B1,Compositions and methods for homoconjugates of antibodies which induce growth arrest or apoptosis of tumor cells ,"Board Of Regents, The University Of Texas System","Maria-Ana Ghetie, Jonathan W. Uhr, Ellen S. Vitetta",1997-07-08,1998-07-08,2002-04-09,2002-04-09,https://patents.google.com/patent/US6368596B1/en
US6337207B1,"Alleles of the human mu opioid receptor, diagnostic methods using said alleles, and methods of treatment based thereon ","The Rockefeller University, The Advanced Research And Technology Institute, Inc.","Mary Jeanne Kreek, Karl Steven LaForge, Lei Yu, Jay A. Tischfield",1998-07-10,1998-07-10,2002-01-08,2002-01-08,https://patents.google.com/patent/US6337207B1/en
US6365164B1,Use of neurotoxin therapy for treatment of urologic and related disorders ,University Technology Corporation,Richard A. Schmidt,1997-07-15,1998-07-15,2002-04-02,2002-04-02,https://patents.google.com/patent/US6365164B1/en
US6361541B1,Surgical instrument for extracting tissue ingrowth from a permeable member of an implanted catheter ,The University Of Iowa Research Foundation,William H. Barnhart,1998-07-17,1998-07-17,2002-03-26,2002-03-26,https://patents.google.com/patent/US6361541B1/en
US6376516B1,"Noscapine and noscapine derivatives, useful as anticancer agents ",Emory University,"Harish C. Joshi, Ye Keqiang, Judith Kapp, Fuqiang Liu",1997-08-19,1998-07-20,2002-04-23,2002-04-23,https://patents.google.com/patent/US6376516B1/en
US6356864B1,Methods for analysis and evaluation of the semantic content of a writing based on vector length ,University Technology Corporation,"Peter William Foltz, Thomas K. Landauer, Darrell Laham II Robert, Walter Kintsch, Robert Ernest Rehder",1997-07-25,1998-07-23,2002-03-12,2002-03-12,https://patents.google.com/patent/US6356864B1/en
US6372932B1,"Porous solid products of 1,3,5-benzenetricarboxylate and metal ions ",University Of Liverpool,"Cameron J Kepert, Matthew J Rosseinsky",1997-07-25,1998-07-24,2002-04-16,2002-04-16,https://patents.google.com/patent/US6372932B1/en
US6375885B1,Methods for coating surfaces with magnetic composites exhibiting distinct flux properties ,The University Of Iowa Research Foundation,"Johna Leddy, Sudath Amarasinghe",1994-08-25,1998-07-27,2002-04-23,2002-04-23,https://patents.google.com/patent/US6375885B1/en
US6365337B1,Genes encoding neuronal voltage-gated calcium channel gamma subunits ,"University Of Iowa Research Foundation, The Jackson Laboratory","Verity A. Letts, Wayne N. Frankel, Kevin P. Campbell, Ricardo Felix, Gloria Biddlecome",1998-07-27,1998-07-27,2002-04-02,2002-04-02,https://patents.google.com/patent/US6365337B1/en
US6383761B2,Methods and compositions for identifying modulators of G-protein-coupled receptors ,"The Regents Of The University Of California, National Institutes Of Health","Bruce R. Conklin, Evi Kostenis, Jürgen Wess",1997-07-28,1998-07-27,2002-05-07,2002-05-07,https://patents.google.com/patent/US6383761B2/en
US6375739B1,Apparatus and process for crystal growth ,University Of Durham,John Tomlinson Mullins,1997-08-22,1998-07-27,2002-04-23,2002-04-23,https://patents.google.com/patent/US6375739B1/en
US6344287B1,High temperature compatible insulation for superconductors and method of applying insulation to superconductors ,Florida State University,"Erdal Celik, Yusuf Hascicek, Ibrahim Mutlu",1997-04-14,1998-07-28,2002-02-05,2002-02-05,https://patents.google.com/patent/US6344287B1/en
US6395960B1,Transgenic mice expressing human presenilin proteins ,"The Hospital For Sick Children, Hsc Research And Development Limited Partnership, The Geverning Council Of The University Of Toronto","Peter H. St. George-Hyslop, Johanna M. Rommens, Paul E. Fraser",1995-04-28,1998-07-29,2002-05-28,2002-05-28,https://patents.google.com/patent/US6395960B1/en
US6346290B1,Combinatorial synthesis of novel materials ,"Symyx Technologies, Inc., The Regents Of The University Of California","Peter G. Schultz, Xiaodong Xiang, Isy Goldwasser",1994-10-18,1998-07-31,2002-02-12,2002-02-12,https://patents.google.com/patent/US6346290B1/en
US6387663B1,Targeting pharmaceutical agents to injured tissues ,University Of Southern California,"Frederick L. Hall, Erlinda M. Gordon, Vaughn A. Starnes, W. French Anderson",1998-07-31,1998-07-31,2002-05-14,2002-05-14,https://patents.google.com/patent/US6387663B1/en
US6343502B1,Apparatus and method for determining the dynamic indentation hardness of materials ,Michigan Technological University,"Ghatu Subhash, Abhijit Chandra, Brian J. Koeppel",1996-10-07,1998-08-03,2002-02-05,2002-02-05,https://patents.google.com/patent/US6343502B1/en
US6357332B1,Process for making metallic/intermetallic composite laminate materian and materials so produced especially for use in lightweight armor ,Thew Regents Of The University Of California,Kenneth Vecchio,1998-08-06,1998-08-06,2002-03-19,2002-03-19,https://patents.google.com/patent/US6357332B1/en
US6340746B1,Prodrugs and conjugates of thiol- and selenol- containing compounds and methods of use thereof ,University Of Utah,"Jeannette C. Roberts, Britta H. Wilmore, Pamela B. Cassidy, Pamela K. Dominick, Megan D. Short",1997-08-07,1998-08-06,2002-01-22,2002-01-22,https://patents.google.com/patent/US6340746B1/en
US6342378B1,Biogasification of solid waste with an anaerobic-phased solids-digester system ,The Regents Of The University Of California,"Ruihong Zhang, Zhiqin Zhang",1998-08-07,1998-08-07,2002-01-29,2002-01-29,https://patents.google.com/patent/US6342378B1/en
US6369183B1,Methods and materials for fabrication of alumoxane polymers ,Wm. Marsh Rice University,"Ronald Lee Cook, Andrew Ross Barron, Kevin Joseph Gleason, David Brent MacQueen, Georgette Laila Siparsky, Yoshihiro Koide, Cullen Taylor Vogelson",1998-08-13,1998-08-13,2002-04-09,2002-04-09,https://patents.google.com/patent/US6369183B1/en
US6346189B1,Carbon nanotube structures made using catalyst islands ,The Board Of Trustees Of The Leland Stanford Junior University,"Hongjie Dai, Calvin F. Quate, Hyongsok Soh, Jing Kong",1998-08-14,1998-08-14,2002-02-12,2002-02-12,https://patents.google.com/patent/US6346189B1/en
US6352777B1,Organic photosensitive optoelectronic devices with transparent electrodes ,The Trustees Of Princeton University,"Vladimir Bulovic, Stephen R. Forrest",1998-08-19,1998-08-19,2002-03-05,2002-03-05,https://patents.google.com/patent/US6352777B1/en
US6359885B1,Multi-channel packet switching apparatus having traffic flow controlling and checking functions ,"Electronics And Telecommunications Research Institute, Washington University","Keun Bae Kim, Paul S. Min, Kyeong-Soo Kim, Otto Schmid",1997-08-27,1998-08-21,2002-03-19,2002-03-19,https://patents.google.com/patent/US6359885B1/en
US6366382B1,Optical decision circuit and use thereof ,"Imec, University Of Gent","Geert Morthier, Roel Baets",1997-08-27,1998-08-27,2002-04-02,2002-04-02,https://patents.google.com/patent/US6366382B1/en
US6375761B1,Magnetoresistive material with two metallic magnetic phases ,The Research Foundation Of State University Of New York,"Richard J. Gambino, Taewan Kim",1998-08-28,1998-08-28,2002-04-23,2002-04-23,https://patents.google.com/patent/US6375761B1/en
US6387234B1,Integrated multiplexed capillary electrophoresis system ,"Iowa State University Research Foundation, Inc.","Edward S. Yeung, Hongdong Tan",1998-08-31,1998-08-31,2002-05-14,2002-05-14,https://patents.google.com/patent/US6387234B1/en
US6370584B1,Distributed routing ,Trustees Of Boston University,"Azer Bestavros, Mark E. Crovella",1998-01-13,1998-09-01,2002-04-09,2002-04-09,https://patents.google.com/patent/US6370584B1/en
US6395562B1,Diagnostic microarray apparatus ,The Regents Of The University Of California,"Bruce D. Hammock, Horacio Kido, Angel Maquieira",1998-04-22,1998-09-04,2002-05-28,2002-05-28,https://patents.google.com/patent/US6395562B1/en
US6340722B1,"Polymerization, compatibilized blending, and particle size control of powder coatings in a supercritical fluid ",The University Of Akron,"Sunggyu Lee, H. Bryan Lanterman, Paul Pettit, Jr., Kathy L. Fullerton",1998-09-04,1998-09-04,2002-01-22,2002-01-22,https://patents.google.com/patent/US6340722B1/en
US6369118B1,Biocompatible emulsifier ,University Of Pittsburgh,Toby J. Chapman,1998-09-09,1998-09-09,2002-04-09,2002-04-09,https://patents.google.com/patent/US6369118B1/en
US6345536B1,Multiple-phase flow meter ,The Texas A&M University System,"Gerald L. Morrison, James C. Holste, Kenneth R. Hall",1998-09-10,1998-09-10,2002-02-12,2002-02-12,https://patents.google.com/patent/US6345536B1/en
US6358737B1,Osteocyte cell lines ,"Board Of Regents, The University Of Texas System","Lynda F Bonewald, Yoichi Kato",1996-07-31,1998-09-11,2002-03-19,2002-03-19,https://patents.google.com/patent/US6358737B1/en
US6339010B2,Semiconductor element forming process having a step of separating film structure from substrate ,President Of Tokyo University Of Agriculture & Technology,Toshiyuki Sameshima,1997-09-16,1998-09-14,2002-01-15,2002-01-15,https://patents.google.com/patent/US6339010B2/en
US6371917B1,Ultrasound bubble recognition imaging ,University Of Virginia Patent Foundation,"Katherine W. Ferrara, Karen Elizabeth Morgan, Paul Dayton",1997-10-03,1998-09-17,2002-04-16,2002-04-16,https://patents.google.com/patent/US6371917B1/en
US6390382B1,Rail fixings ,"Corus Uk Limited, University Of Southampton","William Hodgson, John Barry Clarke, David Farrington, David John Thompson, Christopher John Cedric Jones",1997-09-19,1998-09-18,2002-05-21,2002-05-21,https://patents.google.com/patent/US6390382B1/en
US6395305B1,Reduction of sperm sensitivity to chilling ,University Of Guelph,"Mary Buhr, Liwei He",1997-09-22,1998-09-22,2002-05-28,2002-05-28,https://patents.google.com/patent/US6395305B1/en
US6391314B1,Porcine circoviruses vaccines diagnostic reagents ,"Merial, The Queen's University Of Belfast, University Of Saskatchewan","Gordon Allan, Brian Meehan, Edward Clark, John Ellis, Deborah Haines, Lori Hassard, John Harding, Catherine Elisabeth Charreyre, Gilles Emile Chappuis, Francis McNeilly",1997-10-03,1998-09-25,2002-05-21,2002-05-21,https://patents.google.com/patent/US6391314B1/en
US6365007B1,Photocatalysts for the degradation of organic pollutants ,Yissum Research Development Company Of The Hebrew University Of Jerusalem,"Itamar Willner, Koodali Ranjit",1997-10-01,1998-09-28,2002-04-02,2002-04-02,https://patents.google.com/patent/US6365007B1/en
US6359928B1,System and method for compressing images using multi-threshold wavelet coding ,University Of Southern California,"Houng-Jyh Mike Wang, Yiliang Bao, Chung-Chieh Kuo, Homer H. Chen",1997-09-29,1998-09-28,2002-03-19,2002-03-19,https://patents.google.com/patent/US6359928B1/en
US6379664B1,Composition and method for the prevention and treatment of oxidative damage in ocular tissues ,Board Of Regents University Of Nebraska-Lincoln,"Marjorie F. Lou, Nalini Raghavachari, Fengyu Qiao",1998-09-29,1998-09-29,2002-04-30,2002-04-30,https://patents.google.com/patent/US6379664B1/en
US6387656B1,Gene encoding MNR2 and uses thereof ,The Trustees Of Columbia University In The City Of New York,"Thomas M. Jessell, Yasuto Tanabe, Christopher William",1998-09-29,1998-09-29,2002-05-14,2002-05-14,https://patents.google.com/patent/US6387656B1/en
US6375880B1,Mold shape deposition manufacturing ,The Board Of Trustees Of The Leland Stanford Junior University,"Alexander G. Cooper, John W. Kietzman, Friedrich B. Prinz",1997-09-30,1998-09-30,2002-04-23,2002-04-23,https://patents.google.com/patent/US6375880B1/en
US6359013B1,Styryl sulfone anticancer agents ,Temple University-Of The Commonwealth System Of Higher Education,"E. Premkumar Reddy, M. V. Ramana Reddy",1997-10-03,1998-10-01,2002-03-19,2002-03-19,https://patents.google.com/patent/US6359013B1/en
US6348641B1,"Purified proteins, recombinant DNA sequences and processes for producing caffeine-free beverages ",University Of Hawaii,"John I. Stiles, Istefo Moisyadi, Kabi Raj Neupane",1996-03-26,1998-10-02,2002-02-19,2002-02-19,https://patents.google.com/patent/US6348641B1/en
US6358536B1,"Nitric oxide donor compositions, methods, apparatus, and kits for preventing or alleviating vasoconstriction or vasospasm in a mammal ",Thomas Jefferson University,Jeffrey E. Thomas,1997-10-15,1998-10-02,2002-03-19,2002-03-19,https://patents.google.com/patent/US6358536B1/en
US6396270B1,Quantitation and standardization of magnetic resonance measurements ,University Of Washington,Justin P. Smith,1992-05-15,1998-10-05,2002-05-28,2002-05-28,https://patents.google.com/patent/US6396270B1/en
US6353814B1,Developmental learning machine and method ,Michigan State University,Juyang Weng,1997-10-08,1998-10-07,2002-03-05,2002-03-05,https://patents.google.com/patent/US6353814B1/en
US6376471B1,Gene delivery compositions and methods ,Johns Hopkins University,"John H. Lawrence, III, J. Kevin Donahue",1997-10-10,1998-10-08,2002-04-23,2002-04-23,https://patents.google.com/patent/US6376471B1/en
US6375990B1,Method and devices for transdermal delivery of lithium ,Emory University,"Charles B. Nemeroff, Clinton D. Kilts",1997-10-09,1998-10-09,2002-04-23,2002-04-23,https://patents.google.com/patent/US6375990B1/en
US6364907B1,Method to prevent xenograft transplant rejection ,"Qlt Inc., The University Of British Columbia","Modestus O. K. Obochi, Philippe Maria Clotaire Margaron, Christopher Richard Honey, Stephen Yip, Julia G. Levy",1998-10-09,1998-10-09,2002-04-02,2002-04-02,https://patents.google.com/patent/US6364907B1/en
US6391862B1,Chiral resolving agents for enantioseparations ,The Texas A&M University System,Gyula Vigh,1997-10-14,1998-10-14,2002-05-21,2002-05-21,https://patents.google.com/patent/US6391862B1/en
US6363173B1,Incremental recognition of a three dimensional object ,Carnegie Mellon University,"Anthony Stentz, Keith Lay",1997-12-19,1998-10-14,2002-03-26,2002-03-26,https://patents.google.com/patent/US6363173B1/en
US6361775B1,Compositions and methods for vaccines comprising α-galactosyl epitopes ,"Medical College Of Pennsylvania, Hahnemann University","Uri Galili, Patricia M. Repik",1994-03-15,1998-10-15,2002-03-26,2002-03-26,https://patents.google.com/patent/US6361775B1/en
US6365698B1,Grafted polysilanes useful as photoinitiators and process for preparing same ,"Three Bond Co., Ltd., University Of Cincinnati","Barry Goldslager, Stephen J. Clarson",1998-10-16,1998-10-16,2002-04-02,2002-04-02,https://patents.google.com/patent/US6365698B1/en
US6337472B1,Light imaging microscope having spatially resolved images ,The University Of Texas System Board Of Regents,"Harold R. Garner, Roger A. Schultz",1998-10-19,1998-10-19,2002-01-08,2002-01-08,https://patents.google.com/patent/US6337472B1/en
US6372900B1,Horse endothelin-B receptor gene and gene products ,The Regents Of The University Of California,"Danika Metallinos, Jasper Rine, Ann Bowling",1997-10-21,1998-10-20,2002-04-16,2002-04-16,https://patents.google.com/patent/US6372900B1/en
USPP12350P2,Raspberry plant named ‘Emily’ ,"University Of Maryland, Virginia Tech Intellectual Properties, Inc., University Of Wisconsin At River Falls","Harry Jan Swartz, Joseph A. Fiola, Herbert D. Stiles, Brian R. Smith",1998-10-22,1998-10-22,2002-01-15,2002-01-15,https://patents.google.com/patent/USPP12350P2/en
US6346240B1,Methods of treating animal waste slurries ,"The United States Of America As Represented By The Secretary Of Agriculture, The Board Of Trustees Of The University Of Arkansas","Philip A. Moore, Jr.",1998-10-22,1998-10-22,2002-02-12,2002-02-12,https://patents.google.com/patent/US6346240B1/en
US6365416B1,Method of preparing delta-9-tetrahydrocannabinol ,The University Of Mississippi,"Mahmoud A. Elsohly, Samir A. Ross",1998-10-26,1998-10-26,2002-04-02,2002-04-02,https://patents.google.com/patent/US6365416B1/en
US6391564B1,Methods and compositions utilizing Rad51 ,Yale University,"Thomas Haaf, Efim Ilya Golub, Gurucharan Reddy, Charles Meyer Radding, David C. Ward",1997-01-30,1998-10-27,2002-05-21,2002-05-21,https://patents.google.com/patent/US6391564B1/en
US6341183B1,Graphical user interface for image acquisition and processing ,The Regents Of The University Of California,Kenneth A. Goldberg,1998-10-27,1998-10-27,2002-01-22,2002-01-22,https://patents.google.com/patent/US6341183B1/en
US6384012B1,Use of isolated domains of type IV collagen to modify cell and tissue interactions ,University Of Kansas Medical Center,"Michael P. Sarras, Jr., Billy G. Hudson",1994-06-30,1998-10-30,2002-05-07,2002-05-07,https://patents.google.com/patent/US6384012B1/en
US6358681B2,Diagnostic methods for alzheimer's disease by detection of multiple mRNAs ,The Trustees Of The University Of Pennsylvania,"Stephen Ginsberg, John Q. Trojanowski, Virginia M.-Y. Lee, James Eberwine",1998-10-30,1998-10-30,2002-03-19,2002-03-19,https://patents.google.com/patent/US6358681B2/en
US6382208B2,System for controlling the internal temperature of a respirator ,Board Of Regents University Of Nebraska,"Mark G. Reedy, Kevin L. Barton",1998-11-02,1998-11-02,2002-05-07,2002-05-07,https://patents.google.com/patent/US6382208B2/en
US6354297B1,Method and device for destroying fat cells by induction of programmed cell death ,The Uniformed Services University Of The Health Sciences,Ben Eiseman,1998-04-16,1998-11-02,2002-03-12,2002-03-12,https://patents.google.com/patent/US6354297B1/en
US6391574B1,AFC1 and RCE1: isoprenylated CAAX processing enzymes ,The Regents Of The University Of California,"Jasper D. Rine, Victor L. Boyartchuk, Matthew N. Ashby",1996-08-07,1998-11-03,2002-05-21,2002-05-21,https://patents.google.com/patent/US6391574B1/en
US6370144B1,Methods and apparatus for shaping queued packets using a two-dimensional RAM-based search engine ,Polytechnic University,"Hung-Hsiang Jonathan Chao, Yau-Ren Jenq",1997-11-05,1998-11-04,2002-04-09,2002-04-09,https://patents.google.com/patent/US6370144B1/en
US6389031B1,Methods and apparatus for fairly scheduling queued packets using a ram-based search engine ,Polytechnic University,"Hung-Hsiang Jonathan Chao, Yau-Ren Jenq",1997-11-05,1998-11-04,2002-05-14,2002-05-14,https://patents.google.com/patent/US6389031B1/en
US6388173B2,Scarecrow promotor and uses thereof ,New York University,"Philip N. Benfey, Laura Di Laurenzio, Joanna Wysocka-Diller, Jocelyn E. Malamy, Leonard Pysh, Yrjo Helariutta",1996-04-26,1998-11-05,2002-05-14,2002-05-14,https://patents.google.com/patent/US6388173B2/en
US6369194B1,Vicinyl tricarbonyl compounds and combinatorial libraries containing same ,Yale University,Harry H. Wasserman,1998-11-09,1998-11-09,2002-04-09,2002-04-09,https://patents.google.com/patent/US6369194B1/en
US6390996B1,CPR chest compression monitor ,The Johns Hopkins University,"Henry R. Halperin, Ronald D. Berger",1998-11-09,1998-11-09,2002-05-21,2002-05-21,https://patents.google.com/patent/US6390996B1/en
US6381349B1,Projector/backprojector with slice-to-slice blurring for efficient 3D scatter modeling ,The University Of Utah,"Gengsheng Lawrence Zeng, Chuanyong Bai, Grant T. Gullberg",1997-11-12,1998-11-10,2002-04-30,2002-04-30,https://patents.google.com/patent/US6381349B1/en
US6340569B1,Monoclonal antibody and antigens specific therefor and methods of using same ,University Of Pittsburgh,"Edward D. Ball, Rui-Kun Zhong",1997-11-12,1998-11-12,2002-01-22,2002-01-22,https://patents.google.com/patent/US6340569B1/en
US6365365B1,Method of determining whether an agent modulates glycosyl sulfotransferase-3 ,The Regents Of The University Of California,"Annette Bistrup, Steven D. Rosen, Kirsten Tangemann, Stefan Hemmerich",1998-03-20,1998-11-12,2002-04-02,2002-04-02,https://patents.google.com/patent/US6365365B1/en
US6346689B1,Cell and method for forming a composite hard material and composite hard materials formed thereby ,The Australian National University,"Paul Edwin Willis, Alan Major, Donald Lindsay Clark",1997-11-14,1998-11-12,2002-02-12,2002-02-12,https://patents.google.com/patent/US6346689B1/en
US6355244B1,Methods and compositions for the treatment of psoriasis ,University Of Kentucky Research Foundation,"Kenneth A. Foon, Malaya Chatterjee",1997-11-17,1998-11-16,2002-03-12,2002-03-12,https://patents.google.com/patent/US6355244B1/en
US6391300B1,Method for inhibiting thrombosis in a patient whose blood is subjected to extracorporeal circulation ,The Trustees Of Columbia University In The City Of New York,"Eric Rose, David Stern, Ann Marie Schmidt, Talia Spanier",1996-05-16,1998-11-16,2002-05-21,2002-05-21,https://patents.google.com/patent/US6391300B1/en
US6342384B1,Production of adenoviral vectors using serum-free suspension cell culture in a hollow fiber system ,The University Of Va Patent Foundation,"Leland W. K. Chung, Thomas A. Gardner, Chinghai Kao, Song-Chu Ko",1998-08-21,1998-11-17,2002-01-29,2002-01-29,https://patents.google.com/patent/US6342384B1/en
US6388168B1,DNA constructs and methods for stably transforming plastids of multicellular plants and expressing recombinant proteins therein ,"Rutgers, The State University Of New Jersey","Pal Maliga, Zora Svab Maliga, Jeffrey M. Staub",1990-05-01,1998-11-18,2002-05-14,2002-05-14,https://patents.google.com/patent/US6388168B1/en
US6375673B1,Heat transfer blanket for and method of controlling a patient's temperature ,The Board Of Regents Of The University Of Texas System,"Guy L. Clifton, Emmy R. Miller",1998-04-23,1998-11-20,2002-04-23,2002-04-23,https://patents.google.com/patent/US6375673B1/en
US6377812B1,Combined power control and space-time diversity in mobile cellular communications ,University Of Maryland,"Farrokh Rashid-Farrokhi, K. J. Ray Liu, Leandros Tassiulas",1997-11-20,1998-11-20,2002-04-23,2002-04-23,https://patents.google.com/patent/US6377812B1/en
US6372353B2,Coated surface comprising a polyvinyl alcohol (PVA) based covalently bonded stable hydrophilic coating ,Northeastern University,"Barry L. Karger, Wolfgang Goetzinger",1995-01-27,1998-11-23,2002-04-16,2002-04-16,https://patents.google.com/patent/US6372353B2/en
US6346280B1,Composition and methods for inhibiting the formation of brain amyloid deposits ,University Of Washington,"Gerardo Castillo, Alan D. Snow",1997-05-15,1998-11-24,2002-02-12,2002-02-12,https://patents.google.com/patent/US6346280B1/en
US6384414B1,Method and apparatus for detecting the presence of an object ,"Board Of Regents, The University Of Texas System","David L. Fisher, Robert L. Rogers",1997-11-25,1998-11-25,2002-05-07,2002-05-07,https://patents.google.com/patent/US6384414B1/en
US6389377B1,Methods and apparatus for acoustic transient processing ,The Johns Hopkins University,"Fernando J. Pineda, Gert Cauwenberghs, R. Timothy Edwards",1997-12-01,1998-12-01,2002-05-14,2002-05-14,https://patents.google.com/patent/US6389377B1/en
US6381346B1,Three-dimensional face identification system ,Wheeling Jesuit University,Arsev H. Eraslan,1997-12-01,1998-12-01,2002-04-30,2002-04-30,https://patents.google.com/patent/US6381346B1/en
US6351740B1,Method and system for training dynamic nonlinear adaptive filters which have embedded memory ,The Board Of Trustees Of The Leland Stanford Junior University,Matthew Rabinowitz,1997-12-01,1998-12-01,2002-02-26,2002-02-26,https://patents.google.com/patent/US6351740B1/en
US6387544B1,OLEDS containing thermally stable glassy organic hole transporting materials ,"The Trustees Of Princeton University, The University Of Southern California","Mark E. Thompson, Loy Douglas, Stephen R. Forrest, Bryan E. Koene, Diarmuid O'Brien",1998-04-10,1998-12-02,2002-05-14,2002-05-14,https://patents.google.com/patent/US6387544B1/en
US6355255B1,Streptococcal C5a peptidase vaccine ,Regents Of The University Of Minnesota,"Paul Patrick Cleary, Deborah K. Stafslien",1998-12-07,1998-12-07,2002-03-12,2002-03-12,https://patents.google.com/patent/US6355255B1/en
US6340598B1,Apparatus for multichannel fluorescent immunoassays ,University Of Utah Research Foundation,"James N. Herron, Douglas A. Christensen, Karin D. Caldwell, Vera Janatová, Shao-Chie Huang, Hsu-Kun Wang",1993-05-18,1998-12-08,2002-01-22,2002-01-22,https://patents.google.com/patent/US6340598B1/en
US6352703B1,Compositions and methods for detecting and killing termites ,Board Of Supervisors Of Louisiana State University And Agricultural And Mechanical College,"Gregg Henderson, Jian Chen, Roger A. Laine",1997-12-11,1998-12-08,2002-03-05,2002-03-05,https://patents.google.com/patent/US6352703B1/en
US6340591B1,Integrative protein-DNA cochleate formulations and methods for transforming cells ,"University Of Maryland, University Of Medicine And Dentistry Of New Jersey","David Margolis, Susan Gould-Fogerite, Raphael James Mannino",1998-12-14,1998-12-14,2002-01-22,2002-01-22,https://patents.google.com/patent/US6340591B1/en
