search URL:,https://patents.google.com/?assignee=university&country=US&language=ENGLISH&before=publication:20020601&after=publication:20020101&status=GRANT&type=PATENT&sort=old
id,title,assignee,inventor/author,priority date,filing/creation date,publication date,grant date,result link
US6384191B1,Receptors for fibroblast growth factors ,Regents Of The University Of California,"Lewis T. Williams, Daniel E. Johnson, Pauline E Lee",1989-07-06,1990-07-06,2002-05-07,2002-05-07,https://patents.google.com/patent/US6384191B1/en
US6391590B1,Recombinant streptavidin-metallothionein chimeric protein having biological recognition specificity ,The Regents Of The University Of California,"Takeshi Sano, Alexander N. Glazer, Charles R. Cantor",1991-10-21,1991-10-21,2002-05-21,2002-05-21,https://patents.google.com/patent/US6391590B1/en
US6362160B1,Immunophilin-binding agents prevent glutamate neurotoxicity associated with vascular stroke and neurodegenerative diseases ,The Johns Hopkins University School Of Medicine,"Ted M. Dawson, Joseph P. Steiner, Valina L. Dawson, George R. Uhl, Solomon H. Snyder",1993-06-30,1993-06-30,2002-03-26,2002-03-26,https://patents.google.com/patent/US6362160B1/en
US6362175B1,Porphyrin compounds for imaging tissue oxygen ,The Trustees Of The University Of Pennsylvania,"Sergei Vinogradov, David F. Wilson",1991-09-20,1993-10-15,2002-03-26,2002-03-26,https://patents.google.com/patent/US6362175B1/en
US6387379B1,"Biofunctional surface modified ocular implants, surgical instruments, medical devices, prostheses, contact lenses and the like ",University Of Florida,"Eugene P. Goldberg, Ali Yahiaoui, Khalid Mentak, Theresa Rivero Erickson, James Seeger",1987-04-10,1994-02-28,2002-05-14,2002-05-14,https://patents.google.com/patent/US6387379B1/en
US6348213B1,Method for reversing age-related changes in heart muscle cells ,"Yissum Research And Development Co. Of The Hebrew University Of Jerusalem, Hadassah Medical Organization","Yechezkel Barenholz, Elishalom Yechiel",1986-02-24,1994-05-03,2002-02-19,2002-02-19,https://patents.google.com/patent/US6348213B1/en
US6355626B1,Antithrombin agents in treatment of asthma ,The Trustees Of The University Of Pennsylvania,"Reynold Panettieri, Richard Murray",1994-05-13,1994-05-13,2002-03-12,2002-03-12,https://patents.google.com/patent/US6355626B1/en
US6365787B1,Compounds for the suppression of HIV TAT transactivation ,The Johns Hopkins University,"Ru Chih C. Huang, John N. Gnabre",1994-09-30,1994-09-30,2002-04-02,2002-04-02,https://patents.google.com/patent/US6365787B1/en
US6387884B1,Leukocyte homing modulation ,"Stanford University, John L. Magnani","John L. Magnani, Eugene C. Butcher, Ellen L. Berg",1990-06-18,1994-11-09,2002-05-14,2002-05-14,https://patents.google.com/patent/US6387884B1/en
US6391857B1,Methods and compositions for endothelial binding ,"Stanford University, John L. Magnani","John L. Magnani, Eugene C. Butcher, Ellen L. Berg",1990-06-18,1994-11-09,2002-05-21,2002-05-21,https://patents.google.com/patent/US6391857B1/en
US6372502B1,Retroviral packaging cell lines and processes of using same ,The Trustees Of Columbia University In The City Of New York,"Arthur Bank, Dina G. Markowitz, Stephen P. Goff",1988-02-05,1994-11-17,2002-04-16,2002-04-16,https://patents.google.com/patent/US6372502B1/en
US6348449B1,Methods of inducing mucosal immunity ,The Trustees Of The University Of Pennsylvania,"David B. Weiner, Bin Wang, Kenneth E. Ugen",1993-09-21,1994-12-16,2002-02-19,2002-02-19,https://patents.google.com/patent/US6348449B1/en
US6372218B1,Interferon dosage form and method therefor ,The Texas A&M University System,Joseph M. Cummins,1986-11-06,1995-01-31,2002-04-16,2002-04-16,https://patents.google.com/patent/US6372218B1/en
US6352694B1,Methods for inducing a population of T cells to proliferate using agents which recognize TCR/CD3 and ligands which stimulate an accessory molecule on the surface of the T cells ,"Genetics Institute, Inc., The Regents Of The University Of Michigan","Carl H. June, Craig B. Thompson, Gary J. Nabel, Gary S. Gray, Paul D. Rennert",1994-06-03,1995-03-10,2002-03-05,2002-03-05,https://patents.google.com/patent/US6352694B1/en
US6374670B1,Non-invasive gut motility monitor ,University Of Washington,"Francis A. Spelman, Page Read, N. Mani Prakash, James A. Nelson, Charles E. Pope, Margaret Heitkemper, James D. Rothermel",1995-03-13,1995-03-13,2002-04-23,2002-04-23,https://patents.google.com/patent/US6374670B1/en
US6375690B1,Process for forming coal compacts and product thereof ,The Curators Of The University Of Missouri,"Brett Gunnink, Jayanth Kanunar, Zhuoxiong Liang",1995-03-17,1995-03-17,2002-04-23,2002-04-23,https://patents.google.com/patent/US6375690B1/en
US6388366B1,Carbon nitride cold cathode ,Wayne State University,Roger W. Pryor,1995-05-08,1995-05-08,2002-05-14,2002-05-14,https://patents.google.com/patent/US6388366B1/en
US6375951B1,Therapeutic suppression of specific immune response by administration of oligomeric forms of antigen of controlled chemistry ,Johns Hopkins University,"Howard M. Dintzis, Renée Z. Dintzis, James K. Blodgett, John C. Cheronis, Gary Kirschenheuter",1983-01-24,1995-05-12,2002-04-23,2002-04-23,https://patents.google.com/patent/US6375951B1/en
US6359871B1,Cellular communications network ,Curtin University Of Technology,"Kah-Seng Chung, Richard Beaumont Seale, David Antony Barker",1994-05-27,1995-05-29,2002-03-19,2002-03-19,https://patents.google.com/patent/US6359871B1/en
US6372438B1,Human platelet-derived growth factor receptors ,The Regents Of The University Of California,"Lewis Thomas Williams, Jaime A. Escobedo",1988-02-02,1995-06-05,2002-04-16,2002-04-16,https://patents.google.com/patent/US6372438B1/en
US6395475B1,Semiautomated method for finger-printing bacterial DNA ,Florida State University,"Carol G. Leggett, Ellyn Whitehouse, Robert H. Reeves",1993-05-18,1995-06-05,2002-05-28,2002-05-28,https://patents.google.com/patent/US6395475B1/en
US6383487B1,Methods of treatment using CD25 binding molecules ,"Novartis Ag, University College London","Peter Lloyd Amlot, Arne Nalpon Akbar, Günther Heinrich, Salvatore Cammisuli",1990-03-16,1995-06-06,2002-05-07,2002-05-07,https://patents.google.com/patent/US6383487B1/en
US6346627B1,"Intermediates in the synthesis of 1,3-oxathiolane nucleoside enantiomers ",Emory University,"Dennis C. Liotta, Raymond F. Schinazi, Woo-Baeg Choi",1990-02-01,1995-06-07,2002-02-12,2002-02-12,https://patents.google.com/patent/US6346627B1/en
US6370812B1,"Methods, systems and baits for detecting and controlling termites ","Dowelanco, University Of Florida Research Foundation, Inc.","Kevin Burns, Ellen M. Thoms, Nan-Yao Su",1992-06-01,1995-06-07,2002-04-16,2002-04-16,https://patents.google.com/patent/US6370812B1/en
US6350730B1,OB polypeptides and modified forms as modulators of body weight ,The Rockefeller University,"Jeffrey M. Friedman, Yiying Zhang, Ricardo Proenca",1994-08-17,1995-06-07,2002-02-26,2002-02-26,https://patents.google.com/patent/US6350730B1/en
US6344315B1,Chromosome-specific staining to detect genetic rearrangements associated with chromosome 3 and/or chromosome 17 ,The Regents Of The University Of California,"Joe W. Gray, Daniel Pinkel, Olli-Pekka Kallioniemi, Anne Kallioniemi, Masaru Sakamoto",1986-01-16,1995-06-07,2002-02-05,2002-02-05,https://patents.google.com/patent/US6344315B1/en
US6371199B1,Nucleate boiling surfaces for cooling and gas generation ,The Trustees Of The University Of Pennsylvania,Benjamin Gebhart,1988-02-24,1995-06-07,2002-04-16,2002-04-16,https://patents.google.com/patent/US6371199B1/en
US6339143B1,Methods of using antibodies against hormone-related determinants ,The Trustees Of Columbia University In The City Of New York,"Alexander Krichevsky, Steven Birken, John O'Connor, Robert E. Canfield",1993-05-13,1995-06-07,2002-01-15,2002-01-15,https://patents.google.com/patent/US6339143B1/en
US6391651B1,Materials and methods for detection of insulin dependent diabetes ,"The United States Of America As Represented By The Secretary Of The Department Of Health & Human Services, University Of Florida","Noel K. Maclaren, Abner L. Notkins, Michael S. Lan",1995-08-11,1995-08-11,2002-05-21,2002-05-21,https://patents.google.com/patent/US6391651B1/en
US6361770B1,Method of enhancing expression of MHC class I molecules bearing endogenous peptides ,University Of British Columbia,"Wilfred A. Jefferies, Reinhard Gabathuler, Gregor S. D. Reid, Gerassimos Kolaitis",1994-09-23,1995-09-22,2002-03-26,2002-03-26,https://patents.google.com/patent/US6361770B1/en
US6340403B1,Solar cell module lamination process ,The Regents Of The University Of California,"Paul G. Carey, Jesse B. Thompson, Randy C. Aceves",1994-04-20,1995-10-04,2002-01-22,2002-01-22,https://patents.google.com/patent/US6340403B1/en
US6395964B1,Oral immunization with transgenic plants ,"The Texas A&M University System, The Administrators Of The Tulane Fund","Charles J. Arntzen, Hugh S. Mason, Haq A. Tariq, John D. Clements",1995-10-24,1995-10-24,2002-05-28,2002-05-28,https://patents.google.com/patent/US6395964B1/en
US6361791B1,Stable aqueous dispersions including cationic lipids ,The University Of Tennessee Research Corporation,"Leaf Huang, Richard M. Epand, Remo Bottega",1991-08-28,1995-12-28,2002-03-26,2002-03-26,https://patents.google.com/patent/US6361791B1/en
US6344489B1,Stabilized gas-enriched and gas-supersaturated liquids ,Wayne State University,J. Richard Spears,1991-02-14,1996-01-03,2002-02-05,2002-02-05,https://patents.google.com/patent/US6344489B1/en
US6365344B1,Methods for screening for transdominant effector peptides and RNA molecules ,"The Board Of Trustees Of The Leland Stanford Junior University, Rigel Pharmaceuticals, Inc.","Garry P. Nolan, S. Michael Rothenberg",1996-01-23,1996-01-23,2002-04-02,2002-04-02,https://patents.google.com/patent/US6365344B1/en
US6339065B1,Episomal expression vector for human gene therapy ,Case Western Reserve University,Mark J. Cooper,1993-11-12,1996-01-30,2002-01-15,2002-01-15,https://patents.google.com/patent/US6339065B1/en
US6391579B1,Thyroid sodium/iodide symporter and nucleic acid encoding same ,Albert Einstein College Of Medicine Of Yeshiva University,"Nancy Carrasco, Ge Dai, Orlie Levy",1996-02-01,1996-02-01,2002-05-21,2002-05-21,https://patents.google.com/patent/US6391579B1/en
US6342492B1,Anti-viral triaza compounds and compositions ,The Research Foundation Of State University Of New York,Thomas W. Bell,1995-02-17,1996-02-16,2002-01-29,2002-01-29,https://patents.google.com/patent/US6342492B1/en
US6337159B1,Lithium anode with solid electrolyte interface ,Ramot University Authority For Applied Research & Industrial Development Ltd.,"Emanuel Peled, Avi Melman, Chen Menachem, Yitzhak Lavi, Dany Bar-Tov",1995-03-07,1996-03-06,2002-01-08,2002-01-08,https://patents.google.com/patent/US6337159B1/en
US6372206B1,Orally-administered interferon-TAU compositions and methods ,University Of Florida,"Jeanne M. Soos, Joel Schiffenbauer, Howard Marcellus Johnson",1989-03-02,1996-03-15,2002-04-16,2002-04-16,https://patents.google.com/patent/US6372206B1/en
US6376205B1,Screening methods for agents that modulate or inhibit tau association with tau or map2 ,University Court Of The University Of Aberdeen,"Claude Michel Wischik, Patricia Carol Edwards, Charles Robert Harrington, Martin Roth, Aaron Klug",1995-03-27,1996-03-25,2002-04-23,2002-04-23,https://patents.google.com/patent/US6376205B1/en
US6355146B1,Sputtering process and apparatus for coating powders ,The Regents Of The University Of California,"Daniel M. Makowiecki, John A. Kerns, Craig S. Alford, Mark A. McKernan",1996-04-03,1996-04-03,2002-03-12,2002-03-12,https://patents.google.com/patent/US6355146B1/en
US6379714B1,Pharmaceutical grade botanical drugs ,"Pharmaprint, Inc., University Of Southern California","Tasneem A. Khwaja, Elliot P. Friedman",1995-04-14,1996-04-15,2002-04-30,2002-04-30,https://patents.google.com/patent/US6379714B1/en
US6340459B1,Therapeutic applications for the anti-T-BAM (CD40-L) monoclonal antibody 5C8 in the treatment of reperfusion injury in non-transplant recipients ,The Trustees Of Columbia University In The City Of New York,"Michael J. Yellin, Seth Lederman, Leonard Chess",1995-12-01,1996-04-22,2002-01-22,2002-01-22,https://patents.google.com/patent/US6340459B1/en
US6348353B1,Artificial mammalian chromosome ,Case Western Reserve University,"John J. Harrington, Gil B. Van Bokkelen, Huntington F. Willard",1995-06-07,1996-05-06,2002-02-19,2002-02-19,https://patents.google.com/patent/US6348353B1/en
US6381286B1,Cartesian loop transmitter ,University Of Bristol,"Ross J. Wilkinson, Peter B. Kenington, Joseph P. McGeehan, Mark A. Beach, Andrew Bateman",1995-05-22,1996-05-22,2002-04-30,2002-04-30,https://patents.google.com/patent/US6381286B1/en
US6337194B1,Method for the preparation of insulin by cleavage of a fusion protein and fusion proteins containing insulin A and B chains ,"Vittal Mallya Scientific Research Foundation, The University Of Leicester","Christopher Hadfield, Peter A Meacock, Patnam R Krishnaswamy, Kaithamana Shashi, Krisha K Raina, Candadai S Ramadoss",1995-07-08,1996-07-08,2002-01-08,2002-01-08,https://patents.google.com/patent/US6337194B1/en
US6383763B1,Detection of mycobacteria ,Case Western Reserve University,Robert S. Wallis,1996-07-26,1996-07-26,2002-05-07,2002-05-07,https://patents.google.com/patent/US6383763B1/en
US6365160B1,Papillomavirus polyprotein constructs ,"Csl Limited, The University Of Queensland","Elizabeth Ann Webb, Mary Brigid Margetts, John Cooper Cox, Ian Frazer, Nigel Alan John McMillan, Mark Philip Williams, Margaret Bridget Holland Moloney, Stirling John Edwards",1995-07-27,1996-07-26,2002-04-02,2002-04-02,https://patents.google.com/patent/US6365160B1/en
US6358631B1,Mixed vapor deposited films for electroluminescent devices ,The Trustees Of Princeton University,"Stephen Ross Forrest, Mark Edward Thompson, Paul Edward Burrows, Dennis Matthew McCarty, Linda Susan Sapochak, Jon Andrew Cronin",1994-12-13,1996-08-06,2002-03-19,2002-03-19,https://patents.google.com/patent/US6358631B1/en
US6368816B2,Regulation of intracellular glucocorticoid concentrations ,The University Of Edinburgh,"Brian Robert Walker, Christopher Richard Watkin Edwards, Jonathan Robert Seckl",1995-08-29,1996-08-28,2002-04-09,2002-04-09,https://patents.google.com/patent/US6368816B2/en
US6379961B1,Uses of bone morphogenetic proteins ,The Trustees Of Columbia University In The City Of New York,"Thomas M. Jessell, Karel F. Liem, Jr., Gabi Tremml",1995-09-21,1996-09-20,2002-04-30,2002-04-30,https://patents.google.com/patent/US6379961B1/en
US6340783B1,Rodent models of human amyloidoses ,University Of Washington,Alan D. Snow,1992-09-23,1996-10-03,2002-01-22,2002-01-22,https://patents.google.com/patent/US6340783B1/en
US6359169B1,GABA and L-glutamic acid analogs for antiseizure treatment ,"Northwestern University, Warner-Lambert Company","Richard B. Silverman, Ryszard Andruszkiewicz, Po-Wai Yuen, Denis Martin Sobieray, Lloyd Charles Franklin, Mark Alan Schwindt",1990-11-27,1996-10-16,2002-03-19,2002-03-19,https://patents.google.com/patent/US6359169B1/en
US6390626B2,Image projection system engine assembly ,Duke University,Richard M. Knox,1996-10-17,1996-10-17,2002-05-21,2002-05-21,https://patents.google.com/patent/US6390626B2/en
US6375925B1,Methods and reagents for non-invasive imaging of atherosclerotic plaque ,The Regents Of The University Of California,"Sotorios Tsimikas, Joseph L. Witztum, Wulf Palinski, Linda K. Curtis",1996-11-08,1996-11-08,2002-04-23,2002-04-23,https://patents.google.com/patent/US6375925B1/en
US6370179B1,Low threshold microcavity light emitter ,"Board Of Regents, The University Of Texas System","Dennis G. Deppe, Diana L. Huffaker",1996-11-12,1996-11-12,2002-04-09,2002-04-09,https://patents.google.com/patent/US6370179B1/en
US6396186B1,Electromechanical battery design suitable for back-up power applications ,The Regents Of The University Of California,Richard F. Post,1996-12-02,1996-12-02,2002-05-28,2002-05-28,https://patents.google.com/patent/US6396186B1/en
US6348319B1,Enzyme detection biosensors ,"Australian Membrane And Biotechnology Research Institute, University Of Sydney","Vijoleta Lucija Bronislava Braach-Maksvytis, Bruce Andrew Cornell, David Geoffrey Thomson, Burkhard Raguse",1996-02-08,1997-02-10,2002-02-19,2002-02-19,https://patents.google.com/patent/US6348319B1/en
US6383388B1,Water treatment process and system for metals removal using Saccharomyces cerevisiae ,The Regents Of The University Of California,"Paula A. W. Krauter, Gordon W. Krauter",1995-08-08,1997-02-12,2002-05-07,2002-05-07,https://patents.google.com/patent/US6383388B1/en
US6368790B1,"cDNA encoding P2P proteins and use of P2P cDNA derived antibodies and antisense reagents in determining the proliferative potential of normal, abnormal, and cancer cells in animals and humans ",University Of Tennessee Research Corporation,Robert E. Scott,1996-09-27,1997-02-18,2002-04-09,2002-04-09,https://patents.google.com/patent/US6368790B1/en
US6379911B2,Enzyme detection/assay method and substrates ,"Albert Einstein College Of Medicine Of Yeshiva University, Industrial Research Limited","Vern L. Schramm, Richard Hubert Furneaux, Peter Charles Tyler, Keith Clinch",1996-02-23,1997-02-24,2002-04-30,2002-04-30,https://patents.google.com/patent/US6379911B2/en
US6376744B1,Plastid transformation in Arabidopsis thaliana ,"Rutgers, The State University Of New Jersey","Pal Maliga, Samir Sikdar, Siva Vanga Reddy",1996-03-06,1997-03-06,2002-04-23,2002-04-23,https://patents.google.com/patent/US6376744B1/en
US6353918B1,Interconnection routing system ,The Arizona Board Of Regents On Behalf Of The University Of Arizona,"Jo Dale Carothers, Donghui Li",1996-03-15,1997-03-12,2002-03-05,2002-03-05,https://patents.google.com/patent/US6353918B1/en
US6395712B1,Sensitization of HER-2/neu overexpressing cancer cells to chemotherapy ,"Board Of Regents, The University Of Texas System","Mien-Chie Hung, Naoto T. Ueno",1996-03-20,1997-03-19,2002-05-28,2002-05-28,https://patents.google.com/patent/US6395712B1/en
US6357176B2,Soilless sod ,Mississippi State University,"Brian S. Baldwin, J. Michael Goatley, Jr., Marty J. Fuller, Nancy A. Reichert, Kevin L. Hensler",1997-03-19,1997-03-19,2002-03-19,2002-03-19,https://patents.google.com/patent/US6357176B2/en
US6348452B1,Alteration of microbial populations in the gastrointestinal tract ,"The University Of New South Wales, Burns Philp & Company, Burns Philp Research & Development Pty Ltd, Commonwealth Scientific And Industrial Research Organisation, Arnott's Biscuits Limited, Gist-Brocades Australia Pty Limited, Goodman Fielder Ingredients Limited","Ian L. Brown, Patricia Lynne Conway, Anthony John Evans, Karl Anders Olof Henriksson, Kenneth J. McNaught, Xin Wang",1996-03-20,1997-03-20,2002-02-19,2002-02-19,https://patents.google.com/patent/US6348452B1/en
US6372225B1,Tetanus toxin functional fragment antigen and tetanus vaccine ,The Research Foundation Of Microbial Diseases Of Osaka University,Morihiro Matsuda,1996-03-23,1997-03-24,2002-04-16,2002-04-16,https://patents.google.com/patent/US6372225B1/en
US6364868B1,Ureteral catheter and tissue expander and method of megaureter creation ,The Trustees Of Columbia University In The City Of New York,Edward F. Ikeguchi,1995-08-02,1997-03-26,2002-04-02,2002-04-02,https://patents.google.com/patent/US6364868B1/en
US6376511B2,8-aminoquinolines ,The University Of Mississippi,"James McChesney, Dhammika N. Nanayakkara, Marilyn Bartlett, Arba L. Ager",1996-03-29,1997-03-28,2002-04-23,2002-04-23,https://patents.google.com/patent/US6376511B2/en
US6355705B1,Anaesthetic bone cement ,Queen's University At Kingston,"David M. Bond, John F. Rudan",1997-02-07,1997-04-01,2002-03-12,2002-03-12,https://patents.google.com/patent/US6355705B1/en
US6358431B1,Calixarenes ,The University Of Sheffield,"Charles James Matthew Stirling, Frank Davis",1996-04-16,1997-04-15,2002-03-19,2002-03-19,https://patents.google.com/patent/US6358431B1/en
US6388172B1,Phytochrome regulated transcription factor for control of higher plant development ,The Regents Of The University Of California,"Elaine Tobin, Lin Sun, Zhi-yong Wang",1997-04-18,1997-04-18,2002-05-14,2002-05-14,https://patents.google.com/patent/US6388172B1/en
US6355254B1,Pathogenic Escherichia coli associated protein EspA ,University Of British Columbia,"B. Brett Finlay, Brendan Kenny, Markus Stein, Michael S. Donnenberg, Li-Ching Lai",1996-04-23,1997-04-23,2002-03-12,2002-03-12,https://patents.google.com/patent/US6355254B1/en
US6376257B1,Detection by fret changes of ligand binding by GFP fusion proteins ,University Of Rochester,Anthony Persechini,1997-04-24,1997-04-24,2002-04-23,2002-04-23,https://patents.google.com/patent/US6376257B1/en
US6391594B1,Modified modular PKS with retained scaffold ,"Kosan Biosciences, Inc., The Leland Stanford Junior University","Chaitan Khosla, Gary Ashley, Hong Fu, Camilla M. Kao, Robert McDaniel",1993-09-20,1997-04-30,2002-05-21,2002-05-21,https://patents.google.com/patent/US6391594B1/en
US6361996B1,Neuroepithelial stem cells and glial-restricted intermediate precursors ,University Of Utah Research Foundation,"Mahendra S. Rao, Margot Mayer-Proschel",1997-05-07,1997-05-07,2002-03-26,2002-03-26,https://patents.google.com/patent/US6361996B1/en
US6339013B1,"Method of doping silicon, metal doped silicon, method of making solar cells, and solar cells ",The Board Of Trustees Of The University Of Arkansas,"Hameed A. Naseem, M. Shahidul Haque, William D. Brown",1997-05-13,1997-05-13,2002-01-15,2002-01-15,https://patents.google.com/patent/US6339013B1/en
US6350368B1,Electrochemical and photochemical electrodes and their use ,Yissum Research Development Company Of The Hebrew University Of Jerusalem,"Itamar Willner, Eugeny Katz, Ron Blonder, Vered Heleg-Shabtai",1996-05-27,1997-05-27,2002-02-26,2002-02-26,https://patents.google.com/patent/US6350368B1/en
US6339840B1,Apparatus and method for parallelizing legacy computer code ,"Iowa State University Research Foundation, Inc.","Suraj C. Kothari, Mitra Simanta, Youngtae Kim",1997-06-02,1997-06-02,2002-01-15,2002-01-15,https://patents.google.com/patent/US6339840B1/en
US6355790B1,Inhibition of HIV replication using a mutated transfer RNA primer ,"University Of Rochester, University Of California","Joseph D. Rosenblatt, Xinqiang Li",1997-06-03,1997-06-03,2002-03-12,2002-03-12,https://patents.google.com/patent/US6355790B1/en
US6348786B1,High voltage measuring device utilizing a poled optical fiber ,"Abb Ab, University Of Sydney","Margareta Bjarme, Ian Masson Bassett",1995-06-21,1997-06-19,2002-02-19,2002-02-19,https://patents.google.com/patent/US6348786B1/en
US6373863B1,Yitterbium laser system ,Rutgers University,"Yasutake Ohishi, Elias Snitzer",1992-01-31,1997-06-19,2002-04-16,2002-04-16,https://patents.google.com/patent/US6373863B1/en
US6392024B1,Tenebrio antifreeze proteins ,Queen's University At Kingston,"Laurie A. Graham, Yih-Cherng Liou, Virginia K. Walker, Peter L. Davies",1997-06-26,1997-06-26,2002-05-21,2002-05-21,https://patents.google.com/patent/US6392024B1/en
US6383500B1,"Particles comprising amphiphilic copolymers, having a crosslinked shell domain and an interior core domain, useful for pharmaceutical and other applications ",Washington University,"Karen L. Wooley, Bruce Thurmond II K., Haiyong Huang",1996-06-27,1997-06-27,2002-05-07,2002-05-07,https://patents.google.com/patent/US6383500B1/en
US6335010B1,Gene therapy in coronary angioplasty and bypass ,University Of California At San Diego,"Shu Chien, John Y-J Shyy",1996-11-08,1997-06-30,2002-01-01,2002-01-01,https://patents.google.com/patent/US6335010B1/en
US5834178C1,Flush-storage solution for donor organs ,Univ Wayne State,"Paul C Churchill, Monique C Churchill",1997-07-09,1997-07-09,2002-04-23,2002-04-23,https://patents.google.com/patent/US5834178C1/en
US6367052B1,Method of producing optimized designs using computer systems and designs produced therefrom ,"Rutgers, The State University Of New Jersey","Louis I. Steinberg, J. Storrs Hall, Brian D. Davison",1996-07-17,1997-07-17,2002-04-02,2002-04-02,https://patents.google.com/patent/US6367052B1/en
US6348586B1,Unique associated Kaposi's sarcoma virus sequences and uses thereof ,The Trustees Of Columbia University In The City Of New York,"Yuan Chang, Roy A. Bohenzky, James J. Russo, Isidore S. Edelman, Patrick S. Moore",1996-07-25,1997-07-22,2002-02-19,2002-02-19,https://patents.google.com/patent/US6348586B1/en
US6384300B1,Invertase inhibitor ,University Of Heidelberg,"Thomas Rausch, Silke Krausgrill, Steffen Greiner",1996-07-30,1997-07-30,2002-05-07,2002-05-07,https://patents.google.com/patent/US6384300B1/en
US6355086B2,Method and apparatus for making components by direct laser processing ,"Rolls-Royce Corporation, Board Of Regents, The University Of Texas","Lawrence Evans Brown, Timothy Paul Fuesting, Joseph Jefferson Beaman, Jr., Suman Das",1997-08-12,1997-08-12,2002-03-12,2002-03-12,https://patents.google.com/patent/US6355086B2/en
US6381355B1,Inspection method for comparison of articles ,The Hong Kong University Of Science And Technology,Ravindra Stephen Goonetilleke,1997-08-19,1997-08-19,2002-04-30,2002-04-30,https://patents.google.com/patent/US6381355B1/en
US6346406B1,"Elongation factor-2 kinase (EF-2 kinase), and methods of use therefor ",University Of Medicine & Dentistry Of New Jersey,"Alexey G. Ryazanov, William N. Hait, Karen S. Pavur",1997-08-20,1997-08-20,2002-02-12,2002-02-12,https://patents.google.com/patent/US6346406B1/en
US6342265B1,Apparatus and method for in-situ thickness and stoichiometry measurement of thin films ,"Triumf, Ramot-University Authority For Applied Research & Industrial Development Ltd., The University Of British Columbia","Itzhak Kelson, Yuval Levy",1997-08-20,1997-08-20,2002-01-29,2002-01-29,https://patents.google.com/patent/US6342265B1/en
