US6894154B2,hKIS compositions and methods of use ,Regents Of The University Of Michigan,"Gary J. Nabel, Elizabeth G. Nabel, Manfred Boehm",1998-08-21,2004-03-11,2005-05-17,2005-05-17,https://patents.google.com/patent/US6894154B2/en
US6888892B2,Method for padding macroblocks ,University Of Washington,"Chris Yoochang CHUNG, Kerem Karadayi, Rohit Garg, Donglok Kim, Yongmin Kim",2001-12-10,2001-12-10,2005-05-03,2005-05-03,https://patents.google.com/patent/US6888892B2/en
US6911656B2,"Rotational stage for high speed, large area scanning in focused beam systems ",National University Of Singapore,"Yong Yu Liu, Daniel S. H. Chan, Jacob C. H. Phang",2002-09-16,2004-07-01,2005-06-28,2005-06-28,https://patents.google.com/patent/US6911656B2/en
US6909086B2,Neutral particle beam processing apparatus ,"Ebara Corporation, Japan As Represented By President Of Tohoku University","Seiji Samukawa, Katsunori Ichiki, Kazuo Yamauchi, Hirokuni Hiyama",2001-03-26,2002-03-22,2005-06-21,2005-06-21,https://patents.google.com/patent/US6909086B2/en
US6890311B2,Methods for performing medical procedures within a breast duct ,The Regents Of The University Of California,"Susan M. Love, Sanford H. Barsky",1997-09-16,2002-03-15,2005-05-10,2005-05-10,https://patents.google.com/patent/US6890311B2/en
US6900690B2,Low-power high-performance integrated circuit and related methods ,The Regents Of The University Of California,"Sung-Mo Kang, Seung-Moon Yoo",2001-05-22,2003-12-05,2005-05-31,2005-05-31,https://patents.google.com/patent/US6900690B2/en
US6884458B2,Sensor for monitoring material deposition and method of monitoring material deposition ,The Board Of Trustees Of The University Of Illinois,Chang Liu,2002-12-04,2002-12-04,2005-04-26,2005-04-26,https://patents.google.com/patent/US6884458B2/en
US6887980B2,OrfF and OrfF′ polypeptides from Xanthomonas campestris ,National Chung Hsing University,"Jiann-Hwa Chen, Pei-Tseng Lee, Yin Liu",2001-08-31,2002-08-30,2005-05-03,2005-05-03,https://patents.google.com/patent/US6887980B2/en
US6908699B1,Fuel cell ,University Of South Florida,"Robert Frederick Benson, Lawrence C. Langebrake",2002-07-09,2002-07-09,2005-06-21,2005-06-21,https://patents.google.com/patent/US6908699B1/en
US6875904B2,Animal model for identifying agents that inhibit or enhance CTLA4 signaling ,The Ohio State University Research Foundation,"Yang Liu, Pan Zheng, Ping Lu, Bedrich Mosinger, Ken May",2000-09-20,2001-09-20,2005-04-05,2005-04-05,https://patents.google.com/patent/US6875904B2/en
US6881558B1,Expression system for cloning toxic genes ,The Trustees Of The University Of Pennsylvania,"David B. Weiner, Donghui Zhang, Adam Cohen",2000-06-26,2001-06-25,2005-04-19,2005-04-19,https://patents.google.com/patent/US6881558B1/en
US6878735B2,Multi-substituted imidazolines and method of use thereof ,Board Of Trustees Of Michigan State University,"Jetze J. Tepe, Satyamaheshwar Peddibhotla",2002-05-31,2003-01-17,2005-04-12,2005-04-12,https://patents.google.com/patent/US6878735B2/en
US6875566B2,Marker for antidepressant therapy and methods related thereto ,The Board Of Trustees Of The University Of Illinois,"Mark M. Rasenick, Robert J. Donati, Sadamu Toki",2000-07-29,2001-07-30,2005-04-05,2005-04-05,https://patents.google.com/patent/US6875566B2/en
US6890721B1,Interleukin-1β converting enzyme like apoptotic protease-6 ,"Human Genome Sciences, Inc., Smithkline Beecham Corporation, The Regents Of The University Of Michigan","Vishva M. Dixit, Wei-Wu He, Kristine K. Kikly, Steven M. Ruben",1996-05-20,2001-09-24,2005-05-10,2005-05-10,https://patents.google.com/patent/US6890721B1/en
US6900018B2,Method of screening for a biological response using linear and circular expression elements ,"Board Of Regents, The University Of Texas System","Kathryn F. Sykes, Stephen Albert Johnston",1999-03-24,2002-02-15,2005-05-31,2005-05-31,https://patents.google.com/patent/US6900018B2/en
US6875851B1,Prolyl tripeptidyl peptidases nucleic acid of Porphyromonas gingivalis ,"University Of Georgia Research Foundation, Inc.","James Travis, Jan Potempa, Agnieszka Banbula",1999-03-05,2000-03-03,2005-04-05,2005-04-05,https://patents.google.com/patent/US6875851B1/en
US6890527B2,Methods of treatment ,The University Of Arkansas,"John A. Thoma, Eid E. Haddad, Craig E. Whitfill, Alan P. Avakian",1996-09-30,2002-05-24,2005-05-10,2005-05-10,https://patents.google.com/patent/US6890527B2/en
US6902675B2,Method to control off-flavor in water and aquaculture products ,Mississippi State University,"Anita M. Kelly, Tor P. Schultz",2001-10-19,2002-10-18,2005-06-07,2005-06-07,https://patents.google.com/patent/US6902675B2/en
US6887463B2,Methods and compositions for the treatment of defects in lipoprotein metabolism ,The Trustees Of The University Of Pennsylvania,"James M. Wilson, Karen Kozarsky, Jerome Strauss, III",1995-02-24,2002-06-10,2005-05-03,2005-05-03,https://patents.google.com/patent/US6887463B2/en
US6906116B2,"Unsaturated polyester compounds, resins curable with actinic energy ray, processes for the production thereof, and curable compositions ","Kanagawa University, Taiyo Ink Manufacturing Co., Ltd.","Tadatomi Nishikubo, Atsushi Kameyama, Masaki Sasaki, Masatoshi Kusama",2001-02-15,2003-08-14,2005-06-14,2005-06-14,https://patents.google.com/patent/US6906116B2/en
US6875254B2,Methods for detecting and extracting gold ,"University Of Washington, Placer Dome, Inc.","Clement E. Furlong, Scott Jorgenson-Soelberg, James B. Clendenning, Noel W. Kirshenbaum, Victor Chevillon, Peter Leon Kowalczyk",2001-08-08,2004-02-03,2005-04-05,2005-04-05,https://patents.google.com/patent/US6875254B2/en
US6883151B2,Method and device for IC identification ,National Taiwan University,"Hen-Wai Tsao, Yu-Cheng Fan",2003-05-13,2003-05-13,2005-04-19,2005-04-19,https://patents.google.com/patent/US6883151B2/en
US6890557B2,Emulsion formulations for hydrophilic active agents ,University Of Pittsburgh,"Leaf Huang, Toshifumi Hara",1996-07-03,2003-05-22,2005-05-10,2005-05-10,https://patents.google.com/patent/US6890557B2/en
US6878521B1,"Fibril-blocking peptide, a method for preventing fibril formation ",The University Of Chicago,"Fred J. Stevens, Yair Argon, David P. Davis, Rosemarie Raffen",1999-11-14,2000-11-13,2005-04-12,2005-04-12,https://patents.google.com/patent/US6878521B1/en
US6900185B1,Method of inducing tumor cell apoptosis using trail/Apo-2 ligand gene transfer ,University Of Iowa Research Foundation,"Thomas S. Griffith, Timothy Ratliff",2000-04-12,2000-04-12,2005-05-31,2005-05-31,https://patents.google.com/patent/US6900185B1/en
US6906108B2,"Extracts of vetiver oil as repellent and toxicant to ants, ticks, and cockroaches ",Board Of Supervisors Of Louisiana State University And Agricultural And Mechanical College,"Gregg Henderson, Donald O. Heumann, Roger A. Laine, Lara Maistrello, Betty C. R. Zhu, Feng Chen",2001-08-17,2001-08-17,2005-06-14,2005-06-14,https://patents.google.com/patent/US6906108B2/en
US6887686B2,Cloning and expression of Haemophilus somnus transferrin-binding proteins ,University Of Saskatchewan,"Andrew A. Potter, Clement Rioux, Anthony B. Schryvers",1999-03-10,2002-03-13,2005-05-03,2005-05-03,https://patents.google.com/patent/US6887686B2/en
US6879012B2,Giant planar hall effect in epitaxial ferromagnetic semiconductor devices ,"The Regents Of The University Of California, California Institute Of Technology","Hongxing Tang, Michael L. Roukes, Roland K. Kawakami, David D. Awschalom",2002-06-21,2003-06-23,2005-04-12,2005-04-12,https://patents.google.com/patent/US6879012B2/en
US6891029B2,Isolated polynucleotide sequences encoding a fertility associated antigen ,The Arizona Board Of Regents On Behalf Of The University Of Arizona,"Huanmin Zhang, Roy L. Ax, Mary E. Bellin",2000-07-14,2001-07-16,2005-05-10,2005-05-10,https://patents.google.com/patent/US6891029B2/en
US6890537B2,Antimicrobial theta defensins and methods of using same ,The Regents Of The University Of California,"Michael E. Selsted, Yi-Quan Tang, Jun Yuan, Andre J. Ouellette",1999-05-10,2002-12-05,2005-05-10,2005-05-10,https://patents.google.com/patent/US6890537B2/en
US6906333B2,Magnetic separator for linear dispersion and method for producing the same ,"University Of Washington, Sti Optronics Inc.","Adi A. Scheidemann, Kem Robinson, Patrick L. Jones, Stephen C. Gottschalk",1997-10-07,2004-01-22,2005-06-14,2005-06-14,https://patents.google.com/patent/US6906333B2/en
US6893518B1,Sol-gel manufactured energetic materials ,The Regents Of The University Of California,"Randall L. Simpson, Ronald S. Lee, Thomas M. Tillotson, Lawrence W. Hrubesh, Rosalind W. Swansiger, Glenn A. Fox",1997-09-09,2003-10-29,2005-05-17,2005-05-17,https://patents.google.com/patent/US6893518B1/en
US6911528B1,Hedgehog-derived polypeptides ,The Johns Hopkins University School Of Medicine,"Philip A. Beachy, Jeffrey A. Porter",1994-12-02,2000-05-02,2005-06-28,2005-06-28,https://patents.google.com/patent/US6911528B1/en
US6879758B2,Multi-degree-of-freedom of precision positioning device using spring-mounted electromechanical actuators ,National Kaohsiung First University Of Science And Technology,"Yung-Tien Liu, Rong-Fong Fung, Jiunn-Chau Wang",2003-06-16,2003-06-16,2005-04-12,2005-04-12,https://patents.google.com/patent/US6879758B2/en
US6887853B2,Use of geldanamycin and related compounds for treatment of fibrogenic disorders ,The Trustees Of Boston University,David Strehlow,2000-06-29,2001-06-28,2005-05-03,2005-05-03,https://patents.google.com/patent/US6887853B2/en
US6911318B2,Bacterial transglycosylases: assays for monitoring the activity using Lipid II substrate analogs and methods for discovering new antibiotics ,The Trustees Of Princeton University,Suzanne Walker Kahne,1999-03-03,2002-10-02,2005-06-28,2005-06-28,https://patents.google.com/patent/US6911318B2/en
US6900036B2,"Prion isomers, methods of making, methods of using, and compositions and products comprising prion isomers ",University Of Texas Health Science Center Houston,"Jui-Yoa Chang, Bao-Yuan Lu",2000-12-27,2001-12-19,2005-05-31,2005-05-31,https://patents.google.com/patent/US6900036B2/en
US6887441B2,High resistivity aluminum antimonide radiation detector ,The Regents Of The University Of California,"John W. Sherohman, Arthur W. Coombs, III, Jick H. Yee",2002-09-30,2002-09-30,2005-05-03,2005-05-03,https://patents.google.com/patent/US6887441B2/en
US6887902B2,Anti-inflammatory method using gamma-aminobutyric acid (GABA) analogs ,"Warner-Lambert Company, Board Of Regents Of The University Of Texas System","Denis Schrier, Charles Price Taylor, Jr., Karin Nanette Westlund High",1997-06-25,2001-08-08,2005-05-03,2005-05-03,https://patents.google.com/patent/US6887902B2/en
US6905873B1,Recombinant p53 adenovirus methods and compositions ,"Board Of Regents, The University Of Texas System","Wei-Wei Zhang, Jack A Roth",1992-10-13,1996-04-02,2005-06-14,2005-06-14,https://patents.google.com/patent/US6905873B1/en
US6875903B2,Treatment of Staphylococcus infections ,University Of Vermont,"A. John Bramley, Karen I. Plaut, David Kerr",1998-06-22,2002-02-28,2005-04-05,2005-04-05,https://patents.google.com/patent/US6875903B2/en
US6885038B2,Light-emitting polymers and polymer light-emitting diodes ,"Agency For Science, Technology And Research, National University Of Singapore","Wei Huang, Zhikuan Chen, Soo Jin Chua",2001-06-21,2002-06-18,2005-04-26,2005-04-26,https://patents.google.com/patent/US6885038B2/en
US6890542B2,Leishmania vaccine ,University Court Of The University Of Glasgow,"Jeremy Charles Mottram, Graham Herbert Coombs",1997-04-04,2003-04-24,2005-05-10,2005-05-10,https://patents.google.com/patent/US6890542B2/en
US6899902B1,Dietary fiber and oligosaccharides from ginseng and process for preparation thereof ,Yonsei University,Jaekwan Hwang,2000-10-09,2001-10-09,2005-05-31,2005-05-31,https://patents.google.com/patent/US6899902B1/en
US6878699B1,Taccalonolide microtubule stabilizing agents ,University Of Hawaii,"Thomas K. Hemscheidt, Susan L. Mooberry",1999-05-21,2000-05-18,2005-04-12,2005-04-12,https://patents.google.com/patent/US6878699B1/en
US6881959B2,Method and system for generating an image of the radiation density of a source of photons located in an object ,The Regents Of The University Of Michigan,"Ling Jian Meng, Neal H. Clinthorne, W. Leslie Rogers, David K. Wehe",2002-10-31,2002-10-31,2005-04-19,2005-04-19,https://patents.google.com/patent/US6881959B2/en
US6908542B2,Rotating potentiometric electrode ,The Regents Of The University Of Michigan,"Mark E. Meyerhoff, Qingshan Ye",2000-12-08,2001-12-07,2005-06-21,2005-06-21,https://patents.google.com/patent/US6908542B2/en
US6897257B2,Process for forming latex polymers ,The University Of Southern Mississippi,"Shelby F. Thames, Oliver W. Smith, Sheng Chen, Catherine C. Blackwell",1996-12-24,2002-04-08,2005-05-24,2005-05-24,https://patents.google.com/patent/US6897257B2/en
US6900331B2,Derivatives of epothilone B and D and synthesis thereof ,University Of Notre Dame,"Richard E. Taylor, Yue Chen",2002-03-01,2003-02-28,2005-05-31,2005-05-31,https://patents.google.com/patent/US6900331B2/en
US6882613B2,Cylindrical medium for storing holographic data and methods and apparatus for manipulating data using the cylindrical medium ,Hampton University,Doyle A. Temple,2001-06-21,2001-06-21,2005-04-19,2005-04-19,https://patents.google.com/patent/US6882613B2/en
US6887667B2,Method and apparatus to identify small variations of biomolecules ,Alfred E. Mann Institute For Biomedical Engineering At The University Of Southern California,Gerald E. Loeb,2000-12-28,2001-12-18,2005-05-03,2005-05-03,https://patents.google.com/patent/US6887667B2/en
US6882252B1,Multi-layer microwave resonator ,"Poseideon Scientific Instruments Pty Ltd., The University Of Western Australia","Dominique Cros, Michael Edmund Tobar",1999-12-23,2000-12-21,2005-04-19,2005-04-19,https://patents.google.com/patent/US6882252B1/en
US6881588B2,Fluid treatment device ,Indiana University Research & Technology Corporation,"Tony J. Tegeler, Yehia Mechref, Milos V. Novotny",2002-10-18,2002-10-18,2005-04-19,2005-04-19,https://patents.google.com/patent/US6881588B2/en
US6906238B2,Effective nuclear reprogramming in mammals using CDK2 inhibitors ,"University Of Georgia Research Foundation, Inc.",Steven Stice,2000-03-15,2001-03-15,2005-06-14,2005-06-14,https://patents.google.com/patent/US6906238B2/en
US6887484B2,Vaccine composition containing a promoter peptide ,"Posco, Pohang University Of Science & Technology","Yoe-Sik Bae, Youn-Dong Kim, You-Suk Seo, Young-Chul Sung, Pann-Ghill Suh, Sung-Ho Ryu, Taehoon Lee",2001-07-31,2002-07-31,2005-05-03,2005-05-03,https://patents.google.com/patent/US6887484B2/en
US6887682B2,Chaperonin and osmolyte protein folding and related screening methods ,University Of Kansas Medical Center,"Mark T. Fisher, Paul A. Voziyan",2000-03-15,2001-03-15,2005-05-03,2005-05-03,https://patents.google.com/patent/US6887682B2/en
US6912074B1,Method of producing a big size holographic projection screen for displaying a three-dimensional color images without color deterioration ,Industry-University Cooperation Foundation Hanyang University,"Jung-Young Son, Vladimir I. Bobrinev",2004-08-04,2004-08-04,2005-06-28,2005-06-28,https://patents.google.com/patent/US6912074B1/en
US6911460B2,Antiviral agents and methods of treating viral infections ,"Vion Pharmaceuticals, Inc., Yale University","Ivan C. King, Terrance W. Doyle, Mario Sznol, Alan C. Sartorelli, Yung-Chi Cheng",2001-04-20,2002-04-18,2005-06-28,2005-06-28,https://patents.google.com/patent/US6911460B2/en
US6897053B1,"Enzymes derived from thermophilic organisms that function as a chromosomal replicase, preparation and use thereof ",Rockefeller University,"Michael E. O'Donnell, Olga Yurieva",1997-04-08,2000-11-21,2005-05-24,2005-05-24,https://patents.google.com/patent/US6897053B1/en
US6887478B2,Formalin-treated human papillomavirus L1 protein vaccine ,Georgetown University,"C. Richard Schlegel, A. Bennett Jenson, Shin-je Ghim",1995-10-02,2003-09-22,2005-05-03,2005-05-03,https://patents.google.com/patent/US6887478B2/en
US6878254B2,Size separation of analytes using monomeric surfactants ,"Iowa State University Research Foundation, Inc.","Edward S. Yeung, Wei Wei",2001-03-02,2002-02-27,2005-04-12,2005-04-12,https://patents.google.com/patent/US6878254B2/en
US6893643B2,Recombinant yellow fever virus and methods of use thereof ,The Regents Of The University Of California,"Raul Andino-Pavlovsky, Andres McAllister-Moreno",2000-01-21,2003-03-06,2005-05-17,2005-05-17,https://patents.google.com/patent/US6893643B2/en
US6875574B1,Assays for sensory modulators using a sensory cell specific G-protein alpha subunit ,The Regents Of The University Of California,Charles S. Zuker,1999-01-27,2000-01-26,2005-04-05,2005-04-05,https://patents.google.com/patent/US6875574B1/en
US6911951B2,Ultra-wideband antennas ,The University Of British Columbia,"Kim V. Dotto, Mordechay Yedlin",2001-04-26,2002-04-24,2005-06-28,2005-06-28,https://patents.google.com/patent/US6911951B2/en
US6900026B2,Methods for identifying compounds as antioxidants ,"Duke University, Emory University","Douglas C. Wallace, Simon Melov, James D. Crapo, Brian J. Day",1996-09-06,2001-11-09,2005-05-31,2005-05-31,https://patents.google.com/patent/US6900026B2/en
US6903192B2,Genes regulating circadian clock function and photoperiodism ,State Of Oregon Acting By And Through The State Board Of Higher Education On Behalf Of The University Of Oregon,"Ry Wagner, Karen A. Hicks, Michelle T. Z. Spence, Henriette Foss, Xiang Liang Liu, Michael F. Covington",1998-08-17,2003-11-21,2005-06-07,2005-06-07,https://patents.google.com/patent/US6903192B2/en
US6894205B2,Assay for toxin induced neuronal degeneration and viability in C. elegans ,Vanderbilt University,"Randy D. Blakely, Richard Nass, David Miller",2001-06-22,2001-06-22,2005-05-17,2005-05-17,https://patents.google.com/patent/US6894205B2/en
US6899874B2,Method for the treatment of bacterial vaginal infections ,"New Horizons Diagnostics Corporation, Rockefeller University","Vincent Fischetti, Lawrence Loomis",1997-10-31,2002-05-01,2005-05-31,2005-05-31,https://patents.google.com/patent/US6899874B2/en
US6908556B2,Methods for forming microcultures within porous media ,The University Of Tulsa,Kerry L. Sublette,1999-12-02,2002-10-28,2005-06-21,2005-06-21,https://patents.google.com/patent/US6908556B2/en
US6905857B2,RAD51 polypeptides ,"Pioneer Hi-Bred International, Inc., Trustees Of Columbia University In The City Of New York","Benjamin A. Bowen, Mark A. Chamberlin, Bruce J. Drummond, John A. McElver, Rodney J. Rothstein",1998-02-13,2002-09-18,2005-06-14,2005-06-14,https://patents.google.com/patent/US6905857B2/en
US6887922B1,Glass composite ,Sheffield Hallam University,James Roddis,1999-09-04,2000-09-01,2005-05-03,2005-05-03,https://patents.google.com/patent/US6887922B1/en
US6885536B1,Method and apparatus for magnetically generating motion with high precision ,The Texas A&M University System,Won-jong Kim,2001-08-31,2002-08-30,2005-04-26,2005-04-26,https://patents.google.com/patent/US6885536B1/en
US6875742B2,Method for treating cytokine mediated hepatic injury ,"Zymogenetics, Inc., University Of Kentucky Research Foundation","Peter R. Oeltgen, Paul D. Bishop, Craig J. McClain, Shirish Barve",2000-10-10,2001-10-05,2005-04-05,2005-04-05,https://patents.google.com/patent/US6875742B2/en
US6897291B1,pH sensitive potassium channel in spermatocytes ,"Icagen, Incorporated, The Washington University","Lawrence Salkoff, Matthew Schreiber, Chris Silvia",1997-10-22,2000-03-06,2005-05-24,2005-05-24,https://patents.google.com/patent/US6897291B1/en
US6897436B2,System and method for optical processing based on light-controlled photon tunneling ,University Of Maryland,"Igor I. Smolyaninov, Christopher C. Davis, Anatoly Zayats",2002-06-06,2003-06-06,2005-05-24,2005-05-24,https://patents.google.com/patent/US6897436B2/en
US6897197B2,Method of inhibiting cell proliferation using an anti-oncogene protein ,Albert Einstein College Of Medicine Of Yeshiva University,Ronald A. DePinho,1998-03-19,2003-04-28,2005-05-24,2005-05-24,https://patents.google.com/patent/US6897197B2/en
US6904701B2,Flask and method for drying biological materials ,The Regents Of The University Of California,"Thurein M. Htoo, John H. Crowe, Ann E. Oliver, Fern Tablin",2002-02-15,2002-02-15,2005-06-14,2005-06-14,https://patents.google.com/patent/US6904701B2/en
US6896846B1,Synthesis of orthopaedic implant materials ,University Of Notre Dame,"Arvind Varma, Alexander Mukasyan, Bing-Yun Li",2001-11-02,2002-10-31,2005-05-24,2005-05-24,https://patents.google.com/patent/US6896846B1/en
US6911056B2,Method for diffracting crystals formed by submicroliter crystallization experiments ,The Regents Of The University Of California,"Bernard D. Santarsiero, Raymond C. Stevens, Peter G. Schultz, Joseph M. Jaklevic, Derek T. Yegian, Earl W. Cornell, Robert A. Nordmeyer",1999-06-18,2002-04-08,2005-06-28,2005-06-28,https://patents.google.com/patent/US6911056B2/en
US6884877B2,"Purified linear epitopes from cashew nuts, nucleic acids encoding therefor, and associated methods ","Florida State University Research Foundation, Inc.","Kenneth H. Roux, Shridhar K. Sathe, Suzanne S. Teuber",2001-10-03,2002-10-03,2005-04-26,2005-04-26,https://patents.google.com/patent/US6884877B2/en
US6881738B2,Analogs of choline for neuroprotection and cognitive enhancement in neurodegenerative disorders ,"Medical College Of Georgia Research Institute, University Of Georgia Research Foundation, Inc","Jerry J. Buccafusco, Alvin V. Terry, J. Warren Beach, Rammamohanna R. Jonnala",2001-07-19,2002-07-18,2005-04-19,2005-04-19,https://patents.google.com/patent/US6881738B2/en
US6894159B2,Process for the preparation of 2′-fluoro-5-methyl-beta-L-arabino-furanosyluridine ,The University Of Georgia Research Foundation,"Chung K. Chu, Jinfa Du, Yongseok Choi",1997-07-23,2003-01-24,2005-05-17,2005-05-17,https://patents.google.com/patent/US6894159B2/en
US6909032B2,"DNA encoding a macadamia integrifolia anti-microbial protein, constructs comprising the same and plant material comprising the constructs ","Commonwealth Scientific And Industrial Research Organisation, The State of Queensland, Department of Primary Industries, The University Of Queensland, Bureau Of Sugar Experiments Stations, Queensland University Of Technology","John Michael Manners, John Paul Marcus, Kenneth Clifford Goulter, Jodie Lyn Green, Stuart John Harrison",1996-01-31,2001-06-15,2005-06-21,2005-06-21,https://patents.google.com/patent/US6909032B2/en
US6911314B2,Screening for drugs that affect TNF receptor releasing enzyme ,The Regents Of The University Of California,"Tetsuya Gatanaga, Gale A. Granger",1999-05-14,2000-12-29,2005-06-28,2005-06-28,https://patents.google.com/patent/US6911314B2/en
US6876456B2,Absolute calibration of optical flats ,The Regents Of The University Of California,Gary E. Sommargren,2002-09-27,2002-09-27,2005-04-05,2005-04-05,https://patents.google.com/patent/US6876456B2/en
US6908918B2,Antitumor agents ,Regents Of The University Of California,"Trevor C. McMorris, Michael J. Kelner",1998-02-20,2003-04-14,2005-06-21,2005-06-21,https://patents.google.com/patent/US6908918B2/en
US6899828B2,Composite coatings ,Nanyang Technological University,"Xu Shi, Hong Siang Tan, Beng Kang Tay",1999-05-10,2002-03-25,2005-05-31,2005-05-31,https://patents.google.com/patent/US6899828B2/en
US6874443B2,Layer-by-layer etching apparatus using neutral beam and etching method using the same ,Sungkyunkwan University,"Geun-young Yeom, Min-Jae Chung, Do-Haing Lee, Sung-min Cho, Sae-Hoon Chung",2001-11-26,2002-02-28,2005-04-05,2005-04-05,https://patents.google.com/patent/US6874443B2/en
US6910030B2,Adaptive search method in feature vector space ,"Samsung Electronics Co., Ltd., The Regents Of The University Of California","Yang-lim Choi, Youngsik Huh, B. S. Manjunath, Peng Wu",2000-11-14,2001-02-15,2005-06-21,2005-06-21,https://patents.google.com/patent/US6910030B2/en
US6892164B2,"Device, method, and medium for predicting a probability of an occurrence of a data ","Nec Corporation, Yale University","Jun-Ichi Takeuchi, Andrew R. Barron",1998-06-18,2002-08-26,2005-05-10,2005-05-10,https://patents.google.com/patent/US6892164B2/en
US6889145B1,Three-dimensional model of a Fc region of an IgE antibody and uses thereof ,Northwestern University,"Theodore S. Jardetzky, Beth A. Wurzburg",2000-03-15,2002-08-01,2005-05-03,2005-05-03,https://patents.google.com/patent/US6889145B1/en
US6903183B1,Compositions and methods for regulation of steroidogenesis ,Texas Tech University Health Services Center,"Douglas M. Stocco, Barbara J. Clark",1996-06-07,2000-07-10,2005-06-07,2005-06-07,https://patents.google.com/patent/US6903183B1/en
US6904806B2,Electronic intelligent indenter ,Wayne State University,Roger W. Pryor,2002-07-18,2002-07-18,2005-06-14,2005-06-14,https://patents.google.com/patent/US6904806B2/en
US6893986B2,Method of reducing internal stress in materials ,Wright State University,"Maher S. Amer, John F. Maguire",2002-07-22,2003-07-22,2005-05-17,2005-05-17,https://patents.google.com/patent/US6893986B2/en
US6895688B2,Liquid crystal polarization rotator and method of using same ,"Lucent Technologies Inc., The University Of Minnesota","Bharat R. Acharya, Cheng Cher Huang, Christi Kay Madsen, John A. Rogers",2003-08-29,2003-08-29,2005-05-24,2005-05-24,https://patents.google.com/patent/US6895688B2/en
US6906855B2,Method of amplifying optical signals using doped materials with extremely broad bandwidths ,The Board Of Trustees Of The Leland Stanford Junior University,"Yannick G. Feillens, Michel J. F. Digonnet, Martin M. Fejer",2000-07-28,2004-07-06,2005-06-14,2005-06-14,https://patents.google.com/patent/US6906855B2/en
