US7804689B2,High-power thyristor module having cooling effect ,"Kuen-Cheng Wang, The Department of Electrical Engineering National Chang-Hua University of Education","Kuen-Cheng Wang, Tsair-Rong Chen, Jeen-Sheen Row",2008-05-14,2008-11-04,2010-09-28,2010-09-28,https://patents.google.com/patent/US7804689B2/en
US7795350B2,Blends of amorphous and semicrystalline polymers having shape memory properties ,"Connecticut, University Of","Patrick T. Mather, Changdeng Liu, Cheryl J. Campo",2002-10-11,2008-04-21,2010-09-14,2010-09-14,https://patents.google.com/patent/US7795350B2/en
US7771696B2,Nanocomposites and functionalized carbon nanofibers ,University Of Dayton,"David H. Wang, Loon-Seng Tan",2006-07-27,2006-07-27,2010-08-10,2010-08-10,https://patents.google.com/patent/US7771696B2/en
US7772397B2,"Biologically active peptides and compositions, their use ",University Of British Columbia,"Raymond Andersen, John Coleman, Dilip De Silva, Fangming Kong, Edward Piers, Debra Wallace, Michel Roberge, Theresa Allen",1995-04-20,2008-07-21,2010-08-10,2010-08-10,https://patents.google.com/patent/US7772397B2/en
US7773574B2,Scheduling wireless communication among delay-sensitive and delay-insensitive terminals ,"Samsung Electronics, Co., Ltd., Tsinghua University","Kyung-Hun Jang, Pinyi Fan, Zhigang Cao, Shufu Mao, Yung-soo Kim, Yongxing Zhou, Jianjun Li",2005-07-15,2006-07-17,2010-08-10,2010-08-10,https://patents.google.com/patent/US7773574B2/en
US7790170B2,Modified leukotoxin protein ,University Of Guelph,"Reggie Y. C. Lo, Patricia E. Shewen, Raymond W. H. Lee, Doug Hodgins, Judith N. Strommer",1999-12-17,2007-10-23,2010-09-07,2010-09-07,https://patents.google.com/patent/US7790170B2/en
US7791338B2,MRI method of determining time-optimal gradient waveforms with gradient amplitude as a function of arc-length in k-space ,The Board Of Trustees Of The Leland Stanford Junior University,"Seung Jean Kim, John M. Pauly, Michael Lustig",2007-09-07,2007-09-07,2010-09-07,2010-09-07,https://patents.google.com/patent/US7791338B2/en
US7785639B2,Composition for treating cancer cells and preparation method for the same ,Kaohsiung Medical University,"Yang-Chang Wu, An-Shen Lin, Fang-Rong Chang, Chin-Chung Wu",2005-11-08,2009-11-16,2010-08-31,2010-08-31,https://patents.google.com/patent/US7785639B2/en
US7800366B1,Three dimensional magnetic resonance motion estimation on a single image plane ,Johns Hopkins University,"Jerry L. Prince, Matthias Stuber, Nael Fakhry Osman, Khaled Zakarya Abd-Elmoniem",2005-05-04,2009-01-13,2010-09-21,2010-09-21,https://patents.google.com/patent/US7800366B1/en
US7794712B2,"Production of mutant strain of Aspergillus fumigatus, method of assay for inhibiting siderophore biosynthesis and diagnostic method for detecting likely Aspergillus fumigatus infection ",Simon Fraser University,"Margo Marie Moore, Anna Hodiah Tangen Hissen, Nga Chun Adrian Wan",2004-06-18,2005-06-20,2010-09-14,2010-09-14,https://patents.google.com/patent/US7794712B2/en
US7795410B2,Compositions and methods for treating HIV infection with cupredoxin and cytochrome c ,The Board Of Trustees Of The University Of Illinois,"Ananda Chakrabarty, Tapas Das Gupta, Tohru Yamada, Anita Chaudhari, Arsenio Fialho, Chang Soo Hong",2001-02-15,2009-03-05,2010-09-14,2010-09-14,https://patents.google.com/patent/US7795410B2/en
US7803599B2,Steady streaming particle traps ,University Of Washington,"Barry R. Lutz, Daniel T. Schwartz",2004-01-16,2005-01-18,2010-09-28,2010-09-28,https://patents.google.com/patent/US7803599B2/en
US7772185B2,Method for promoting axonal outgrowth in damaged nerves ,Emory University,"Arthur W. English, Robert McKeon, Erica Werner",2004-01-30,2005-01-31,2010-08-10,2010-08-10,https://patents.google.com/patent/US7772185B2/en
US7803558B2,Modulation of aqueous humor outflow by targeting vascular-endothelial-cadherin in Schlemm's canal cells ,The Arizona Board Of Regents On Behalf Of The University Of Arizona,"W Daniel STAMER, Ronald L Heimark",2003-02-14,2008-06-18,2010-09-28,2010-09-28,https://patents.google.com/patent/US7803558B2/en
US7772543B2,System and method for processing nanowires with holographic optical tweezers ,"New York University, Harvard University","David G. Grier, Ritesh Agarwal, Guihua Yu, Charles M. Lieber, Kosta Ladavac, Yael Roichman",2005-01-12,2006-01-11,2010-08-10,2010-08-10,https://patents.google.com/patent/US7772543B2/en
US7790061B2,Directed assembly of three-dimensional structures with micron-scale features ,Board Of Trustees Of University Of Illinois,"Gregory Gratson, Jennifer A. Lewis",2003-06-17,2006-11-16,2010-09-07,2010-09-07,https://patents.google.com/patent/US7790061B2/en
US7794733B2,"Omp85 proteins of Neisseria gonorrhoeae and Neisseria meningitidis, compositions containing same and methods of use thereof ",The University Of Montana,"Ralph C. Judd, D. Scott Manning",1998-10-22,2003-06-26,2010-09-14,2010-09-14,https://patents.google.com/patent/US7794733B2/en
US7804416B2,Methods and systems for tracking users and providing services ,National Taiwan University,"Chao-Lin Wu, Li-Chen Fu",2007-08-22,2008-06-17,2010-09-28,2010-09-28,https://patents.google.com/patent/US7804416B2/en
US7804877B2,Atomic lasers with exciplex assisted absorption ,"Cu Aerospace, Llc, The Board Of The University Of Illinois","Joseph T. Verdeyen, James Gary Eden, David L. Carroll, Jason D. Readle, Clark J. Wagner",2007-05-18,2008-05-19,2010-09-28,2010-09-28,https://patents.google.com/patent/US7804877B2/en
US7785897B2,Method and apparatus for producing a discrete droplet for subsequent analysis or manipulation ,Simon Fraser University,"George Agnes, Xiao Feng, Michael Bogan",2000-10-23,2001-10-23,2010-08-31,2010-08-31,https://patents.google.com/patent/US7785897B2/en
US7789936B2,Methods and systems for removing copper from ferrous scrap ,University Of Utah Research Foundation,"Weol Dong Cho, Peng Fan",2003-08-18,2004-08-18,2010-09-07,2010-09-07,https://patents.google.com/patent/US7789936B2/en
US7800202B2,Semiconductor device ,"Tohoku University, Foundation For Advancement Of International Science","Tadahiro Ohmi, Akinobu Teramoto",2005-12-02,2006-11-30,2010-09-21,2010-09-21,https://patents.google.com/patent/US7800202B2/en
US7777929B2,Electric device and method of its fabrication ,Bar Iian University,Zeez Zalevsky,2005-01-25,2006-01-25,2010-08-17,2010-08-17,https://patents.google.com/patent/US7777929B2/en
US7795427B2,"Methods for inhibiting osteoclast differentiation, formation, or function and for increasing bone mass ",New York University,"Bruce N. Cronstein, Firas Mohamed Kara",2006-02-14,2007-02-13,2010-09-14,2010-09-14,https://patents.google.com/patent/US7795427B2/en
US7780897B2,Hydrogel constructs using stereolithography ,"Board Of Regents, The University Of Texas System, Keck Graduate Institute","Ryan Wicker, Francisco Medina, Karina Arcaute, Luis Ochoa, Christopher Elkins, Brenda Mann",2005-04-22,2005-04-22,2010-08-24,2010-08-24,https://patents.google.com/patent/US7780897B2/en
US7783131B2,Method of generating positioning coefficients for strip-based satellite image ,National Central University,"Liang-Chien Chen, Tee-Ann Teo, Chien-Liang Liu, Jer-Jiunn Chen",2006-02-16,2006-05-30,2010-08-24,2010-08-24,https://patents.google.com/patent/US7783131B2/en
US7785823B2,Method for selective separation of free-astaxanthin from green algae Haematococcus pluvialis ,Sungkyunkwan University,"Sang-jun SIM, Chang-deok KANG",2006-02-21,2007-02-21,2010-08-31,2010-08-31,https://patents.google.com/patent/US7785823B2/en
US7797140B2,Generalizations of adjoint networks techniques for RLC interconnects model-order reductions ,Chang Gung University,"Herng-Jer Lee, Chia-Chi Chu, Wu-Shiung Feng, Ming-Hong Lai",2004-11-05,2004-11-05,2010-09-14,2010-09-14,https://patents.google.com/patent/US7797140B2/en
US7803424B2,Method for manufacturing metal-carrying carbonaceous material ,Feng Chia University,"Tse-Hao Ko, Ming-Chain Hung",2007-03-09,2007-07-25,2010-09-28,2010-09-28,https://patents.google.com/patent/US7803424B2/en
US7776536B2,Comparative fluorescence hybridization to nucleic acid arrays ,The Regents Of The University Of California,"Daniel Pinkel, Donna Albertson, Joe W. Gray",1994-12-09,2007-03-29,2010-08-17,2010-08-17,https://patents.google.com/patent/US7776536B2/en
US7804571B2,Vertical alignment liquid crystal display with high transmittance and wide view angle ,"University Of Central Florida Research Foundation, Inc., Toppoly Optoelectronics Corp.","Ruibo Lu, Qi Hong, Shin-Tson Wu, Thomas X. Wu",2004-12-23,2008-10-03,2010-09-28,2010-09-28,https://patents.google.com/patent/US7804571B2/en
US7799788B2,Method of treating chronic myelogenous leukemia cells ,"University Of South Florida, Bristol-Myers Squibb Company","Kapil N. Bhalla, Francis Y. Lee",2006-08-02,2009-02-02,2010-09-21,2010-09-21,https://patents.google.com/patent/US7799788B2/en
US7795299B2,Neo-tanshinlactone and analogs as potent and selective anti-breast cancer agents ,The University Of North Carolina At Chapel Hill,"Kuo-Hsiung Lee, Xihong Wang, Kenneth F. Bastow, Tian-Shung Wu",2004-03-10,2009-01-16,2010-09-14,2010-09-14,https://patents.google.com/patent/US7795299B2/en
US7772416B2,Data storage materials ,University Of Iowa Research Foundation,Leonard R. MacGillivray,2004-06-10,2005-06-10,2010-08-10,2010-08-10,https://patents.google.com/patent/US7772416B2/en
US7785649B2,Method for manufacturing protein chip substrate using plasma and protein chip substrate manufactured by the method ,Sungkyunkwan University Foundation For Corporate Collaboration,"Dong-geun Jung, Sang-hak Yeo, Chang-rok Choi",2005-12-28,2006-12-27,2010-08-31,2010-08-31,https://patents.google.com/patent/US7785649B2/en
US7790384B2,HIP1 cancer markers ,The Regents Of The University Of Michigan,"Theodora Ross, Ikuko Mizukami",2001-11-15,2007-03-08,2010-09-07,2010-09-07,https://patents.google.com/patent/US7790384B2/en
US7775370B2,Particle sorting by fluidic vectoring ,Utah State University,Barton L. Smith,2005-03-21,2006-03-21,2010-08-17,2010-08-17,https://patents.google.com/patent/US7775370B2/en
US7794778B2,Amperometric sensor for uric acid and method for the same ,Chung Yuan Christian University,"Shen-Kan Hsiung, Jung-Chuan Chou, Tai-Ping Sun, Mei-Ling Cheng",2005-08-26,2005-08-26,2010-09-14,2010-09-14,https://patents.google.com/patent/US7794778B2/en
US7781225B2,Surface layer affinity-chromatography ,University Of Sunderland,Frederick John Rowell,2003-01-20,2004-01-20,2010-08-24,2010-08-24,https://patents.google.com/patent/US7781225B2/en
US7767788B2,Folding protein functioning as a molecular switch ,The Research Foundation Of State University Of New York,"Stewart Loh, Mark C. Butler, Jeung-Hoi Ha, Tracy L. Radley",2003-03-21,2004-03-17,2010-08-03,2010-08-03,https://patents.google.com/patent/US7767788B2/en
US7786259B2,Attachment and elaboration strategies for inverse peptide synthesis ,The Curators Of The University Of Missouri,William G. Gutheil,2001-05-23,2007-07-13,2010-08-31,2010-08-31,https://patents.google.com/patent/US7786259B2/en
US7786260B1,Polypeptide fragments comprising c terminal portion of helicobacter catalase ,"Csl Limited, The University Of New South Wales","Christopher Vincent Doidge, Elizabeth Ann Webb, Linda Joy Rothel, Phillip Sutton, Stuart Lloyd Hazell",1999-10-15,2000-10-13,2010-08-31,2010-08-31,https://patents.google.com/patent/US7786260B1/en
US7790383B2,Genetic polymorphisms in the corticotropin-releasing hormone (CRH) gene as markers for improving beef marbling score and/or subcutaneous fat depth ,Washington State University Research Foundation,"Zhihua Jiang, Tito A. Wibowo, Jennifer J. Michal",2006-03-21,2007-03-21,2010-09-07,2010-09-07,https://patents.google.com/patent/US7790383B2/en
US7803919B2,Bovine ABCG2 gene missense mutations and uses thereof ,The Board Of Trustees Of The University Of Illinois,"Eyal Seroussi, Harris A. Lewin, Mark R. Band, Miri Cohen-Zinder, James K. Drackley, Denis M. Larkin, Juan J. Loor, Micha Ron, Moshe Shani, Joel Ira Weller",2005-06-28,2006-06-28,2010-09-28,2010-09-28,https://patents.google.com/patent/US7803919B2/en
US7776898B2,Opioid receptor active compounds ,The Curators Of The University Of Missouri,"William J. Welsh, Seong Jae Yu, Anil Nair",2002-02-07,2007-09-18,2010-08-17,2010-08-17,https://patents.google.com/patent/US7776898B2/en
US7768314B2,Integrated circuit with multidimensional switch topology ,National University Corporation Okayama University,"Yohei MATSUMOTO, Akira Masaki",2004-05-12,2005-03-28,2010-08-03,2010-08-03,https://patents.google.com/patent/US7768314B2/en
US7790459B2,In vitro maturation of immature human oocytes ,Mcgill University,Ri-Cheng Chian,2002-03-08,2008-01-04,2010-09-07,2010-09-07,https://patents.google.com/patent/US7790459B2/en
US7800105B2,Ga2O3 semiconductor device ,Waseda University,"Noboru Ichinose, Kiyoshi Shimamura, Kazuo Aoki, Encarnacion Antonia Garcia Villora",2004-03-12,2005-01-14,2010-09-21,2010-09-21,https://patents.google.com/patent/US7800105B2/en
US7785841B2,Methods for the early diagnosis of ovarian cancer ,Board Of Trustees Of The University Of Arkansas,Timothy J. O'Brien,1997-03-19,2004-12-15,2010-08-31,2010-08-31,https://patents.google.com/patent/US7785841B2/en
US7786310B2,Small molecule transcriptional activation domains ,The Regents Of The University Of Michigan,"Anna K. Mapp, Aaron R. Minter",2004-11-05,2005-11-07,2010-08-31,2010-08-31,https://patents.google.com/patent/US7786310B2/en
US7785825B2,"Compositions and methods for dehydration and cyclization of peptides, synthetic compounds, and lantibiotics ",The Board Of Trustees Of The University Of Illinois,"Willem A. van der Donk, Lili Xie, Champak Chatterjee, Moushumi Paul",2004-01-12,2005-01-12,2010-08-31,2010-08-31,https://patents.google.com/patent/US7785825B2/en
US7772531B2,Adaptive optics based system and method to generate and control multiple optical beams for trapping and manipulating small particles ,University Of Victoria Innovation And Development Corporation,"Colin Bradley, Rodolphe Conan",2007-10-25,2007-10-25,2010-08-10,2010-08-10,https://patents.google.com/patent/US7772531B2/en
US7767762B2,Methods for forming copolymers comprising olefin and protected or unprotected hydroxystyrene units ,University Of Massachusetts Lowell,Rudolf Faust,2004-02-11,2006-08-11,2010-08-03,2010-08-03,https://patents.google.com/patent/US7767762B2/en
US7785593B2,Antibody (11C7) anti nogo a and its pharmaceutical use ,"Novartis Ag, University Of Zurich","Carmen Barske, Anis Khusro Mir, Thomas Oertle, Lisa Schnell, Martin E. Schwab, Alessandra Vitaliti, Mauro Zurini",2002-10-12,2003-12-09,2010-08-31,2010-08-31,https://patents.google.com/patent/US7785593B2/en
US7795495B2,Transgenic mice for screening for inhibitors of protein aggregation and methods for making and using them ,The Regents Of The University Of California,"Eliezer Masliah, Edward Rockenstein, Makoto Hashimoto",2000-02-18,2007-02-15,2010-09-14,2010-09-14,https://patents.google.com/patent/US7795495B2/en
US7786147B2,Analogs of choline for neuroprotection and cognitive enhancement in neurodegenerative disorders ,"Medical College of Georgia Research Institute., University Of Georgia Research Foundation, Inc.","Jerry J. Buccafusco, Alvin V. Terry, J. Warren Beach, Rammamohanna R. Jonnala",2001-07-19,2005-03-09,2010-08-31,2010-08-31,https://patents.google.com/patent/US7786147B2/en
US7790037B2,Separation of compounds using tagging moieties including varying numbers of repeat units ,University of Pittsburgh—of the Commonwealth System of Higher Education,"Craig S. Wilcox, Dennis P. Curran",2003-06-25,2004-06-25,2010-09-07,2010-09-07,https://patents.google.com/patent/US7790037B2/en
US7795021B2,Lineage restricted glial precursors from the central nervous system ,University Of Utah Research Foundation,"Mahendra S. Rao, Mark Noble, Margot Mayer-Proschel",1997-11-29,2007-03-30,2010-09-14,2010-09-14,https://patents.google.com/patent/US7795021B2/en
US7803567B2,Methods and compositions for detecting trichomonas in a sample contacted with fixative ,"Board Of Regents, The University Of Texas System","John F. Alderete, Te-Hung Chang",2005-12-09,2006-12-06,2010-09-28,2010-09-28,https://patents.google.com/patent/US7803567B2/en
US7772368B2,"Deletion forms of IGE-dependent histamine releasing factor having histamine releasing activity, HRF-binding peptides and the uses thereof ",Ewha University-Industry Collaboration Foundation,"Kyunglim Lee, Miyoung Kim",2005-01-25,2006-01-25,2010-08-10,2010-08-10,https://patents.google.com/patent/US7772368B2/en
US7803768B2,Method for treatment of hyperglycemia in a subject in need thereof ,"Kyoto University, Daiichi Sankyo Company Limited","Kenji Kangawa, Takashi Akamizu, Taiga Irako, Shuichi Koda, Naomi Wakabayashi",2005-02-23,2006-02-23,2010-09-28,2010-09-28,https://patents.google.com/patent/US7803768B2/en
US7803560B2,Methods of screening for antagonists of mammalian monocyte chemoattractant protein receptors ,The Regents Of The University Of California,"Israel F. Charo, Shaun R. Coughlin",1994-01-13,2007-02-05,2010-09-28,2010-09-28,https://patents.google.com/patent/US7803560B2/en
US7771977B2,Alkane polyol dehydrogenase ,National University Corporation NARA Institute of Science and Technology,"Keiko Onodera, Yoshiki Tani",2006-09-29,2007-04-13,2010-08-10,2010-08-10,https://patents.google.com/patent/US7771977B2/en
US7776593B2,Hes6 as a marker of pancreatic endocrine cells ,The Regents Of The University Of California,"Fred Levine, Bjoern Tyrberg",2006-08-07,2007-08-07,2010-08-17,2010-08-17,https://patents.google.com/patent/US7776593B2/en
US7793564B2,Parallel mechanism having two rotational and one translational degrees of freedom ,Tianjin University,"Tian Huang, Haitao Liu",2006-04-30,2007-01-25,2010-09-14,2010-09-14,https://patents.google.com/patent/US7793564B2/en
US7786170B2,Histone deacetylase inhibitor enhancement of trail-induced apoptosis ,University Of South Florida,Kapil N. Bhalla,2002-12-06,2005-06-06,2010-08-31,2010-08-31,https://patents.google.com/patent/US7786170B2/en
US7794928B2,"Norovirus detection, methods and compositions therefor ",Washington University,"Herbert W. Virgin, Christiane Wobus, Stephanie Karst",2004-05-05,2008-02-04,2010-09-14,2010-09-14,https://patents.google.com/patent/US7794928B2/en
US7771761B2,Cheese with calcium lactate crystal inhibitor ,"Regents Of The University Of Minnesota, Nutricepts, Inc.","Lloyd E. Metzger, Donald A. Grindstaff",2005-08-05,2006-08-07,2010-08-10,2010-08-10,https://patents.google.com/patent/US7771761B2/en
US7801804B2,Convex parimutuel contingent claim market mechanism ,The Board Of Trustees Of The Leland Stanford Junior University,"Mark E. Peters, Yinyu Ye",2007-10-10,2007-10-10,2010-09-21,2010-09-21,https://patents.google.com/patent/US7801804B2/en
US7795026B2,Methods for obtaining human embryoid body-derived cells ,The Johns Hopkins University School Of Medicine,"Michael J. Shamblott, John D. Gearhart",2000-01-21,2001-01-22,2010-09-14,2010-09-14,https://patents.google.com/patent/US7795026B2/en
US7776569B2,"Virally-encoded RNAs as substrates, inhibitors and delivery vehicles for RNAi ",University Of Massachusetts,"Timothy F. Kowalik, Bradford M. Stadler",2003-08-22,2004-08-23,2010-08-17,2010-08-17,https://patents.google.com/patent/US7776569B2/en
US7781625B2,Process catalysed by bis-trifilmide compounds ,The Queen's University Of Belfast,"Martyn J. Earle, Barry Joseph Mcauley, Alwar Ramani, Kenneth Richard Seddon, Jillian M. Thomson",2001-03-12,2002-03-12,2010-08-24,2010-08-24,https://patents.google.com/patent/US7781625B2/en
US7793787B2,Polymers useful as medical materials ,University Of Southampton,"Hitoshi Mizomoto, Mark Bradley",2004-08-13,2005-08-11,2010-09-14,2010-09-14,https://patents.google.com/patent/US7793787B2/en
US7785834B2,Soluble TNF receptors and their use in treatment of disease ,"Ercole Biotech, Inc., University Of North Carolina At Chapel Hill, Santaris Pharma A/S","Peter L. Sazani, Maria Graziewicz, Ryszard Kole, Henrik Ørum",2005-11-10,2007-05-01,2010-08-31,2010-08-31,https://patents.google.com/patent/US7785834B2/en
US7781166B2,Methods of detecting and controlling mucoid pseudomonas biofilm production ,Marshall University Research Corporation,"Hongwei D. Yu, Dongru Qiu",2006-03-31,2007-03-29,2010-08-24,2010-08-24,https://patents.google.com/patent/US7781166B2/en
US7767195B2,Method for inducing a psychotic state in an animal and a high throughput assay method for identifying a candidate agent having anti-psychotic properties ,The Research Foundation Of State University Of New York,Andre A. Fenton,2006-05-08,2007-05-08,2010-08-03,2010-08-03,https://patents.google.com/patent/US7767195B2/en
US7772382B2,Chitosan derivative and method of producing same ,"National University Corporation Nagoya University, Daicel Chemical Industries, Ltd.","Yoshio Okamoto, Chiyo Yamamoto, Masami Kamigaito",2005-05-09,2006-04-28,2010-08-10,2010-08-10,https://patents.google.com/patent/US7772382B2/en
US7799519B2,Diagnosing and grading gliomas using a proteomics approach ,Vanderbilt University,Richard Caprioli,2005-07-07,2006-07-05,2010-09-21,2010-09-21,https://patents.google.com/patent/US7799519B2/en
US7785857B2,Protein C variant ,Saint Louis University,"Alireza R. Rezaie, Likui Yang",2006-08-31,2007-08-30,2010-08-31,2010-08-31,https://patents.google.com/patent/US7785857B2/en
US7800293B2,Field emission lamp and method for making the same ,"Tsinghua University, Hon Hai Precision Industry Co., Ltd.","Li Qian, Liang Liu, Peng Liu, Jie Tang, Yang Wei, Shou-Shan Fan",2006-03-31,2006-11-21,2010-09-21,2010-09-21,https://patents.google.com/patent/US7800293B2/en
US7790889B2,"DI-(4-vinylpyridine) metal phthalocyanine compound, composition comprising the same and preparation method thereof ",Hoseo University Academic Cooperation Foundation,"Young Goo Kang, Dae Woo Ihm, Shi Surk KIM",2008-08-20,2008-12-24,2010-09-07,2010-09-07,https://patents.google.com/patent/US7790889B2/en
US7781317B2,Method of non-catalytic formation and growth of nanowires ,"Toyota Motor Engineering & Manufacturing North America, Inc., The Regents Of The University Of California","Joshua Goldberger, Melissa Fardy, Oded Rabin, Allon Hochbaum, Minjuan Zhang, Peidong Yang",2007-01-03,2007-01-03,2010-08-24,2010-08-24,https://patents.google.com/patent/US7781317B2/en
US7786220B2,pH and temperature sensitive hydrogels ,Sungyunkwan University Foundation For Corporate Collaboration,"Doo Sung Lee, Woo Sun Shim, You Han Bae, Je Sun You, Min Sang Kim, Huynh Dai Phu",2004-01-29,2005-01-26,2010-08-31,2010-08-31,https://patents.google.com/patent/US7786220B2/en
US7772202B2,Methods for treating breast cancer using NRIF3 related molecules ,New York University,"Li Dangsheng, Sharmistha Das, Herbert Samuels",2004-02-26,2007-08-07,2010-08-10,2010-08-10,https://patents.google.com/patent/US7772202B2/en
US7781644B2,Arabidosis AtLEJ1 gene involved in inhibiting biosynthesis of jasmonic acid and ethylene and method for producing male-sterile plant using the same ,Korea University Industry and Academy Cooperation Foundation,"Jeong Sheop Shin, Kwang Wook Jung, Kyoung Shin Yoo, Mei Hua Cui, Yun Young Kim, Sung Han Ok",2006-07-14,2007-04-03,2010-08-24,2010-08-24,https://patents.google.com/patent/US7781644B2/en
US7767811B2,Kinetic resolutions of chiral 2- and 3-substituted carboxylic acids ,Brandeis University,"Li Deng, Jianfeng Hang, Liang Tang",2000-07-31,2006-06-05,2010-08-03,2010-08-03,https://patents.google.com/patent/US7767811B2/en
US7772078B2,Germanium substrate-type materials and approach therefor ,"The Board Of Trustees Of The Leland Stanford Junior University, Canon Kabushiki Kaisha","Ammar Munir Nayfeh, Chi On Chui, Krishna C. Saraswat, Takao Yonehara",2004-07-22,2008-08-26,2010-08-10,2010-08-10,https://patents.google.com/patent/US7772078B2/en
US7772367B2,C-terminal p53 palindromic peptide that induces apoptosis of cells with aberrant p53 and uses thereof ,The Trustees Of Columbia University In The City Of New York,"Robert L. Fine, Paul Brandt-Rauf, Yueha Mao",2004-01-30,2005-01-27,2010-08-10,2010-08-10,https://patents.google.com/patent/US7772367B2/en
US7781190B2,Method for constructing and modifying large DNA molecules ,The University Of Hong Kong,"Jian-Dong Huang, Xin-Mei Zhang, Julian Alexander Tanner",2003-07-24,2004-07-16,2010-08-24,2010-08-24,https://patents.google.com/patent/US7781190B2/en
US7786095B2,Amphiphilic macrocyclic derivatives and their analogues ,University College Dublin,"Raphael Darcy, Lawrence John Penkler, Bart Jan Ravoo",2000-04-28,2005-12-07,2010-08-31,2010-08-31,https://patents.google.com/patent/US7786095B2/en
US7777873B2,Refractive index sensor ,"Tsinghua University, Hon Hai Precision Industry Co., Ltd.","Xiao-Ling Wang, Guo-Fan Jin, Jun Zhu",2007-11-07,2008-08-07,2010-08-17,2010-08-17,https://patents.google.com/patent/US7777873B2/en
US7785547B2,Apparatus and method for increasing the concentration of recycled hydrogen in a high pressure hydrogenation reactor ,"Petrochina Company Limited, China University Of Petroleum Beijing","Guangjin Chen, An Ma, Lijun Yan, Xuqiang Guo, Changyu Sun, Xiulin Wang",2006-10-26,2007-10-23,2010-08-31,2010-08-31,https://patents.google.com/patent/US7785547B2/en
US7785827B2,Method and composition for leucyl-tRNA synthetases and derivatives thereof that activate and aminoacylate non-leucine amino acid to tRNA adaptor molecules ,University Of Houston System,"Susan A. Martinis, James M. Briggs, Richard S. Mursinna, Keun Woo Lee, Tommie L. Lincecum, Amy M. Williams, Yuxin Zhai",2001-09-20,2002-09-20,2010-08-31,2010-08-31,https://patents.google.com/patent/US7785827B2/en
USRE41644E1,Method for optical modulation at periodic optical structure band edges ,The Regents Of The University Of California,"William S. C. Chang, Paul K. L. Yu",2000-09-27,2006-08-03,2010-09-07,2010-09-07,https://patents.google.com/patent/USRE41644E1/en
