US7561772B2,Organic devices having a fiber structure ,The Trustees Of Princeton University,"Max Shtein, Stephen R. Forrest",2004-07-16,2007-03-19,2009-07-14,2009-07-14,https://patents.google.com/patent/US7561772B2/en
US7556969B2,Intensified neutral loss tags and use thereof in mass spectrometry ,Northeastern University,"Poguang Wang, Guodong Li, Jianxin Gao, Roger W. Giese, Xin Zhang",2002-12-19,2003-12-19,2009-07-07,2009-07-07,https://patents.google.com/patent/US7556969B2/en
US7559253B2,Method for measuring bonding force between substrate and carbon nanotube array formed thereon ,"Tsinghua University, Hon Hai Precision Industry Co., Ltd.","Kai Liu, Kai-Li Jiang, Shou-Shan Fan",2006-09-01,2007-08-30,2009-07-14,2009-07-14,https://patents.google.com/patent/US7559253B2/en
US7555840B2,Omni-directional lens in sundials and solar compasses ,The Trustees Of Columbia University In The City Of New York,Chengjun Julian Chen,2007-08-17,2007-08-17,2009-07-07,2009-07-07,https://patents.google.com/patent/US7555840B2/en
US7589719B2,Fast multi-pass partitioning via priority based scheduling ,"The Regents Of The University Of California, Pixar","John Owens, Andy Riffel, Aaron Lefohn, Kiril Vidimce, Mark Leone",2004-07-15,2005-07-15,2009-09-15,2009-09-15,https://patents.google.com/patent/US7589719B2/en
US7561089B2,Digital to analogue conversion ,University Of Westminster,"Hashem Zare-Hoseini, Izzet Kale, Richard Charles Spicer Morling",2004-12-22,2005-12-14,2009-07-14,2009-07-14,https://patents.google.com/patent/US7561089B2/en
US7566798B2,Platinum complexes and methods of use ,University Of South Florida,"Heidi Kay, Jay W. Palmer, Joseph A. Stanko",2003-08-13,2004-08-13,2009-07-28,2009-07-28,https://patents.google.com/patent/US7566798B2/en
US7572431B2,Synthesis of tetragonal phase stabilized nano and submicron sized nanoparticles ,"University Of Central Florida Research Foundation, Inc.","Sudipta Seal, Satyajit Shukla",2002-09-05,2006-08-11,2009-08-11,2009-08-11,https://patents.google.com/patent/US7572431B2/en
US7584807B2,Multiple pulsejet boring device ,The University Of Scranton,"W. Andrew Berger, Robert A. Spalletta, Jerry A. Carter, Richard M. Pell, Marian Mazurkiewicz",2005-03-31,2006-03-23,2009-09-08,2009-09-08,https://patents.google.com/patent/US7584807B2/en
US7559923B2,Method of interventional surgery ,The Regents Of The University Of California,"Kirk Patrick Seward, Albert P. Pisano",2001-09-20,2004-03-18,2009-07-14,2009-07-14,https://patents.google.com/patent/US7559923B2/en
US7595166B2,Methods of screening modulators of T2R taste receptors ,"The Regents Of The University Of California, The United States Of America As Represented By The Secretary Of The Department Of Health And Human Services","Charles Zuker, Jon E. Adler, Nick Ryba, Ken Mueller, Mark Hoon",1999-09-10,2007-10-25,2009-09-29,2009-09-29,https://patents.google.com/patent/US7595166B2/en
US7569023B2,Orthotic clubfoot device ,Washington University,Matthew Dobbs,2005-07-01,2006-06-26,2009-08-04,2009-08-04,https://patents.google.com/patent/US7569023B2/en
US7595347B2,Method for protecting normal cells from cytotoxicity of chemotherapeutic agents ,Temple University—Of the Commonwealth System of Higher Education,"Stephen C. Cosenza, M. V. Ramana Reddy, E. Premkumar Reddy",1999-10-12,2004-05-21,2009-09-29,2009-09-29,https://patents.google.com/patent/US7595347B2/en
US7565634B1,Massively parallel boolean satisfiability implication circuit ,"The Regents Of The University Of California, Santa Cruz","Mark J. Boyd, Tracy Larrabee",2004-10-20,2005-10-20,2009-07-21,2009-07-21,https://patents.google.com/patent/US7565634B1/en
US7556944B2,Methods and compositions for use in preparing siRNAs ,The Board Of Trustees Of The Leland Stanford Junior University,"Jason Myers, James Ferrell",2002-05-03,2003-04-30,2009-07-07,2009-07-07,https://patents.google.com/patent/US7556944B2/en
US7569774B2,Self-healing cable for extreme environments ,University Of Vermont And State Agricultural College,"Dryver R. Huston, Bernard R. Tolmie",2007-05-15,2007-05-15,2009-08-04,2009-08-04,https://patents.google.com/patent/US7569774B2/en
US7578939B2,Ceramic membrane water filtration ,Board Of Trustees Of Michigan State University,"Susan J. Masten, Simon H. R. Davies, Melissa Baumann, Bhavana Karnik",2004-12-09,2005-12-06,2009-08-25,2009-08-25,https://patents.google.com/patent/US7578939B2/en
US7579515B2,Increasing gamete production with a gene switch ,North Carolina State University,William L. Miller,2002-12-24,2003-12-10,2009-08-25,2009-08-25,https://patents.google.com/patent/US7579515B2/en
US7589470B2,Method and apparatus for producing plasma ,Dublin City University,"Lutfi Oksuz, Albert Rogers Ellingboe",2006-01-31,2006-01-31,2009-09-15,2009-09-15,https://patents.google.com/patent/US7589470B2/en
US7595679B1,Method and apparatus to reduce noise fluctuation in on-chip power distribution networks ,University Of Rochester,"Mikhail Popovich, Eby G. Friedman, Radu M. Secareanu, Olin L. Hartin",2005-04-12,2006-04-12,2009-09-29,2009-09-29,https://patents.google.com/patent/US7595679B1/en
US7596133B2,Apparatus and method for data transmission/reception using channel state information in wireless communication system ,"Samsung Electronics Co., Ltd, Seoul National University Industry Foundation","Yo-An Shin, Jong-won Kim",2004-05-12,2005-05-12,2009-09-29,2009-09-29,https://patents.google.com/patent/US7596133B2/en
US7569217B2,Porcine adenovirus E1 and E4 regions ,University Of Saskatchewan,Suresh K. Tikoo,2001-09-24,2002-07-19,2009-08-04,2009-08-04,https://patents.google.com/patent/US7569217B2/en
US7579114B2,Method of preparing positive electrode active material ,"Panasonic Corporation, Osaka City University","Tsutomu Ohzuku, Hiroshi Yoshizawa, Masatoshi Nagayama",2001-09-13,2006-09-14,2009-08-25,2009-08-25,https://patents.google.com/patent/US7579114B2/en
US7579773B2,Organic light-emitting device with a phosphor-sensitized fluorescent emission layer ,The Trustees Of Princeton University,"Stephen Forrest, Hiroshi Kanno",2006-06-05,2006-06-05,2009-08-25,2009-08-25,https://patents.google.com/patent/US7579773B2/en
US7583439B2,Wide-angle and broadband polarization converter ,"University Of Central Florida Research Foundation, Inc., Chi Mei Optoelectronics Corp.","Chang-Ching Tsai, Shin-Tson Wu, Wang-Yang Li, Chung-Kuang Wei",2007-08-09,2007-08-09,2009-09-01,2009-09-01,https://patents.google.com/patent/US7583439B2/en
US7585842B2,Human kunitz-type inhibitor with enhanced antifibrinolytic activity ,The Reagents Of The University Of California,"Walter Kisiel, Hitendra S. Chand, S. Paul Bajaj",2004-04-16,2006-12-28,2009-09-08,2009-09-08,https://patents.google.com/patent/US7585842B2/en
US7582442B2,Methods and compositions for using aleveolar macrophage phospholipase A2 ,The Regents Of The University Of Michigan,"James A. Shayman, Akira Abe, Miki Hiraoka",2004-03-16,2005-03-15,2009-09-01,2009-09-01,https://patents.google.com/patent/US7582442B2/en
US7574925B2,Metering and pumping devices ,University Of Southern California,Behrokh Khoshnevis,2006-11-02,2007-11-01,2009-08-18,2009-08-18,https://patents.google.com/patent/US7574925B2/en
US7557923B2,Method and system for in situ spectroscopic evaluation of an object ,University Of Kentucky Research Foundation,Robert A. Lodder,2005-09-12,2006-09-12,2009-07-07,2009-07-07,https://patents.google.com/patent/US7557923B2/en
US7581556B2,Crutch-like mobility assist device with rotatable footer assembly ,University Of Maryland,"Henry W. Haslach, Jr., James R. Borrelli",2005-12-13,2006-12-13,2009-09-01,2009-09-01,https://patents.google.com/patent/US7581556B2/en
US7569308B2,Rectangular contact lithography for circuit performance improvement and manufacture cost reduction ,The University Of Hong Kong,"Jun Wang, Alfred K. Wong, Edmund Y. Lam",2004-02-24,2005-02-24,2009-08-04,2009-08-04,https://patents.google.com/patent/US7569308B2/en
US7585490B2,Synthesis and use of nanocrystalline zeolites ,University Of Iowa Research Foundation,"Sarah Larsen, Vicki Grassian, Weiguo Song, Gonghu Li",2005-04-15,2006-04-17,2009-09-08,2009-09-08,https://patents.google.com/patent/US7585490B2/en
US7586611B2,Method and apparatus for analysis of semiconductor materials using photoacoustic spectroscopy techniques ,Dublin City University,"Donnacha Lowney, Patrick McNally, Alec Reader",2003-05-23,2004-05-21,2009-09-08,2009-09-08,https://patents.google.com/patent/US7586611B2/en
US7573579B2,Coded aperture imaging photopolarimetry ,Duke University,David J. Brady,2006-10-12,2007-10-11,2009-08-11,2009-08-11,https://patents.google.com/patent/US7573579B2/en
US7595500B2,High speed electron tunneling devices ,University Technology Center Corp,"Garret Moddel, Blake J. Eliasson",2001-05-21,2006-08-14,2009-09-29,2009-09-29,https://patents.google.com/patent/US7595500B2/en
US7578941B2,Length-based liquid-liquid extraction of carbon nanotubes using a phase transfer catalyst ,William Marsh Rice University,"Kirk J. Ziegler, Daniel J. Schmidt, Robert H. Hauge, Richard E. Smalley",2004-11-30,2005-11-29,2009-08-25,2009-08-25,https://patents.google.com/patent/US7578941B2/en
US7576535B2,Multi-compartment separation in magnetic resonance using transient steady-state free precession imaging ,The Board Of Trustees Of The Leland Stanford Junior University,Brian A. Hargreaves,2003-12-08,2003-12-08,2009-08-18,2009-08-18,https://patents.google.com/patent/US7576535B2/en
USRE40860E1,Electrostatic audio loudspeakers ,University Of Warwick,"Duncan Robert Billson, David Arthur Hutchins",2000-09-02,2000-08-28,2009-07-21,2009-07-21,https://patents.google.com/patent/USRE40860E1/en
US7585640B2,Diagnosing and monitoring inflammatory diseases by measuring complement components on white blood cells ,University Of Pittsburgh,"Joseph M. Ahearn, Susan M. Manzi, Chau-Ching Liu",2004-05-11,2005-05-11,2009-09-08,2009-09-08,https://patents.google.com/patent/US7585640B2/en
US7590437B2,Measurement of cardiac output and blood volume by non-invasive detection of indicator dilution ,Alfred E. Mann Institute For Biomedical Engineering At The University Of Southern California,"Eduardo H. Rubinstein, Oscar V. Scremin, Daniel P. Holschneider, Jean-Michel I. Maarek",2001-05-22,2004-05-17,2009-09-15,2009-09-15,https://patents.google.com/patent/US7590437B2/en
US7566787B2,Small molecule cyclin D1 ablative agents ,The Ohio State University,Ching-Shih Chen,2004-12-22,2005-12-22,2009-07-28,2009-07-28,https://patents.google.com/patent/US7566787B2/en
US7591896B2,Hydrothermal growth of hexagonal beryllium borate crystals for use in laser non-linear optical and birefringent applications and devices ,Clemson University,"Joseph W Kolis, Colin D. McMillen, Henry G. Giesber, III",2005-12-02,2006-12-04,2009-09-22,2009-09-22,https://patents.google.com/patent/US7591896B2/en
US7574497B2,System and method for an open autonomy kernel (oak) ,The John Hopkins University,"David H. Scheidt, David P. Watson, David L. Alger, Christopher B. McCubbin, Shon D. Vick",2001-06-01,2002-05-30,2009-08-11,2009-08-11,https://patents.google.com/patent/US7574497B2/en
US7577266B2,Systems and methods for interference suppression with directional sensing patterns ,The Board Of Trustees Of The University Of Illinois,"Albert S. Feng, Michael E. Lockwood, Douglas L. Jones, Charissa R. Lansing, William D. O'Brien, Bruce C. Wheeler, Robert C. Bilger",2003-04-09,2006-07-11,2009-08-18,2009-08-18,https://patents.google.com/patent/US7577266B2/en
US7556968B2,Scanning probe microscope and molecular structure change observation method ,"Kanazawa University Kanazawa-shi, Olympus Corporation","Toshio Ando, Yoshiaki Hayashi",2003-01-09,2005-06-28,2009-07-07,2009-07-07,https://patents.google.com/patent/US7556968B2/en
US7585627B2,Polymorphism in tryptophan hydroxylase-2 controls brain serotonin synthesis ,Duke University,"Marc G. Caron, Xiaodong Zhang, Martin Beaulieu, Raul R. Gainetdinov, Tatiana D. Sotnikova, Ranga R. Krishnan, David A. Schwartz, Lauranell Burch, Redford B. Williams",2004-05-21,2005-05-20,2009-09-08,2009-09-08,https://patents.google.com/patent/US7585627B2/en
US7588906B2,Hydrogels for biomolecule analysis and corresponding method to analyze biomolecules ,"Wisconsin Alumni Research Foundation, The University Of Chicago","Shawn B. Brueggemeier, Stephen J. Kron, Sean P. Palecek, Laurie Parker, Stephen Brian Henry Kent",2004-02-24,2005-12-16,2009-09-15,2009-09-15,https://patents.google.com/patent/US7588906B2/en
US7583039B2,Brushless DC motor control method and brushless DC motor controller ,"Shanghai Sanden Behr Automotive A/C Co., Ltd., East China University Of Science And Technology","Minxian Zhong, Bin He, Xiaodong Yao, Junzhong Zou",2003-12-30,2004-12-29,2009-09-01,2009-09-01,https://patents.google.com/patent/US7583039B2/en
US7582365B2,Reversibly reducible metal complexes as electron transporting materials for OLEDs ,"Universal Display Corporation, The University Of Southern California","Robert Walters, Raymond Kwong, Mark E. Thompson",2005-01-10,2005-01-10,2009-09-01,2009-09-01,https://patents.google.com/patent/US7582365B2/en
US7572747B2,Optical glass ,"Alfred University, Kyocera Corporation","Alexis G. Clare, Tatsuji Furuse, Matthew Hall",2007-09-27,2008-09-26,2009-08-11,2009-08-11,https://patents.google.com/patent/US7572747B2/en
US7592583B2,Photosensor with customizable angular-response characteristics ,The Regents Of The University Of California,"Erik Page, Keith Graeber, Konstantinos Papamichael, Michael Siminovitch",2007-02-07,2008-02-07,2009-09-22,2009-09-22,https://patents.google.com/patent/US7592583B2/en
US7596545B1,Automated data entry system ,University Of Kansas,"Danico Lee, Constantinos Tsatsoulis, Steven M. Perry",2004-08-27,2005-08-29,2009-09-29,2009-09-29,https://patents.google.com/patent/US7596545B1/en
US7572599B2,"Metalloprotease activation of myostatin, and methods of modulating myostatin activity ","The Johns Hopkins University School Of Medicine, Wisconsin Alumni Research Foundation, Wyeth","Se-Jin Lee, Alexandra C. McPherron, Daniel S. Greenspan, William N. Pappano, Neil Wolfman, Kathy Tomkinson",2002-09-16,2003-09-16,2009-08-11,2009-08-11,https://patents.google.com/patent/US7572599B2/en
US7576147B2,Cellulosic biomass soy flour based biocomposites and process for manufacturing thereof ,Board Of Trustees Of Michigan State University,"Lawrence T. Drzal, Amar K. Mohanty, Wanjun Liu, Kelby Thayer, Manjusri Misra",2004-08-27,2005-08-26,2009-08-18,2009-08-18,https://patents.google.com/patent/US7576147B2/en
US7557293B2,Thermophotovoltaic power supply ,National University Of Singapore,"Siaw Kiang Chou, Chang Shu, Wen Ming Yang, Hong Xue, Zhi Wang Li",2003-12-03,2003-12-03,2009-07-07,2009-07-07,https://patents.google.com/patent/US7557293B2/en
US7563388B2,"Crosslinked liquid crystalline polymer, method for the preparation thereof, and articles derived therefrom ",The University Of Connecticut,"Patrick T. Mather, Haihu Qin",2004-08-27,2005-08-16,2009-07-21,2009-07-21,https://patents.google.com/patent/US7563388B2/en
US7569542B2,Anti-microbial targeting chimeric pharmaceutical ,The Regents Of The University Of California,"Randal Eckert, Fengxia Qi, Wenyuan Shi, Maxwell H. Anderson",1999-08-20,2003-11-12,2009-08-04,2009-08-04,https://patents.google.com/patent/US7569542B2/en
US7592159B2,Antibiotic alternatives ,"Iowa State University Research Foundation, Inc.",Chad H. Stahl,2004-03-15,2006-01-06,2009-09-22,2009-09-22,https://patents.google.com/patent/US7592159B2/en
US7569637B2,Carbon nanotube reinforced polymer and process for preparing the same ,"Stichting Dutch Polymer Institute, Ben-Gurion University Of The Negev Research And Development Authority","Cornelis E. Koning, Oren Regev, Joachim Loos",2003-02-13,2004-02-12,2009-08-04,2009-08-04,https://patents.google.com/patent/US7569637B2/en
US7557142B2,Therapeutic use of methionine to reduce the toxicity of platinum-containing anti-tumor compounds ,Board Of Trustees Of Southern Illinois University,Kathleen C. M. Campbell,1996-10-03,2003-10-27,2009-07-07,2009-07-07,https://patents.google.com/patent/US7557142B2/en
US7560253B1,HLS-5 tumor suppressor factor ,The University Of Western Australia,"Svend Peter Klinken, Jean-Philippe Lalonde, James Howard Williams",1999-11-24,2000-11-24,2009-07-14,2009-07-14,https://patents.google.com/patent/US7560253B1/en
US7589176B2,Antifungal polypeptides ,"Pioneer Hi-Bred International, Inc., E. I. Du Pont De Nemours And Company, The Regents Of The University Of California","Daniel J. Altier, Irina Ellanskaya, Jacob T. Gilliam, Jennie Hunter-Cevera, James K. Presnail, Eric Schepers, Carl R. Simmons, Tamas Torok, Nasser Yalpani",2006-01-25,2007-01-24,2009-09-15,2009-09-15,https://patents.google.com/patent/US7589176B2/en
US7557657B2,Variable gain amplifier with wide gain variation and wide bandwidth ,"Samsung Electro-Mechanics Co., Ltd., Information And Communications University Research And Industrial Cooperation Group","Hoang Duong Quoc, Sang Gug Lee, Jeong Hoon Kim, Tah Joon Park, Eung Ju Kim",2006-07-10,2007-07-09,2009-07-07,2009-07-07,https://patents.google.com/patent/US7557657B2/en
US7565920B2,Woven fabric with moisture management properties ,The Hong Kong Polytechnic University,"Yi Li, Jun-Yan Hu",2003-11-07,2006-09-15,2009-07-28,2009-07-28,https://patents.google.com/patent/US7565920B2/en
US7562403B2,Hospital bed apparatus for turning and repositioning plus shifting a patient to another bed ,Southern Taiwan University Of Technology,"Ching-Hua Wei, Ting-Chun Tung, Zhi-Hao Shi, Whai-Shen Chen, Shen-Yuan Lin",2006-01-04,2007-01-03,2009-07-21,2009-07-21,https://patents.google.com/patent/US7562403B2/en
US7572355B1,Electrochemistry using permanent magnets with electrodes embedded therein ,Board Of Trustees Of The University Of Arkansas,"Prabhu U. Arumugam, Ingrid Fritsch",2004-01-07,2005-01-07,2009-08-11,2009-08-11,https://patents.google.com/patent/US7572355B1/en
US7582173B2,Monolithic metallic glasses with enhanced ductility ,Yonsei University,"Eun Soo Park, Jong Hyun Na, Hye Jung Chang, Ju Yeon Lee, Byung Joo Park, Won Tae Kim, Do Hyang Kim",2005-04-19,2005-06-02,2009-09-01,2009-09-01,https://patents.google.com/patent/US7582173B2/en
US7572173B2,Polishing apparatus and pad replacing method thereof ,National Taiwan University Of Science And Technology,"Shiuh-Jer Huang, Guang-Ling He, Shu-Yi Lin",2006-11-24,2007-08-20,2009-08-11,2009-08-11,https://patents.google.com/patent/US7572173B2/en
US7592486B2,Anhydrous fluoride salts and reagents and methods for their production ,Board Of Regents Of The University Of Nebraska,"Stephen G. DiMagno, Haoran Sun",2004-09-16,2005-09-15,2009-09-22,2009-09-22,https://patents.google.com/patent/US7592486B2/en
US7556970B2,"Method of repairing damaged film having low dielectric constant, semiconductor device fabricating system and storage medium ","Tokyo Electron Limited, National University Corporation, Nagoya University","Masaru Hori, Kazuhiro Kubota",2006-03-27,2007-03-26,2009-07-07,2009-07-07,https://patents.google.com/patent/US7556970B2/en
US7590216B2,Cone beam local tomography ,"University Of Central Florida Research Foundation, Inc.",Alexander Katsevich,2005-12-28,2006-10-13,2009-09-15,2009-09-15,https://patents.google.com/patent/US7590216B2/en
US7570734B2,Method and apparatus for X-ray image correction ,"J. Morita Manufacturing Corporation, Nihon University","Yoshinori Arai, Masakazu Suzuki",2003-07-25,2004-07-19,2009-08-04,2009-08-04,https://patents.google.com/patent/US7570734B2/en
US7570202B2,Polarimetric selectivity method for suppressing cross-track clutter in sounding radars ,The Johns Hopkins University,Russell K. Raney,2007-05-16,2008-05-16,2009-08-04,2009-08-04,https://patents.google.com/patent/US7570202B2/en
US7575858B2,Method of visualizing proteins bound to protein-binding membranes ,Temple University—Of the Commonwealth System of Higher Education,"Christopher R. Yonan, Frank N. Chang",2002-09-11,2003-09-09,2009-08-18,2009-08-18,https://patents.google.com/patent/US7575858B2/en
US7572912B2,"Luminescent gold (III) compounds, their preparation, and light-emitting devices containing same ",University Of Hong Kong,"Vivian Wing-Wah Yam, Man-Chung Wong, Hoi-Sing Kwok, Xiuling Zhu",2004-10-29,2004-10-29,2009-08-11,2009-08-11,https://patents.google.com/patent/US7572912B2/en
US7566449B2,Method and composition for inhibition of angiogenesis using antagonists based on MMP-9 and β1 integrins ,University Of Southern California,"Peter C. Brooks, Dorothy Rodriguez",1999-07-13,2005-03-25,2009-07-28,2009-07-28,https://patents.google.com/patent/US7566449B2/en
US7592001B2,High aspect ratio metal particles and methods for forming same ,"University Of Florida Research Foundation, Inc.","Kevin William Powers, Marie Kissinger",2004-08-02,2004-08-02,2009-09-22,2009-09-22,https://patents.google.com/patent/US7592001B2/en
US7556806B2,Carbohydrate-based synthetic vaccines for HIV ,University Of Maryland Biotechnology Institute,Lai-Xi Wang,2002-10-11,2003-10-14,2009-07-07,2009-07-07,https://patents.google.com/patent/US7556806B2/en
US7562324B2,Method of designing a synchronous circuit of VLSI for clock skew scheduling and optimization ,Chang Gung University,"Chao-Kai Chang, Chia-Chi Chu, Wu-Shiung Feng",2006-11-09,2006-11-09,2009-07-14,2009-07-14,https://patents.google.com/patent/US7562324B2/en
US7575744B2,Composition and method for inhibition of microorganisms ,"University Of Georgia Research Foundation, Inc.","Michael P. Doyle, Tong Zhao",2002-11-25,2003-11-24,2009-08-18,2009-08-18,https://patents.google.com/patent/US7575744B2/en
US7563572B2,Method for long range allele-specific PCR ,University Of Utah Research Foundation,"Genevieve Pont-Kingdon, Elaine Lyon",2004-08-02,2005-08-01,2009-07-21,2009-07-21,https://patents.google.com/patent/US7563572B2/en
US7588657B2,Pattern-free method of making line gratings ,Princeton University,"William B Russel, Stephen Y Chou, Leonard F Pease, III, Parikshit A Deshpande",2003-09-29,2004-09-29,2009-09-15,2009-09-15,https://patents.google.com/patent/US7588657B2/en
US7574360B2,Unit selection module and method of chinese text-to-speech synthesis ,National Cheng Kung University,"Chung Hsien Wu, Jiun Fu Chen, Chi Chun Hsia, Jhing Fa Wang",2004-11-04,2005-07-22,2009-08-11,2009-08-11,https://patents.google.com/patent/US7574360B2/en
US7585957B2,Site specific system for generating diversity protein sequences ,"The Regents Of The University Of California, Avidbiotics Corp","Jeffery F. Miller, Sergei Doulatov, Asher Hodes, Min Xu, Mari Gingery, David W. Martin, Jr.",2004-08-03,2005-08-03,2009-09-08,2009-09-08,https://patents.google.com/patent/US7585957B2/en
US7572313B2,Ternary carbide and nitride composites having tribological applications and methods of making same ,Drexel University,"Thirumalai G. Palanisamy, Surojit Gupta, Michel Barsoum, Chien-Wei Li",2004-05-26,2005-05-10,2009-08-11,2009-08-11,https://patents.google.com/patent/US7572313B2/en
US7589941B2,Fault current limiter having superconducting bypass reactor for simultaneous quenching ,"Industry-Academic Cooperation Foundation, Yonsei University","Dong-Keun Park, Min-Choel Ahn, Seong-Eun Yang, Tae-Kuk Ko",2006-03-02,2006-12-06,2009-09-15,2009-09-15,https://patents.google.com/patent/US7589941B2/en
US7588953B2,Method of fabricating porous aluminum oxide mold having sub-micron structure and methods of imprinting to make LEDS using the mold ,National Central University,"Yeeu-Chang Lee, Shen-Hang Tu, Jyh-Chen Chen, Jenq Yang Chang",2006-12-14,2007-03-09,2009-09-15,2009-09-15,https://patents.google.com/patent/US7588953B2/en
US7594978B2,Apparatus for continuous coking refining ,The University Of Wyoming Research Corporation,"Lee E. Brecher, Lyle A. Johnson, Jr., Vijay K. Sethi",1999-11-24,2005-11-01,2009-09-29,2009-09-29,https://patents.google.com/patent/US7594978B2/en
US7575735B2,Metal oxide and metal fluoride nanostructures and methods of making same ,The Research Foundation Of State University Of New York,"Stanislaus S. Wong, Yuanbing Mao",2005-11-02,2006-11-02,2009-08-18,2009-08-18,https://patents.google.com/patent/US7575735B2/en
US7591707B2,"Underwire assembly for brassiere, brassiere using the same, and process for producing and wearing the brassiere ",The Hong Kong Polytechnic University,"Winnie Yu, Jintu Fan, Rong Zheng",2006-06-14,2006-06-14,2009-09-22,2009-09-22,https://patents.google.com/patent/US7591707B2/en
US7572743B2,Low temperature methods for forming patterned electrically conductive thin films and patterned articles therefrom ,"University Of Florida Research Foundation, Inc.","Andrew Gabriel Rinzler, Zhuangchun Wu",2005-09-21,2006-09-21,2009-08-11,2009-08-11,https://patents.google.com/patent/US7572743B2/en
US7595407B2,Boron complexation strategy for use in manipulating 1-acyldipyrromethanes ,North Carolina State University,"Jonathan S. Lindsey, Kannan Muthukumaran, Marcin Ptaszek, H. Z. Syeda Huma",2004-06-18,2007-08-29,2009-09-29,2009-09-29,https://patents.google.com/patent/US7595407B2/en
US7585482B2,Method and apparatus for producing carbon nanotubes ,The Board Of Regents Of The University Of Oklahoma,"Daniel E. Resasco, Boonyarach Kitiyanan, Walter Alvarez, Leandro Balzano",2000-06-02,2005-10-17,2009-09-08,2009-09-08,https://patents.google.com/patent/US7585482B2/en
US7561726B2,Automated landmark extraction from three-dimensional whole body scanned data ,National Tsing Hua University,"Jun-Ming Lu, Mao-Jiun Wang",2004-12-09,2005-08-05,2009-07-14,2009-07-14,https://patents.google.com/patent/US7561726B2/en
US7569341B2,Nucleic acid directed immobilization arrays and methods of assembly ,Trustees Of Boston University,"Christof M. Niemeyer, Charles R. Cantor, Takeshi Sano, Cassandra L. Smith",1994-01-31,1997-11-07,2009-08-04,2009-08-04,https://patents.google.com/patent/US7569341B2/en
