search URL:,https://patents.google.com/?assignee=university&country=US&language=ENGLISH&before=publication:20060701&after=publication:20060401&status=GRANT&type=PATENT
id,title,assignee,inventor/author,priority date,filing/creation date,publication date,grant date,result link
US7025425B2,"Method, system, and computer program product for the evaluation of glycemic control in diabetes from self-monitoring data ",University Of Virginia Patent Foundation,"Boris P. Kovatchev, Daniel J. Cox",2000-03-29,2001-03-29,2006-04-11,2006-04-11,https://patents.google.com/patent/US7025425B2/en
US7029475B2,Spinal stabilization method ,Yale University,Manohar M. Panjabi,2003-05-02,2004-04-30,2006-04-18,2006-04-18,https://patents.google.com/patent/US7029475B2/en
US7058873B2,Encoding method using a low density parity check code with a column weight of two ,Carnegie Mellon University,"Hongwei Song, Vijayakumar Bhagavatula, JingFeng Liu",2002-11-07,2002-11-07,2006-06-06,2006-06-06,https://patents.google.com/patent/US7058873B2/en
US7027848B2,Apparatus and method for non-invasive spectroscopic measurement of analytes in tissue using a matched reference analyte ,"Inlight Solutions, Inc., University Of New Mexico","Mark Ries Robinson, Cliona Fleming, Howland Jones, Mark Rohrscheib",2002-04-04,2002-04-04,2006-04-11,2006-04-11,https://patents.google.com/patent/US7027848B2/en
US7045337B2,In vivo incorporation of unnatural amino acids ,"The Scripps Research Institute, The Regents Of The University Of California","Peter Schultz, Lei Wang, John Christopher Anderson, Jason William Chin, David R. Liu, Thomas J. Magliery, Eric L. Meggers, Ryan A. Mehl, Miro Pastrnak, Steven William Santoro, Zhiwen Zhang",2001-04-19,2002-04-19,2006-05-16,2006-05-16,https://patents.google.com/patent/US7045337B2/en
US7066879B2,Insertable device and system for minimal access procedure ,The Trustees Of Columbia University In The City Of New York,"Dennis L. Fowler, Peter K. Allen, Andrew T. Miller",2003-07-15,2003-07-15,2006-06-27,2006-06-27,https://patents.google.com/patent/US7066879B2/en
US7024235B2,"Specially configured nasal pulse oximeter/photoplethysmography probes, and combined nasal probe/cannula, selectively with sampler for capnography, and covering sleeves for same ","University Of Florida Research Foundation, Inc., Beta Biomed Services, Inc.","Richard J. Melker, Joachim S. Gravenstein, George Worley",2002-06-20,2003-12-30,2006-04-04,2006-04-04,https://patents.google.com/patent/US7024235B2/en
US7045108B2,Method for fabricating carbon nanotube yarn ,"Tsinghua University, Hon Hai Precision Ind. Co., Ltd.","KaiLi Jiang, Shoushan Fan, QunQing Li",2002-09-16,2002-12-31,2006-05-16,2006-05-16,https://patents.google.com/patent/US7045108B2/en
US7033603B2,Drug releasing biodegradable fiber for delivery of therapeutics ,Board Of Regents The University Of Texas,"Kevin D. Nelson, Brent B. Crow",1999-08-06,2003-05-02,2006-04-25,2006-04-25,https://patents.google.com/patent/US7033603B2/en
US7037687B2,Method of determining the nucleotide sequence of oligonucleotides and DNA molecules ,"Arizona Board Of Regents, University Of Alberta","Peter Williams, Mark A. Hayes, Seth D. Rose, Linda B. Bloom, Linda J. Reha-Krantz, Vincent B. Pizziconi",1998-05-01,2002-08-28,2006-05-02,2006-05-02,https://patents.google.com/patent/US7037687B2/en
US7056455B2,Process for the preparation of nanostructured materials ,Carnegie Mellon University,"Krzysztof Matyjaszewski, Tomasz Kowalewski, David N. Lambeth, James Spanswick, Nicolay V. Tsarevsky",2001-04-06,2002-04-06,2006-06-06,2006-06-06,https://patents.google.com/patent/US7056455B2/en
US7023735B2,Methods of increasing the reliability of a flash memory ,Ramot At Tel-Aviv University Ltd.,"Amir Ban, Simon Litsyn, Idan Alrod",2003-06-17,2004-06-16,2006-04-04,2006-04-04,https://patents.google.com/patent/US7023735B2/en
US7058628B1,Method for node ranking in a linked database ,The Board Of Trustees Of The Leland Stanford Junior University,Lawrence Page,1997-01-10,2001-07-02,2006-06-06,2006-06-06,https://patents.google.com/patent/US7058628B1/en
US7048014B2,Methods for creating woven devices ,"Board Of Regents, The University Of Texas System","Hideki Hyodoh, Andras Konya, Kenneth C. Wright",1999-02-01,2002-09-16,2006-05-23,2006-05-23,https://patents.google.com/patent/US7048014B2/en
US7054064B2,Optical polarizer and method for fabricating such optical polarizer ,"Tsinghua University, Hon Hai Precision Ind. Co., Ltd.","Kai-Li Jiang, Shou-Shan Fan, Qun-Qing Li",2002-09-10,2002-12-31,2006-05-30,2006-05-30,https://patents.google.com/patent/US7054064B2/en
US7022831B1,Regulation of BCL-2 gene expression ,The Trustees Of The University Of Pennsylvania,John C. Reed,1988-12-22,1999-08-17,2006-04-04,2006-04-04,https://patents.google.com/patent/US7022831B1/en
US7061622B2,Aspects of basic OCT engine technologies for high speed optical coherence tomography and light source and other improvements in optical coherence tomography ,"Case Western Reserve University, University Hospitals Of Cleveland","Andrew M. Rollins, Joseph A. Izatt, Volker Westphal, Siavash Yazdanfar",2001-08-03,2002-08-05,2006-06-13,2006-06-13,https://patents.google.com/patent/US7061622B2/en
US7041481B2,Chemical amplification based on fluid partitioning ,The Regents Of The University Of California,"Brian L. Anderson, Billy W. Colston, Jr., Chris Elkin",2003-03-14,2003-03-14,2006-05-09,2006-05-09,https://patents.google.com/patent/US7041481B2/en
US7022077B2,Systems and methods for making noninvasive assessments of cardiac tissue and parameters ,"Allez Physionix Ltd., University Of Washington","Pierre D. Mourad, Michel Kliot, Rex Patterson, Alec Rooke",2000-11-28,2003-07-01,2006-04-04,2006-04-04,https://patents.google.com/patent/US7022077B2/en
US7048999B2,Method for producing self-assembled objects comprising single-wall carbon nanotubes and compositions thereof ,Wiiliam Marsh Rice University,"Richard E. Smalley, Daniel T. Colbert, Hongjie Dai, Jie Liu, Andrew G. Rinzler, Jason H. Hafner, Kenneth A. Smith, Ting Guo, Pavel Nikolaev, Andreas Thess",1997-03-07,2001-12-28,2006-05-23,2006-05-23,https://patents.google.com/patent/US7048999B2/en
US7025746B2,Vascular access device ,Yale University,Michael Tal,2001-12-26,2002-12-24,2006-04-11,2006-04-11,https://patents.google.com/patent/US7025746B2/en
US7047055B2,Fetal pulse oximetry ,"The General Hospital Corporation, The University","David Alan Boas, Anna Zourabian",2000-01-28,2001-01-26,2006-05-16,2006-05-16,https://patents.google.com/patent/US7047055B2/en
US7042615B2,Electrochromic devices based on lithium insertion ,The Regents Of The University Of California,Thomas J. Richardson,2002-05-17,2003-05-19,2006-05-09,2006-05-09,https://patents.google.com/patent/US7042615B2/en
US7066173B2,Medical ventilator and method of controlling same ,"University Of Florida Research Foundation, Inc.","Michael J. Banner, Paul B. Blanch, Neil R. Euliano, Jose C. Principe",1999-06-30,2003-04-04,2006-06-27,2006-06-27,https://patents.google.com/patent/US7066173B2/en
US7053737B2,Stress bimorph MEMS switches and methods of making same ,"Hrl Laboratories, Llc, The Regents Of The University Of California","Robert N. Schwartz, Ming Wu, Tsung-Yuan Hsu, Adele E. Schmitz, Robert Y. Loo, James H. Schaffner, Gregory L. Tangonan",2001-09-21,2002-09-19,2006-05-30,2006-05-30,https://patents.google.com/patent/US7053737B2/en
US7041077B2,Uveoscleral drainage device ,Yale University,Milton B. Shields,2002-07-19,2003-07-21,2006-05-09,2006-05-09,https://patents.google.com/patent/US7041077B2/en
US7068874B2,Microfluidic sorting device ,The Regents Of The University Of California,"Mark Wang, Erhan Polatkan Ata, Sadik C. Esener",2000-11-28,2004-05-18,2006-06-27,2006-06-27,https://patents.google.com/patent/US7068874B2/en
US7061856B2,Data throughput over lossy communication links ,The Board Of Trustees Of The Leland Stanford Junior University,Debarag N. Banerjee,2001-02-05,2002-02-05,2006-06-13,2006-06-13,https://patents.google.com/patent/US7061856B2/en
US7042184B2,Microrobot for surgical applications ,Board Of Regents Of The University Of Nebraska,"Dmitry Oleynikov, Shane Farritor, Adnan Hadzialic, Stephen R. Platt",2003-07-08,2003-07-08,2006-05-09,2006-05-09,https://patents.google.com/patent/US7042184B2/en
US7058197B1,Multi-variable model for identifying crop response zones in a field ,Board Of Trustees Of The University Of Illinois,"John Dennis McGuire, Randall Scott Pearson",1999-11-04,1999-11-04,2006-06-06,2006-06-06,https://patents.google.com/patent/US7058197B1/en
US7048903B2,Macroscopically manipulable nanoscale devices made from nanotube assemblies ,William Marsh Rice University,"Daniel T. Colbert, Hongjie Dai, Jason H. Hafner, Andrew G. Rinzler, Richard E. Smalley, Jie Liu, Kenneth A. Smith, Ting Guo, Pavel Nikolaev, Andreas Thess",1996-08-08,2001-11-30,2006-05-23,2006-05-23,https://patents.google.com/patent/US7048903B2/en
US7067456B2,Sorbent for separation of carbon dioxide (CO2) from gas mixtures ,The Ohio State University,"Liang-Shih Fan, Himanshu Gupta",2003-02-06,2003-02-06,2006-06-27,2006-06-27,https://patents.google.com/patent/US7067456B2/en
US7060641B2,Diamond-silicon carbide composite ,The Regents Of The University Of California,"Jiang Qian, Yusheng Zhao",2003-05-30,2005-04-19,2006-06-13,2006-06-13,https://patents.google.com/patent/US7060641B2/en
US7021173B2,Remote center of motion robotic system and method ,The John Hopkins University,"Dan Stoianovici, Louis L. Whitcomb, Dumitru Mazilu, Russell H. Taylor, Louis R. Kavoussi",2002-02-06,2003-02-06,2006-04-04,2006-04-04,https://patents.google.com/patent/US7021173B2/en
US7030989B2,Wavelength tunable surface plasmon resonance sensor ,University Of Washington,"Paul Yager, Elain S. Fu",2002-10-28,2003-10-28,2006-04-18,2006-04-18,https://patents.google.com/patent/US7030989B2/en
US7031308B2,Tree-based ordered multicasting method ,The Regents Of The University Of California,"J. J. Garcia-Luna-Aceves, Hans-Peter Dommel",2000-10-30,2001-10-30,2006-04-18,2006-04-18,https://patents.google.com/patent/US7031308B2/en
US7033570B2,Solar-thermal fluid-wall reaction processing ,"Regents Of The University Of Colorado, Midwest Research Institute","Alan W. Weimer, Jaimee K. Dahl, Allan A. Lewandowski, Carl Bingham, Karen J. Raska Buechler, Willy Grothe",2000-05-08,2003-03-07,2006-04-25,2006-04-25,https://patents.google.com/patent/US7033570B2/en
US7065975B1,Ice dispenser for refrigerator with bottom mount freezer ,"Iowa State University Research Foundation, Inc., Maytag Corporation","Steven G. Herndon, Bill Koons, Steven L. Devlin, John A. Roberts, Anna M. Jones",2004-07-06,2004-07-06,2006-06-27,2006-06-27,https://patents.google.com/patent/US7065975B1/en
US7022896B1,Methods and materials for making and using transgenic dicamba-degrading organisms ,Board Of Regents Of University Of Nebraska,"Donald P. Weeks, Xiao-Zhuo Wang, Patricia L. Herman",1997-04-04,1998-04-03,2006-04-04,2006-04-04,https://patents.google.com/patent/US7022896B1/en
US7053063B2,Controlled electroporation and mass transfer across cell membranes in tissue ,The Regents Of The University Of California,"Boris Rubinsky, Yong Huang",1999-07-21,2005-05-26,2006-05-30,2006-05-30,https://patents.google.com/patent/US7053063B2/en
US7068878B2,Optical beam scanning system for compact image display or image acquisition ,University Of Washington,"Janet Crossman-Bosworth, Eric J. Seibel, Mark E. Fauver",2003-01-24,2004-01-23,2006-06-27,2006-06-27,https://patents.google.com/patent/US7068878B2/en
US7046639B2,System and method for ad hoc network access employing the distributed election of a shared transmission schedule ,The Regents Of The University Of California,"J. J. Garcia-Luna-Aceves, Lichun Bao",2000-09-29,2001-09-28,2006-05-16,2006-05-16,https://patents.google.com/patent/US7046639B2/en
US7052668B2,Process utilizing seeds for making single-wall carbon nanotubes ,William Marsh Rice University,"Richard E. Smalley, Robert H. Hauge, Peter Athol Willis, W. Carter Kittrell",2001-01-31,2002-01-29,2006-05-30,2006-05-30,https://patents.google.com/patent/US7052668B2/en
US7034647B2,Integrated magnetics for a DC-DC converter with flexible output inductor ,Northeastern University,"Liang Yan, Dayu Qu, Bradley Lehman",2001-10-12,2002-10-15,2006-04-25,2006-04-25,https://patents.google.com/patent/US7034647B2/en
US7063860B2,Application of lipid vehicles and use for drug delivery ,University Of Pittsburgh,"Michael B. Chancellor, Matthew O. Fraser, Yao-Chi Chuang, William C. de Groat, Leaf Huang, Naoki Yoshimura",2001-08-13,2002-08-13,2006-06-20,2006-06-20,https://patents.google.com/patent/US7063860B2/en
US7044135B2,Device and method for forming a circumferential conduction block in a pulmonary vein ,The Regents Of The University Of California,Michael D. Lesh,1997-05-09,2002-08-30,2006-05-16,2006-05-16,https://patents.google.com/patent/US7044135B2/en
US7062913B2,Heat engine ,The Ohio State University,"Richard N. Christensen, Jiming Cao, E. Thomas Henkel",1999-12-17,2000-12-15,2006-06-20,2006-06-20,https://patents.google.com/patent/US7062913B2/en
US7063377B2,Hood lift mechanisms utilizing active materials and methods of use ,"General Motors Corporation, University Of Michigan","Diann Brei, John Redmond, Nathan A. Wilmot, Alan L. Browne, Nancy L. Johnson, Gary L. Jones",2004-08-06,2004-08-06,2006-06-20,2006-06-20,https://patents.google.com/patent/US7063377B2/en
US7026500B2,Halogenated selective androgen receptor modulators and methods of use thereof ,University Of Tennessee Research Foundation,"James T. Dalton, Duane D. Miller, Mitchell S. Steiner, Karen A. Veverka",2000-08-24,2003-02-24,2006-04-11,2006-04-11,https://patents.google.com/patent/US7026500B2/en
US7022506B2,"Method and device for treating osteoarthritis, cartilage disease, defects and injuries in the human knee ",The Trustees Of The University Of Pennsylvania,"Carl T. Brighton, Solomon R. Pollack",2000-02-23,2003-06-09,2006-04-04,2006-04-04,https://patents.google.com/patent/US7022506B2/en
US7053610B2,Squid detected NMR and MRI at ultralow fields ,The Regents Of Th University Of California,"John Clarke, Robert McDermott, Alexander Pines, Andreas Heinz Trabesinger",2002-02-06,2004-11-22,2006-05-30,2006-05-30,https://patents.google.com/patent/US7053610B2/en
US7056339B2,Drug delivery platform ,The Board Of Trustees Of The Leland Stanford Junior University,"Christopher J. Elkins, Michael D. Dake, Jacob M. Waugh",2001-04-20,2002-03-11,2006-06-06,2006-06-06,https://patents.google.com/patent/US7056339B2/en
US7046934B2,Optical communication system using a high altitude tethered balloon ,The Johns Hopkins University,"Surjit S. Badesha, Andrew D. Goldfinger, Thomas W. Jerardi",2000-01-10,2002-07-03,2006-05-16,2006-05-16,https://patents.google.com/patent/US7046934B2/en
US7052854B2,Application of nanotechnology and sensor technologies for ex-vivo diagnostics ,"University Of Florida Research Foundation, Inc.","Richard J. Melker, Ronald L. Hayes, Ka-Wang Kevin Wang, Donn Michael Dennis",2001-05-23,2003-10-02,2006-05-30,2006-05-30,https://patents.google.com/patent/US7052854B2/en
US7048723B1,Surface micromachined microneedles ,The University Of Utah Research Foundation,"A. Bruno Frazier, John D. Brazzle",1998-09-18,1999-09-17,2006-05-23,2006-05-23,https://patents.google.com/patent/US7048723B1/en
US7030997B2,Characterizing aberrations in an imaging lens and applications to visual testing and integrated circuit mask analysis ,The Regents Of The University Of California,"Andrew R. Neureuther, Kostas Adam, Garth C. Robins, Frank E. Gennari",2001-09-11,2002-09-10,2006-04-18,2006-04-18,https://patents.google.com/patent/US7030997B2/en
US7047078B2,"Methods for stimulating components in, on, or near the pudendal nerve or its branches to achieve selective physiologic responses ",Case Western Reserve University,"W. Boggs II Joseph, Brian J. Wenzel, Kenneth J. Gustafson, Warren M. Grill",2001-03-30,2003-09-12,2006-05-16,2006-05-16,https://patents.google.com/patent/US7047078B2/en
US7047169B2,Method for optimizing a solution set ,The Board Of Trustees Of The University Of Illinois,"Martin Pelikan, David E. Goldberg",2001-01-18,2002-01-18,2006-05-16,2006-05-16,https://patents.google.com/patent/US7047169B2/en
US7024404B1,Retrieval and display of data objects using a cross-group ranking metric ,The State University Rutgers,"Apostolos Gerasoulis, Wei Wang, Hyun-Ju Seo",2002-05-28,2002-05-28,2006-04-04,2006-04-04,https://patents.google.com/patent/US7024404B1/en
US7023209B2,Method and apparatus for magnetic resonance imaging and spectroscopy using microstrip transmission line coils ,Regents Of The University Of Minnesota,"Xiaoliang Zhang, Kamil Ugurbil, Wei Chen",2000-10-09,2001-10-09,2006-04-04,2006-04-04,https://patents.google.com/patent/US7023209B2/en
US7052545B2,High throughput screening of crystallization of materials ,"California Institute Of Technology, The Regents Of The University Of California","Stephen R. Quake, Carl L. Hansen",2001-04-06,2001-06-22,2006-05-30,2006-05-30,https://patents.google.com/patent/US7052545B2/en
US7058691B1,System for wireless push and pull based services ,Trustees Of Princeton University,"Shun Zheng Yu, Hisashi Kobayashi",2000-06-12,2000-06-12,2006-06-06,2006-06-06,https://patents.google.com/patent/US7058691B1/en
US7060811B2,WWOX: a tumor suppressor gene mutated in multiple cancers ,"Board Of Regents, The University Of Texas System","C. Marcelo Aldaz, Andrzej Bednarek",2000-10-13,2001-10-15,2006-06-13,2006-06-13,https://patents.google.com/patent/US7060811B2/en
US7047168B2,Method and system for providing constraint-based guidance to a designer in a collaborative design environment ,The Regents Of The University Of Michigan,"Juan-Antonio Carballo, Stephen W. Director",2002-01-16,2002-01-16,2006-05-16,2006-05-16,https://patents.google.com/patent/US7047168B2/en
US7056738B2,Early stage multipotential stem cells in colonies of bone marrow stromal cells ,"Tulane University, Philadelphia Heath And Education Corporation","Darwin J. Prockop, David C. Colter, Ichiro Sekiya",2001-03-23,2001-03-23,2006-06-06,2006-06-06,https://patents.google.com/patent/US7056738B2/en
US7049373B2,Process for preparation of graft polymers ,Carnegie Mellon University,"Krzysztof Matyjaszewski, Jean-Francois Lutz, Hosei Shinoda",1999-08-06,2001-12-21,2006-05-23,2006-05-23,https://patents.google.com/patent/US7049373B2/en
US7029996B2,Methods for producing uniform large-grained and grain boundary location manipulated polycrystalline thin film semiconductors using sequential lateral solidification ,The Trustees Of Columbia University In The City Of New York,"James S. Im, Robert S. Sposili, Mark A. Crowder",1999-09-03,2002-11-13,2006-04-18,2006-04-18,https://patents.google.com/patent/US7029996B2/en
US7061524B2,Motion/saturation detection system and method for synthesizing high dynamic range motion blur free images from multiple captures ,The Board Of Trustees Of The Leland Stanford Junior University,"Xinqiao Liu, Abbas El Gamal",2001-11-13,2001-11-13,2006-06-13,2006-06-13,https://patents.google.com/patent/US7061524B2/en
US7053021B1,Core-shell synthesis of carbon-supported alloy nanoparticle catalysts ,The Research Foundation Of The State University Of New York,"Chuan-Jian Zhong, Jin Luo, Mathew M. Maye, Li Han, Nancy N. Kariuki, Ting He",2004-04-22,2004-04-22,2006-05-30,2006-05-30,https://patents.google.com/patent/US7053021B1/en
US7045344B2,Adenoviral vector and methods for making and using the same ,"The Board Of Trustees Of The Leland Stanford Junior University, The University Of Washington","Mark A. Kay, Hiroyuki Mizuguchi",1998-11-19,2001-08-15,2006-05-16,2006-05-16,https://patents.google.com/patent/US7045344B2/en
US7048939B2,Methods for the inhibition of neointima formation ,The Board Of Trustees Of The Leland Stanford Junior University,"Christopher J. Elkins, Michael D. Dake, Jacob M. Waugh",2001-04-20,2002-03-11,2006-05-23,2006-05-23,https://patents.google.com/patent/US7048939B2/en
US7041784B2,Apoptotic compounds ,"Board Of Regents, The University Of Texas System","Xiaodong Wang, Chunying Du",2000-08-23,2003-08-15,2006-05-09,2006-05-09,https://patents.google.com/patent/US7041784B2/en
US7022296B1,Method for treating flue gas ,University Of Cincinnati,"Soon-Jai Khang, Timothy Keener",1997-07-10,2000-11-14,2006-04-04,2006-04-04,https://patents.google.com/patent/US7022296B1/en
US7061065B2,Light emitting diode and method for producing the same ,National Chung-Hsing University,"Ray-Hua Horng, Tung-Hsing Wu, Shao-Hua Huang, Chi-Ying Chiu",2003-03-31,2003-03-31,2006-06-13,2006-06-13,https://patents.google.com/patent/US7061065B2/en
US7026461B1,Engineered protein kinases which can utilize nucleotide triphosphate substrates ,Princeton University,Kevan Shokat,1997-02-07,2001-11-01,2006-04-11,2006-04-11,https://patents.google.com/patent/US7026461B1/en
US7029971B2,Thin film dielectrics for capacitors and methods of making thereof ,"E. I. Du Pont De Nemours And Company, Norch Carolina State University","William J. Borland, Jon Fredrick Ihlefeld, Angus Ian Kingon, Jon-Paul Maria",2003-07-17,2003-07-17,2006-04-18,2006-04-18,https://patents.google.com/patent/US7029971B2/en
US7067318B2,Methods for transfecting T cells ,"The Regents Of The University Of Michigan, The United States Of America As Represented By The Secretary Of The Navy","Carl H. June, Craig B. Thompson, Suil Kim",1995-06-07,2003-09-09,2006-06-27,2006-06-27,https://patents.google.com/patent/US7067318B2/en
US7056493B2,Radio-opaque polymer biomaterials ,"Rutgers,The State University","Joachim B Kohn, Durgadas Bolikal, Sanyog M Pendharkar",1997-11-07,2003-10-23,2006-06-06,2006-06-06,https://patents.google.com/patent/US7056493B2/en
US7032589B2,Portable ventilator ,The Johns Hopkins University,"W. Kerechanin II Charles, Dexter G. Smith, Jennifer A. Nix, Protagoras N. Cutchis",2002-01-23,2003-01-23,2006-04-25,2006-04-25,https://patents.google.com/patent/US7032589B2/en
US7022870B2,N-bridged selective androgen receptor modulators and methods of use thereof ,University Of Tennessee Research Foundation,"James T. Dalton, Duane D. Miller, Craig A. Marhefka, Wenqing Gao",2002-06-17,2003-06-17,2006-04-04,2006-04-04,https://patents.google.com/patent/US7022870B2/en
US7067109B1,Cancer treatment kits comprising therapeutic conjugates that bind to aminophospholipids ,"Board Of Regents, The University Of Texas System","Philip E. Thorpe, Sophia Ran, Rolf A. Brekken",1998-07-13,1999-07-12,2006-06-27,2006-06-27,https://patents.google.com/patent/US7067109B1/en
US7067111B1,"Ethylenedicysteine (EC)-drug conjugates, compositions and methods for tissue specific disease imaging ","Board Of Regents, University Of Texas System","David J. Yang, Chun W. Liu, Dong-Fang Yu, E. Edmund Kim",1999-10-25,2000-06-21,2006-06-27,2006-06-27,https://patents.google.com/patent/US7067111B1/en
US7068593B2,Apparatus and method for synchronizing frequency in orthogonal frequency division multiplexing communication system ,Chung-Ang University Industry Academic Cooperation Foundation,"Yong Soo Cho, Kyung Won Park",2001-02-08,2001-11-26,2006-06-27,2006-06-27,https://patents.google.com/patent/US7068593B2/en
US7064166B2,Process for monomer sequence control in polymerizations ,Carnegie Mellon University,"Krzysztof Matyjaszewski, Betül Kirci, Jean François Lutz, Tomislav Pintauer",2001-10-12,2002-10-11,2006-06-20,2006-06-20,https://patents.google.com/patent/US7064166B2/en
US7029646B2,Method for cutting single-wall carbon nanotubes through fluorination ,William Marsh Rice University,"John L. Margrave, Zhenning Gu, Robert H. Hauge, Richard E. Smalley",2002-04-08,2003-04-08,2006-04-18,2006-04-18,https://patents.google.com/patent/US7029646B2/en
US7022303B2,Single-crystal-like materials ,"Rutgers, The State University","Richard E. Riman, Larry E. McCandlish",2002-05-13,2002-05-13,2006-04-04,2006-04-04,https://patents.google.com/patent/US7022303B2/en
US7027134B1,Spectrophotometric system and method for the identification and characterization of a particle in a bodily fluid ,University Of South Florida,"Luis H. Garcia-Rubio, Catalina E. Alupoaei, Willard Harris, Alfredo Peguero, Edward P. Cutolo, German Felix Leparc",1995-02-08,2004-09-03,2006-04-11,2006-04-11,https://patents.google.com/patent/US7027134B1/en
US7049116B2,Engineered protein kinases which can utilize modified nucleotide triphosphate substrates ,Princeton University,Kevan M. Shokat,1997-02-07,2001-11-01,2006-05-23,2006-05-23,https://patents.google.com/patent/US7049116B2/en
US7051736B2,Endotracheal tube pressure monitoring system and method of controlling same ,University Of Florida,"Michael J. Banner, Paul B. Blanch, Neil R. Euliano",2000-08-17,2003-06-30,2006-05-30,2006-05-30,https://patents.google.com/patent/US7051736B2/en
US7029514B1,Core-shell magnetic nanoparticles and nanocomposite materials formed therefrom ,University Of Rochester,"Hong Yang, Xiaowei Teng",2003-03-17,2004-03-17,2006-04-18,2006-04-18,https://patents.google.com/patent/US7029514B1/en
US7043934B2,Device for collecting water from air ,"University Of Maryland, College Park","Reinhard K. Radermacher, Hisham Fawzi",2000-05-01,2004-02-05,2006-05-16,2006-05-16,https://patents.google.com/patent/US7043934B2/en
US7033473B2,Method and apparatus for combined magnetophoretic and dielectrophoretic manipulation of analyte mixtures ,"Board Of Regents, University Of Texas","Peter R. C. Gascoyne, Jody V. Vykoukal, Frederick F. Becker",2000-06-14,2001-06-14,2006-04-25,2006-04-25,https://patents.google.com/patent/US7033473B2/en
US7038727B2,Method to smooth photometric variations across multi-projector displays ,The University Of Chicago,"Aditi Majumder, Rick L. Stevens",2002-10-30,2002-10-30,2006-05-02,2006-05-02,https://patents.google.com/patent/US7038727B2/en
