US7042755B1,High density non-volatile memory device ,The Regents Of The University Of California,"David F. Bocian, Werner G. Kuhr, Jonathan Lindsey, Peter Christian Clausen, Daniel Tomasz Gryko",1999-07-01,2000-06-28,2006-05-09,2006-05-09,https://patents.google.com/patent/US7042755B1/en
US7047792B1,Surface acoustic wave hydrogen sensor ,University Of South Florida,"Venkat R. Bhethanabotla, Shekhar Bhansali",2003-07-07,2004-07-07,2006-05-23,2006-05-23,https://patents.google.com/patent/US7047792B1/en
US7030411B2,Electronic unit integrated into a flexible polymer body ,The Regents Of The University Of California,"Peter A. Krulevitch, Mariam N. Maghribi, William J. Benett, Julie K. Hamilton, Klint A. Rose, James Courtney Davidson, Mark S. Strauch",2002-12-18,2004-09-13,2006-04-18,2006-04-18,https://patents.google.com/patent/US7030411B2/en
US7045087B2,Assembly of free-standing films using a layer-by-layer process ,The Board Of Regents For Oklahoma State University,Nicholas A. Kotov,2000-03-28,2001-03-27,2006-05-16,2006-05-16,https://patents.google.com/patent/US7045087B2/en
US7034091B2,Combinatorial synthesis and screening of non-biological polymers ,"The Regents Of The University Of California, Symyx Technologies, Inc.","Peter G. Schultz, Xiao-Dong Xiang, Isy Goldwasser, Gabriel Briceno, Xiao-Dong Sun, Kai-An Wang",1994-10-18,2002-02-11,2006-04-25,2006-04-25,https://patents.google.com/patent/US7034091B2/en
US7031844B2,Cluster analysis of genetic microarray images ,The Board Of Regents Of The University Of Nebraska,"Daniel Bozinov, Jörg Rahnenführer",2002-03-18,2002-03-18,2006-04-18,2006-04-18,https://patents.google.com/patent/US7031844B2/en
US7026480B2,Organometallic light-emitting material ,The University Of Hong Kong,"Chi-Ming Che, Wei Lu, Michael Chi-Wang Chan",2001-03-08,2002-03-08,2006-04-11,2006-04-11,https://patents.google.com/patent/US7026480B2/en
US7045797B2,Axial ejection with improved geometry for generating a two-dimensional substantially quadrupole field ,The University Of British Columbia,"Mikhail Sudakov, Donald J. Douglas, Chuan-Fan Ding",2002-08-05,2003-04-16,2006-05-16,2006-05-16,https://patents.google.com/patent/US7045797B2/en
US7064497B1,Dead-time-modulated synchronous PWM controller for dimmable CCFL royer inverter ,National Taiwan University Of Science And Technology,Guan-Chyun Hsieh,2005-02-09,2005-02-09,2006-06-20,2006-06-20,https://patents.google.com/patent/US7064497B1/en
US7047080B2,Self-sufficient retinal prosthesis powered by intraocular photovoltaic cells ,The Board Of Trustees Of The Leland Stanford Junior University,"Daniel V. Palanker, Alexander Vankov, Mark Blumenkranz",2003-02-14,2003-12-19,2006-05-16,2006-05-16,https://patents.google.com/patent/US7047080B2/en
US7048856B2,"Ultrafiltration membrane, device, bioartificial organ, and methods ","Regents Of The University Of Michigan, Cleveland Clinic Foundation","William H. Fissell, IV, H. David Humes, Shuvo Roy, Aaron Fleischman",2002-09-11,2003-09-11,2006-05-23,2006-05-23,https://patents.google.com/patent/US7048856B2/en
US7041479B2,Enhanced in vitro synthesis of active proteins containing disulfide bonds ,The Board Of Trustess Of The Leland Stanford Junior University,"James Robert Swartz, Dong-myung Kim",2000-09-06,2003-03-31,2006-05-09,2006-05-09,https://patents.google.com/patent/US7041479B2/en
US7060689B2,Methods and compositions for delivery and retention of active agents to lymph nodes ,The Board Of Regents Of The University Of Texas System,"Beth A. Goins, William T. Phillips",1999-07-14,2002-01-11,2006-06-13,2006-06-13,https://patents.google.com/patent/US7060689B2/en
US7029276B2,Use of cyclic forces to expedite remodeling of craniofacial bones ,The Board Of Trustees Of The University Of Illinois,Jeremy Jian Mao,2000-09-22,2003-11-14,2006-04-18,2006-04-18,https://patents.google.com/patent/US7029276B2/en
US7036769B2,Microstructures using carbon fiber composite honeycomb beams ,The Regents Of The University Of California,Robert Wood,2003-05-14,2004-04-22,2006-05-02,2006-05-02,https://patents.google.com/patent/US7036769B2/en
US7026294B2,Method of use of peptide antagonists of zonulin to prevent or delay the onset of diabetes ,University Of Maryland,"Alessio Fasano, Tammara L. Watts",2000-05-19,2001-03-21,2006-04-11,2006-04-11,https://patents.google.com/patent/US7026294B2/en
US7060078B2,Apparatus and method for positive closure of an internal tissue membrane opening ,Indiana University Research And Technology Corporation,"David Hathaway, Brian Patton, Keith March",1992-10-19,2001-11-13,2006-06-13,2006-06-13,https://patents.google.com/patent/US7060078B2/en
US7060793B2,Circularly permuted fluorescent protein indicators ,The Regents Of The University Of California,"Roger Y. Tsien, Geoffrey Baird",1999-05-21,2001-10-23,2006-06-13,2006-06-13,https://patents.google.com/patent/US7060793B2/en
US7026444B2,Extracellular novel RAGE binding protein (EN-RAGE) and uses thereof ,The Trustees Of Columbia University In The City Of New York,"Ann Marie Schmidt, David Stern",1998-10-06,2003-09-19,2006-04-11,2006-04-11,https://patents.google.com/patent/US7026444B2/en
US7058199B1,Methods and apparatus for hiding data in halftone images ,The Hong Kong University Of Science And Technology,"Oscar Chi-Lim Au, Ming Sun Fu",2000-08-14,2000-08-14,2006-06-06,2006-06-06,https://patents.google.com/patent/US7058199B1/en
US7035692B1,High density polymer-based integrated electrode array ,The Regents Of The University Of California,"Mariam N. Maghribi, Peter A. Krulevitch, James Courtney Davidson, Julie K. Hamilton",2003-04-30,2004-04-16,2006-04-25,2006-04-25,https://patents.google.com/patent/US7035692B1/en
US7050635B2,Multi-dimensional pattern recognition by use of digital holography ,The University Of Connecticut,"Bahram Javidi, Enrique Tajahuerce",2001-03-30,2001-03-30,2006-05-23,2006-05-23,https://patents.google.com/patent/US7050635B2/en
US7045063B2,Treatment of swine wastewater by biological and membrane separation technologies ,The Regents Of The University Of California,"Ruihong H. Zhang, Jane H. Turnbull",2002-07-26,2003-07-23,2006-05-16,2006-05-16,https://patents.google.com/patent/US7045063B2/en
US7026157B1,Bacterial hemoglobin receptor genes ,Oregon Health And Science University,"Igor Stojiljkovic, Magdalene So, Vivian Hwa, Fred Heffron, Xavier Nassif",1994-10-18,2000-09-19,2006-04-11,2006-04-11,https://patents.google.com/patent/US7026157B1/en
US7060869B2,Fluorescent protein sensors for detection of analytes ,The Regents Of The University Of California,"Roger Y. Tsien, Atsushi Miyawaki",1997-03-14,2000-04-20,2006-06-13,2006-06-13,https://patents.google.com/patent/US7060869B2/en
US7056061B2,Remediation of contaminates including low bioavailability hydrocarbons ,"Rutgers, The State University Of New Jersey","Jerome J. Kukor, Kyoungphile Nam",2000-05-24,2004-03-24,2006-06-06,2006-06-06,https://patents.google.com/patent/US7056061B2/en
US7052915B2,Selective labeling and isolation of phosphopeptides and applications to proteome analysis ,University Of Washington,"Ruedi Aebersold, Huilin Zhou",2000-06-12,2001-10-18,2006-05-30,2006-05-30,https://patents.google.com/patent/US7052915B2/en
US7041150B2,Preparation of alloys by the Armstrong method ,The University Of Chicago,"Donn Reynolds Armstrong, Richard Paul Anderson, Lance E. Jacobsen",2002-09-07,2003-09-03,2006-05-09,2006-05-09,https://patents.google.com/patent/US7041150B2/en
US7068817B2,"Method for on-line machine vision measurement, monitoring and control of product features during on-line manufacturing processes ",Mcmaster University,"Wilfred M. Bourg, Jr., Steven A. Bresnahan, Gabe Jan Haarsma, John F. MacGregor, Paul Allan Martin, Honglu Yu",2002-11-07,2002-11-07,2006-06-27,2006-06-27,https://patents.google.com/patent/US7068817B2/en
US7038164B2,Laser head for irradiation and removal of material from a surface of a structure ,Loma Linda University Medical Center,"Paul E. Denney, Jay R. Eastman, Paul M. Fallara",2003-03-18,2004-03-18,2006-05-02,2006-05-02,https://patents.google.com/patent/US7038164B2/en
US7024335B1,Condition assessment and life expectancy prediction for devices ,The Texas A&M University System,Alexander G. Parlos,1998-04-15,2003-07-25,2006-04-04,2006-04-04,https://patents.google.com/patent/US7024335B1/en
US7053665B2,Circuits and methods for high-capacity asynchronous pipeline processing ,The Trustees Of Columbia University In The City Of New York,"Montek Singh, Steven M. Nowick",2000-04-25,2005-03-15,2006-05-30,2006-05-30,https://patents.google.com/patent/US7053665B2/en
US7060510B2,Electronic and optoelectronic devices and methods for preparing same ,The Trustees Of The University Of Pennsylvania,"Dawn A. Bonnell, Xiaojun Lei, David Joseph Conklin",2000-08-15,2005-05-12,2006-06-13,2006-06-13,https://patents.google.com/patent/US7060510B2/en
US7064545B2,Method and apparatus of background suppression in MR imaging using spin locking ,"General Electric Company, The Regents Of The University Of California","Gregory G. Zaharchuk, Jean H. Brittain",2004-08-30,2004-08-30,2006-06-20,2006-06-20,https://patents.google.com/patent/US7064545B2/en
US7049406B2,Hemoglobin mutants with increased soluble expression and/or reduced nitric oxide scavenging ,"Baxter Biotech Technology Sarl, William Marsh Rice University","Michael J Weickert, Christopher B Glascock, Antony J Mathews, Douglas D Lemon, Daniel H Doherty, John S Olson",1997-05-02,2002-03-27,2006-05-23,2006-05-23,https://patents.google.com/patent/US7049406B2/en
US7064474B2,Carbon nanotube array and field emission device using same ,"Tsinghua University, Hon Hai Precision Ind. Co., Ltd.","Liang Liu, Shoushan Fan",2002-11-14,2003-03-26,2006-06-20,2006-06-20,https://patents.google.com/patent/US7064474B2/en
US7052812B1,Three-dimensional optical data storage in fluorescent dye-doped photopolymer ,The Regents Of The University Of California,"Mark Wang, Sadik Esener",1999-04-12,2000-04-11,2006-05-30,2006-05-30,https://patents.google.com/patent/US7052812B1/en
US7041287B2,Compositions and methods for selective dissolution of nascent intravascular blood clots ,Trustees Of The University Of Pennsylvania,"Vladimir R. Muzykantov, Juan Carlos Murciano, Douglas Cines",1998-05-21,2003-07-01,2006-05-09,2006-05-09,https://patents.google.com/patent/US7041287B2/en
US7049140B1,X-ray guided drug delivery ,Vanderbilt University,Dennis E. Hallahan,1999-04-29,2000-04-28,2006-05-23,2006-05-23,https://patents.google.com/patent/US7049140B1/en
US7049428B1,HCV variants ,Washington University,"Charles M. Rice, III, Keril J. Blight",1998-03-04,2000-05-23,2006-05-23,2006-05-23,https://patents.google.com/patent/US7049428B1/en
US7027449B2,Method for maintaining reservation state in a network router and resulting scalable integrated architectures for computer networks ,The Regents Of The University Of California,"J. J. Garcia-Luna-Aceves, Srinivas Vutukury",2000-10-10,2001-10-10,2006-04-11,2006-04-11,https://patents.google.com/patent/US7027449B2/en
US7052468B2,Method and apparatus for detecting environmental smoke exposure ,"University Of Florida Research Foundation, Inc.","Richard J. Melker, Mark Gold",2001-05-24,2002-05-22,2006-05-30,2006-05-30,https://patents.google.com/patent/US7052468B2/en
US7027699B2,Optical fiber and optical fiber sensors ,The Hong Kong Polytechnic University,"Xiaoming Tao, Jianming Yu, Dongxiao Yang",2003-05-21,2003-05-21,2006-04-11,2006-04-11,https://patents.google.com/patent/US7027699B2/en
US7060987B2,Electron ionization source for othogonal acceleration time-of-flight mass spectrometry ,Brigham Young University,"Edgar D. Lee, Alan L. Rockwood, Bingfang Yue, Milton L. Lee",2003-03-03,2004-03-03,2006-06-13,2006-06-13,https://patents.google.com/patent/US7060987B2/en
US7039156B2,"Display method and apparatus of x-ray projection image for medical use, x-ray CT apparatus for medical use and recording medium for recording program to achieve the display method ","Nihon University, J. Morita Manufacturing Corporation","Yoshinori Arai, Masakazu Suzuki, Kouji Yasuda",2000-10-04,2001-10-04,2006-05-02,2006-05-02,https://patents.google.com/patent/US7039156B2/en
US7060932B2,Method and apparatus for material processing ,Loma Linda University Medical Center,"Paul E. Denney, Jay R. Eastman, Paul M. Fallara, Andrew P. Joseph, John S. Phillips, Ta-Chieh Huang, Michael N. Patena, Tim Burnham, Paul Coleman",2003-03-18,2003-10-22,2006-06-13,2006-06-13,https://patents.google.com/patent/US7060932B2/en
US7022517B1,Method and apparatus for the delivery of samples to a chemical sensor array ,"Board Of Regents, The University Of Texas System","John T. McDevitt, Eric V. Anslyn, Jason B. Shear, Dean P. Neikirk, Damon V. Borich",1999-07-16,2000-07-14,2006-04-04,2006-04-04,https://patents.google.com/patent/US7022517B1/en
US7053547B2,Increased emission efficiency in organic light-emitting devices on high-index substrates ,"Universal Display Corporation, The Trustees Of Princeton University","Min-Hao Michael Lu, James C. Sturm, Conor Francis Madigan, Raymond Kwong",2001-11-29,2002-11-27,2006-05-30,2006-05-30,https://patents.google.com/patent/US7053547B2/en
US7042317B2,High-frequency active inductor ,"State Of Oregon, Acting By And Through The Board Of Higher Education On Behalf Of Portland State University","Haiqiao Xiao, Rolf Schaumann, W. Robert Daasch",2003-09-08,2004-09-08,2006-05-09,2006-05-09,https://patents.google.com/patent/US7042317B2/en
US7029454B2,Milking device ,Nihon University,Toshi Watanabe,2001-05-18,2002-05-15,2006-04-18,2006-04-18,https://patents.google.com/patent/US7029454B2/en
US7064105B2,"Deoxo-proline-containing tamandarin and didemnin analogs, dehydro-proline-containing tamandarin and didemnin analogs, and methods of making and using them ",The Trustees Of The University Of Pennsylvania,"Madeleine M. Joullié, Bo Liang, Xiaobin Ding",2000-04-07,2001-01-22,2006-06-20,2006-06-20,https://patents.google.com/patent/US7064105B2/en
US7022421B2,Organic light emitting devices having carrier blocking layers comprising metal complexes ,"The University Of Southern California, The Trustees Of Princeton University","Mark E. Thompson, Xiaofan Ren, Vadim Adamovich, Steven Cordero, Brian Wendell D'Andrade, Bert Alleyne, Stephen R. Forrest",2001-08-29,2002-08-23,2006-04-04,2006-04-04,https://patents.google.com/patent/US7022421B2/en
US7056513B2,Telomerase ,"Geron Corporation, Regents Of The University Of Colorado","Thomas R. Cech, Joachim Lingner, Toru Nakamura, Karen B. Chapman, Gregg B. Morin, Calvin B. Harley, William H. Andrews",1996-10-01,2001-04-26,2006-06-06,2006-06-06,https://patents.google.com/patent/US7056513B2/en
US7043204B2,Through-the-earth radio ,The Regents Of The University Of California,"David Reagor, Jose Vasquez-Dominguez",2003-06-26,2003-11-20,2006-05-09,2006-05-09,https://patents.google.com/patent/US7043204B2/en
US7029606B2,Hyperpolarizable organic chromophores ,University Of Washington,"Larry R. Dalton, Kwan-Yue Jen, Timothy Londergan, William Brenden Carlson, Gregory Phelan, Diyun Huang, Daniel Casmier, Todd Ewy, Nicholas Buker",2000-07-24,2001-07-24,2006-04-18,2006-04-18,https://patents.google.com/patent/US7029606B2/en
US7027145B2,Reconfigurable surface finish inspection apparatus for cylinder bores and other surfaces ,The Regents Of The University Of Michigan,"Stephen B. Segall, Yoram Koren",2003-06-24,2003-06-24,2006-04-11,2006-04-11,https://patents.google.com/patent/US7027145B2/en
US7035269B2,Method and apparatus for distributed synchronous clocking ,Mcgill University,"David Robert Cameron Rolston, David Victor Plant, Gordon Walter Roberts",2000-02-02,2001-02-01,2006-04-25,2006-04-25,https://patents.google.com/patent/US7035269B2/en
US7043500B2,Subtractive clustering for use in analysis of data ,"Board Of Regents, The University Of Texas Syxtem",James F. Leary,2001-04-25,2002-04-25,2006-05-09,2006-05-09,https://patents.google.com/patent/US7043500B2/en
US7033415B2,Methods of controlling nanoparticle growth ,Northwestern University,"Chad A. Mirkin, Gabriella S. Métraux, Rongchao Jin, YunWei Charles Cao",2003-04-02,2004-04-02,2006-04-25,2006-04-25,https://patents.google.com/patent/US7033415B2/en
US7034008B2,Cardiac arrhythmia treatment methods ,The Johns Hopkins University,"J. Kevin Donahue, Eduardo Marban",2000-09-06,2001-09-06,2006-04-25,2006-04-25,https://patents.google.com/patent/US7034008B2/en
US7037729B2,"Porous materials embedded with nanospecies, methods of fabrication thereof, and methods of use thereof ",Emory University,"Shuming Nie, Xiaohu Gao",2003-08-04,2003-09-18,2006-05-02,2006-05-02,https://patents.google.com/patent/US7037729B2/en
US7060733B2,Methods for treating pancreatitis with curcumin compounds and inhibitors of reactive oxygen species ,"The Regents Of The University Of California, The United States Of America As Represented By The Department Of Veterans' Affairs","Stephen J. Pandol, Ilya Y. Gukovsky",2002-08-15,2002-08-15,2006-06-13,2006-06-13,https://patents.google.com/patent/US7060733B2/en
US7069163B2,Digital spread spectrum methods and apparatus for testing aircraft wiring ,Utah State University,"Jacob Gunther, Deekshit Dosibhatla, Cynthia Furse",2002-04-23,2003-04-23,2006-06-27,2006-06-27,https://patents.google.com/patent/US7069163B2/en
US7057134B2,Laser manipulation system for controllably moving a laser head for irradiation and removal of material from a surface of a structure ,Loma Linda University Medical Center,"Paul E. Denney, Jay R. Eastman, Paul M. Fallara, Andrew P. Joseph, John S. Phillips, Michael N. Patena, Tim Burnham, Paul Coleman",2003-03-18,2003-10-22,2006-06-06,2006-06-06,https://patents.google.com/patent/US7057134B2/en
US7052856B2,NELL-1 enhanced bone mineralization ,The Regents Of The University Of California,Kang Ting,1999-10-05,1999-10-05,2006-05-30,2006-05-30,https://patents.google.com/patent/US7052856B2/en
US7034143B1,Systems and methods for sequencing by hybridization ,Brown University Research Foundation,"Franco P. Preparata, Eliezer Upfal",1998-10-13,1999-10-13,2006-04-25,2006-04-25,https://patents.google.com/patent/US7034143B1/en
US7060324B2,Method of creating a dispersion of a liquid on a substrate ,"Board Of Regents, The University Of Texas System","Todd Bailey, Byung J. Choi, Matthew Colburn, Sidlgata V. Sreenivasan, C. Grant Willson, John Ekerdt",2000-10-12,2004-01-13,2006-06-13,2006-06-13,https://patents.google.com/patent/US7060324B2/en
US7049543B2,Method of defining features on materials with a femtosecond laser ,The Regents Of The University Of California,"Edward Victor Roos, Franklin Roeske, Ronald S. Lee, Jerry J. Benterou",2003-11-07,2003-11-07,2006-05-23,2006-05-23,https://patents.google.com/patent/US7049543B2/en
US7022371B2,"Phytase enzymes, nucleic acids encoding phytase enzymes and vectors and host cells incorporating same ","Genencor International, Inc., University Of Manchester","Christian F. Stafford, Anthony P. J. Trinci, Jayne L. Brookman",1999-08-13,2002-08-26,2006-04-04,2006-04-04,https://patents.google.com/patent/US7022371B2/en
US7056713B1,Urate oxidase ,Duke University,"Michael Hershfield, Susan J. Kelly",1998-08-06,1999-08-05,2006-06-06,2006-06-06,https://patents.google.com/patent/US7056713B1/en
US7041634B2,Method of inhibiting immune system destruction of transplanted viable cells ,"Emory University, Bristol Myers-Squibb Company","Collin J. Weber, Mary K. Hagler, Peter S. Linsley, Judith A. Kapp, Susan A. Safley",1995-09-27,1998-03-27,2006-05-09,2006-05-09,https://patents.google.com/patent/US7041634B2/en
US7043990B2,System for and method of performing evaluation techniques on a log or round timber ,"Board Of Control Of Michigan Technological University, The United States Of America As Represented By The Secretary Of Agriculture","Xiping Wang, Robert J. Ross, James A. Mattson, John Erickson, John W. Forsman, Earl A. Geske, Michael A. Wehr",2001-01-31,2002-01-30,2006-05-16,2006-05-16,https://patents.google.com/patent/US7043990B2/en
US7060430B2,Screening methods for identifying viral proteins with interferon antagonizing functions and potential antiviral agents ,Mount Sinai School Of Medicine Of New York University,"Peter M. Palese, Adolfo Garcia-Sastre, Christopher Basler",2000-04-10,2003-08-05,2006-06-13,2006-06-13,https://patents.google.com/patent/US7060430B2/en
US7042214B2,Non-linear symmetric sweep spectral-spatial RF pulses for MR spectroscopy ,"The Board Of Trustees Of The Leland Stanford Junior University, The Regents Of The University Of California","Charles H. Cunningham, John M. Pauly, Daniel B. Vigneron",2004-04-13,2004-04-13,2006-05-09,2006-05-09,https://patents.google.com/patent/US7042214B2/en
US7025789B2,Prosthetic device and method for total joint replacement in small joint arthroplasty ,The University Of Hong Kong,"Shew Ping Chow, Kwok Wai Lam, Ian Gibson",2003-04-29,2003-04-29,2006-04-11,2006-04-11,https://patents.google.com/patent/US7025789B2/en
US7067129B2,Receptor specific transepithelial transport in therapeutics ,"The Brigham And Woman's Hospital, Inc., Brandeis University","Richard S. Blumberg, Neil E. Simister, Wayne I. Lencer",1995-01-17,2002-08-08,2006-06-27,2006-06-27,https://patents.google.com/patent/US7067129B2/en
US7045290B2,Yeast screens for treatment of human disease ,The University Of Chicago,"Susan Lindquist, Sylvia Krobitsch, Tiago Fleming Outeiro",2001-02-15,2002-02-15,2006-05-16,2006-05-16,https://patents.google.com/patent/US7045290B2/en
US7049044B2,Nanocomposite negative resists for next generation lithographies ,The University Of North Carolina At Charlotte,"Kenneth Gonsalves, Mohammed Azam Ali",2002-12-19,2002-12-19,2006-05-23,2006-05-23,https://patents.google.com/patent/US7049044B2/en
US7064192B2,High pressure refolding of protein aggregates and inclusion bodies ,The Regents Of The University Of Colorado,"Theodore W. Randolph, John F. Carpenter, Richard St. John",1998-07-09,2002-11-12,2006-06-20,2006-06-20,https://patents.google.com/patent/US7064192B2/en
US7049132B1,Stress-responsive induction of a therapeutic agent and methods of use ,University Of Southern California,Amy S. Lee,1999-06-28,2000-06-28,2006-05-23,2006-05-23,https://patents.google.com/patent/US7049132B1/en
US7035400B1,Signaling Techniques in channels with asymmetric powers and capacities ,Wm. Marsh Rice University,"Rohit V. Gaikwad, Richard G. Baraniuk",1999-03-01,2000-02-21,2006-04-25,2006-04-25,https://patents.google.com/patent/US7035400B1/en
US7022519B2,Compositions and methods for helper-free production of recombinant adeno-associated viruses ,The Trustees Of The University Of Pennsylvania,"Guangping Gao, James M Wilson",1999-03-18,2002-09-20,2006-04-04,2006-04-04,https://patents.google.com/patent/US7022519B2/en
US7040157B2,Variable depth automated dynamic water profiler ,North Carolina State University,"Howard Glasgow, Jr., Robert E. Reed, David C. Toms, JoAnn Burkholder",2001-07-31,2002-07-30,2006-05-09,2006-05-09,https://patents.google.com/patent/US7040157B2/en
US7026763B2,Apparatus for magnetic and electrostatic confinement of plasma ,The Regents Of The University Of California,"Norman Rostoker, Michl Binderbauer",2001-02-01,2002-12-23,2006-04-11,2006-04-11,https://patents.google.com/patent/US7026763B2/en
US7027965B2,Time domain passivity control of haptic interfaces ,The University Of Washington,"Blake Hannaford, Jee-Hwan Ryu",2000-09-13,2001-09-13,2006-04-11,2006-04-11,https://patents.google.com/patent/US7027965B2/en
US7056901B2,Microgel particles for the delivery of bioactive materials ,The Regents Of The University Of California,"Jean M. J. Frechet, Niren Murthy",2002-03-29,2003-03-28,2006-06-06,2006-06-06,https://patents.google.com/patent/US7056901B2/en
US7061237B2,Remote NMR/MRI detection of laser polarized gases ,The Regents Of The University Of California,"Alexander Pines, Sunil Saxena, Adam Moule, Megan Spence, Juliette A. Seeley, Kimberly L. Pierce, Song-I Han, Josef Granwehr",2000-07-13,2002-10-09,2006-06-13,2006-06-13,https://patents.google.com/patent/US7061237B2/en
US7063820B2,Photoelectrochemical air disinfection ,"University Of Florida Research Foundation, Inc.",Dharendra Yogi Goswami,2003-06-16,2003-06-16,2006-06-20,2006-06-20,https://patents.google.com/patent/US7063820B2/en
US7035538B2,Monitoring optical dispersion based on vestigial side band optical filtering ,University Of Southern California,"Alan E. Willner, Qian Yu, Zhongqi Pan, Lianshan Yan",2001-07-09,2002-07-08,2006-04-25,2006-04-25,https://patents.google.com/patent/US7035538B2/en
US7053119B2,Methods for identifying and using IKK inhibitors ,"The Regents Of The University Of California, Charterhouse Therapeutics Ltd.","Michael Karin, Pankaj Kapahi",1999-11-23,2003-02-28,2006-05-30,2006-05-30,https://patents.google.com/patent/US7053119B2/en
US7061011B2,Bipolar organic devices ,The Trustees Of Princeton University,"Stephen R. Forrest, Jiangeng Xue",2003-11-26,2003-11-26,2006-06-13,2006-06-13,https://patents.google.com/patent/US7061011B2/en
US7029838B2,Prevascularized contructs for implantation to provide blood perfusion ,Arizona Board Of Regents On Behalf Of The University Of Arizona,"Stuart K. Williams, James B. Hoying, Benjamin R. Shepherd",2001-03-30,2002-03-29,2006-04-18,2006-04-18,https://patents.google.com/patent/US7029838B2/en
US7052829B2,Prevascularized constructs for implantation to provide blood perfusion ,The Arizona Board Of Regents On Behalf Of The University Of Arizona,"Stuart K. Williams, James B. Hoying, Benjamin R. Shepherd",2001-03-30,2002-04-29,2006-05-30,2006-05-30,https://patents.google.com/patent/US7052829B2/en
US7057076B2,Bicyclic and tricyclic cannabinoids ,University Of Connecticut,"Alexandros Makriyannis, Spyridon P Nikas, Atmaram D Khanolkar",2001-07-13,2002-07-11,2006-06-06,2006-06-06,https://patents.google.com/patent/US7057076B2/en
