US7776921B2,Treating benign prostate hyperplasia with SARMS ,University Of Tennessee Research Foundation,"James T. Dalton, Duane D. Miller, Mitchell S. Steiner, Karen A. Veverka, Wenqing Gao",2002-02-07,2003-02-06,2010-08-17,2010-08-17,https://patents.google.com/patent/US7776921B2/en
US7804455B2,Antenna apparatus for linearly polarized diversity antenna in RFID reader and method of controlling the antenna apparatus ,"Electronics And Telecommunications Reseach Institute, Chungbuk National University Industry-Academic Cooperation Foundation","Jong Moon Lee, Nae-Soo Kim, Cheol Sig Pyo, Ik Guen CHOI",2006-12-05,2007-07-24,2010-09-28,2010-09-28,https://patents.google.com/patent/US7804455B2/en
US7776997B2,Solvent resistant polymers ,Central Michigan University Board Of Trustees,"Dillip K. Mohanty, Ajit Sharma",2005-01-13,2006-02-03,2010-08-17,2010-08-17,https://patents.google.com/patent/US7776997B2/en
US7787429B2,Method and apparatus for establishing path in wireless network ,"Samsung Electronics Co., Ltd., Korea University Industrial & Academic Collaboration Foundation","Paul Barom Jeon, Jun Hyeong Kim, Sang Do Park, Chul Hee Kang, Sun Shin An, Won Keun Kong, Joo Sang Youn",2007-02-07,2007-07-10,2010-08-31,2010-08-31,https://patents.google.com/patent/US7787429B2/en
US7771689B2,Bulk synthesis of metal and metal based dielectric nanowires ,"University Of Louisville Research Foundation, Inc","Mahendra Kumar Sunkara, Hari Chandrasekaran, Hongwei Li",2002-11-08,2003-11-10,2010-08-10,2010-08-10,https://patents.google.com/patent/US7771689B2/en
US7767841B1,Gold complexes for catalysIS and preparation thereof ,"University Of New Orleans Research And Technology Foundation, Inc.","Steven P. Nolan, Pierre de Fremont",2007-04-05,2008-04-07,2010-08-03,2010-08-03,https://patents.google.com/patent/US7767841B1/en
US7803264B2,Electro-catalysts for the oxidation of ammonia in alkaline media ,Ohio University,Gerardine G. Botte,2003-10-10,2008-12-16,2010-09-28,2010-09-28,https://patents.google.com/patent/US7803264B2/en
US7776545B2,Diagnostic method for Celiac Sprue ,The Board Of Trustees Of The Leland Stanford Junior University,"Chaitan Khosla, Lu Shan",2002-11-20,2003-11-20,2010-08-17,2010-08-17,https://patents.google.com/patent/US7776545B2/en
US7776338B2,Adjuvant activities of mutants of LT-IIa and LT-IIb enterotoxin lacking binding to ganglioside ,The Research Foundation Of State University Of New York,"Terry D. Connell, Michael W. Russell, Hesham Nawar, Sergio Arce",2003-09-25,2008-11-05,2010-08-17,2010-08-17,https://patents.google.com/patent/US7776338B2/en
US7781566B2,ErbB interface peptidomimetics and methods of use thereof ,The Trustees Of The University Of Pennsylvania,"Mark I. Greene, Ramachandran Murali, Hongtao Zhang, Mark Richter, Alan Berezov, Qingdu Liu, Jinqiu Chen",2001-04-06,2009-11-25,2010-08-24,2010-08-24,https://patents.google.com/patent/US7781566B2/en
US7796411B2,Universal three phase controllers for power converters ,The Regents Of The University Of California,"Taotao Jin, Keyue Smedley",2003-10-30,2008-12-30,2010-09-14,2010-09-14,https://patents.google.com/patent/US7796411B2/en
US7781561B2,Processes of synthesizing aromatic amine-based benzoxazine resins ,National Chungsing University,"Ching-Hsuan Lin, Ya-Ru Taso, Jhao-Wei Sie, Hao-Hsin Lee",2006-08-17,2007-08-16,2010-08-24,2010-08-24,https://patents.google.com/patent/US7781561B2/en
US7776823B2,Human cathelicidin antimicrobial peptides ,The Regents Of The University Of California,"Richard L. Gallo, Masamoto Murakami",2003-10-21,2004-10-20,2010-08-17,2010-08-17,https://patents.google.com/patent/US7776823B2/en
US7782266B2,Circularly-polarized dielectric resonator antenna ,National Taiwan University,"Tze-Hsuan Chang, Jean-Fu Kiang",2007-12-14,2008-01-14,2010-08-24,2010-08-24,https://patents.google.com/patent/US7782266B2/en
US7771547B2,Methods for producing lead-free in-situ composite solder alloys ,Board Of Trustees Operating Michigan State University,"Thomas R. Bieler, Karatholuvu N. Subramanian, Sunglak Choi",1998-07-13,2003-12-08,2010-08-10,2010-08-10,https://patents.google.com/patent/US7771547B2/en
US7772056B2,Transistors for replacing metal-oxide semiconductor field-effect transistors in nanoelectronics ,University Of Utah Research Foundation,"Mark S. Miller, Justin B. Jackson, Divesh Kapoor, Justin Millis",2007-06-18,2008-06-18,2010-08-10,2010-08-10,https://patents.google.com/patent/US7772056B2/en
US7773018B2,Sigma-delta analog-to-digital converter and solid-state image pickup device ,"Samsung Electronics Co., Ltd., Industry-Academic Cooperation Foundation Yonsei University","Youngcheol Chae, In Hee Lee, Gunhee Han, Seog Heon Ham",2008-05-23,2009-05-26,2010-08-10,2010-08-10,https://patents.google.com/patent/US7773018B2/en
US7794136B2,Twin-vortex micromixer for enforced mass exchange ,National Tsing Hua University,"Jing-Tang Yang, Kai-Yang Tung, Wei-Feng Fang, Ker-Jer Huang",2006-05-09,2006-05-09,2010-09-14,2010-09-14,https://patents.google.com/patent/US7794136B2/en
US7794998B2,Primate T-lymphotropic viruses ,"Johns Hopkins University, The United States Of America As Represented By The Department Of Health And Human Services","William M. Switzer, Walid Heneine, Thomas M. Folks, Nathan D. Wolfe, Donald S. Burke, Eitel Mpoudi Ngole",2005-02-21,2007-02-24,2010-09-14,2010-09-14,https://patents.google.com/patent/US7794998B2/en
US7795839B2,Parallel hybrid vehicle optimal storage system ,Bowling Green State University,Aaron Bloomfield,2006-03-13,2010-03-22,2010-09-14,2010-09-14,https://patents.google.com/patent/US7795839B2/en
US7793271B2,Bi-directional product development process simulation ,State Of Oregon Acting By And Through The State Board Of Higher Education On Behalf Of Portland State University,David M. Raffo,2004-06-17,2005-06-16,2010-09-07,2010-09-07,https://patents.google.com/patent/US7793271B2/en
US7788079B2,Methods for producing equivalent circuit models of multi-layer circuits and apparatus using the same ,Chinese University Of Hong Kong,"Ke-Li Wu, Jie Wang",2006-01-19,2006-05-05,2010-08-31,2010-08-31,https://patents.google.com/patent/US7788079B2/en
US7781607B2,Method for producing polymerized coordination compounds of platinum complex ,"Nanocarrier Co., Ltd., The University Of Tokyo","Katsutoshi Kobayashi, Shoko Nagasaki, Kazunori Kataoka, Chieko Tsuchiya",2005-06-09,2006-06-08,2010-08-24,2010-08-24,https://patents.google.com/patent/US7781607B2/en
US7771660B2,Electrophoretic interactive spectral methods and devices for the detection and/or characterization of biological particles ,University Of North Carolina At Chapel Hill,Don A. Gabriel,2004-05-04,2005-05-03,2010-08-10,2010-08-10,https://patents.google.com/patent/US7771660B2/en
US7776794B2,Biosensor using living cells on silicon-based microarrays ,The Research Foundation Of State University Of New York,"Ben G. Szaro, James Castracane, Xiaojun Feng",2003-09-19,2004-09-20,2010-08-17,2010-08-17,https://patents.google.com/patent/US7776794B2/en
US7771679B2,Process for the recovery of titanium dioxide from titanium-containing compositions ,The University Of Leeds,"Animesh Jha, Vilas Dattatray Tathavadkar",2003-09-18,2004-09-14,2010-08-10,2010-08-10,https://patents.google.com/patent/US7771679B2/en
US7771941B2,Method for determining the specific growth rate of distinct microbial populations in a non-homogeneous system ,University Of South Florida,"Peter George Stroot, Matthew Raymond Cutter, Samuel James DuPont, Jr.",2006-06-23,2007-06-25,2010-08-10,2010-08-10,https://patents.google.com/patent/US7771941B2/en
US7767615B2,Method for producing carbon nanotubes and/or nanofibres ,Cambridge University Technical Services Limited,"Ian Kinloch, Charanjeet Singh, Milo Sebastian Peter Shaffer, Krzysztof K. K. Koziol, Alan Windle",2002-11-14,2003-11-13,2010-08-03,2010-08-03,https://patents.google.com/patent/US7767615B2/en
US7773769B2,Method of and apparatus for detecting degradation of visual performance ,University College Cardiff Consultants Limited,"Rishi Rattan, John Millington Wild",2006-04-03,2007-03-28,2010-08-10,2010-08-10,https://patents.google.com/patent/US7773769B2/en
US7804792B2,Method and apparatus for transmitting and receiving data in a communication system ,"Samsung Electronics Co., Ltd., Industry-Academic Cooperation Foundation, Yonsei University","Jin-Ghoo Choi, Sung-Soo Hwang, Sang-Boh Yun, Kyung-Ho Sohn, Young-Yong Kim, Chung-Ha Koh",2007-04-04,2008-04-04,2010-09-28,2010-09-28,https://patents.google.com/patent/US7804792B2/en
US7803775B2,Protein kinase C peptides for use in withdrawal ,The Board Of Trustees Of The Leland Stanford Junior University,"Daria Mochly-Rosen, Joan J. Kendig, Sarah M. Sweitzer",2002-05-01,2007-05-22,2010-09-28,2010-09-28,https://patents.google.com/patent/US7803775B2/en
US7774951B2,Sensing device with whisker elements ,Northwestern University,"Mitra J. Hartmann, Joseph H. Solomon",2006-10-04,2007-10-03,2010-08-17,2010-08-17,https://patents.google.com/patent/US7774951B2/en
US7776341B2,Biomarkers of tuberculosis that distinguish disease categories: use as serodiagnostic antigens ,"Colorado State University Research Foundation, New York University","John T. Belisle, Mark J. Sartain, Suman Laal",2006-08-10,2007-08-10,2010-08-17,2010-08-17,https://patents.google.com/patent/US7776341B2/en
US7799776B2,"Indoleamine 2,3-dioxygenase (IDO) inhibitors ",The University Of British Columbia,"Raymond J. Andersen, Alban PEREIRA, Xin-Hui HUANG, Grant MAUK, Eduardo VOTTERO, Michel Roberge, Aruna BALGI",2004-07-13,2005-07-13,2010-09-21,2010-09-21,https://patents.google.com/patent/US7799776B2/en
US7799932B2,"N-substituted 3,4-alkylenedioxypyrroles, ester substituted dihydroxypyrroles and methods for synthesis of these pyrroles ","University Of Florida Research Foundation, Inc.","John R. Reynolds, Ryan M. Walczak, Sigure Cowart II John",2005-10-06,2006-10-06,2010-09-21,2010-09-21,https://patents.google.com/patent/US7799932B2/en
US7771985B2,Mesoscale detection structures ,Trustees Of The University Of Pennsylvania,"Peter Wilding, Larry J. Kricka, Jay N. Zemel",1992-05-01,2007-04-04,2010-08-10,2010-08-10,https://patents.google.com/patent/US7771985B2/en
US7771702B2,Sulfur-tolerant catalysts and related precursors and processes ,"University Of Iowa Research Foundation, Honda Motor Co., Ltd.","Darrell P. Eyman, Christopher Brooks",2003-02-20,2003-02-20,2010-08-10,2010-08-10,https://patents.google.com/patent/US7771702B2/en
US7782433B2,Copper alloy and liquid-crystal display device ,"Tohoku University, Advanced Interconnect Materials Llc",Junichi Koike,2004-08-31,2009-09-23,2010-08-24,2010-08-24,https://patents.google.com/patent/US7782433B2/en
US7771521B2,Hyperbranched polyimide-based hybrid material ,"National University Corporation Nagoya Institute Of Technology, Ibiden Co., Ltd.","Yasuharu Yamada, Tomoyuki Suzuki",2004-08-30,2007-02-28,2010-08-10,2010-08-10,https://patents.google.com/patent/US7771521B2/en
USPP21222P2,Southern highbush blueberry plant named ‘TH-682’ ,"University Of Georgia Research Foundation, The United States Of America As Represented By The Secretary Of Agriculture","D. Scott NeSmith, Mark Ehlenfeldt",2009-02-25,2009-02-25,2010-08-24,2010-08-24,https://patents.google.com/patent/USPP21222P2/en
US7795923B1,Logic circuit ,National Changhua University Of Education,Tsung-Yi Wu,2009-10-13,2009-10-13,2010-09-14,2010-09-14,https://patents.google.com/patent/US7795923B1/en
US7801593B2,"System, software, and method for detection of sleep-disordered breathing using an electrocardiogram ","Board Of Regents, The University Of Texas System, John R. Burk, Edgar A. Lucas","Khosrow Behbehani, Sridhar Vijendra, John R. Burk, Edgar A. Lucas",2004-08-23,2008-02-13,2010-09-21,2010-09-21,https://patents.google.com/patent/US7801593B2/en
US7770523B2,Interactive amusement park attraction vehicle ,University Of South Florida,Michael G. Kovac,2005-10-07,2006-10-09,2010-08-10,2010-08-10,https://patents.google.com/patent/US7770523B2/en
US7781950B2,Field emission element having carbon nanotube and manufacturing method thereof ,"Tsinghua University, Hon Hai Precision Industry Co., Ltd.","Liang Liu, Kai-Li Jiang, Shou-Shan Fan, Caesar Chen, Hsi-Fu Lee, Ga-Lane Chen",2006-06-23,2007-06-22,2010-08-24,2010-08-24,https://patents.google.com/patent/US7781950B2/en
US7794728B2,Attenuated Listeria spp. and methods for using the same ,The Regents Of The University Of California,"Daniel A. Portnoy, Mary O'Riordan, Ian Glomski",2002-05-29,2003-05-29,2010-09-14,2010-09-14,https://patents.google.com/patent/US7794728B2/en
US7785669B2,Method for making high-density carbon nanotube array ,"Tsinghua University, Hon Hai Precision Industry Co., Ltd.","Ding Wang, Peng-Cheng Song, Chang-Hong Liu, Shou-Shan Fan",2007-07-25,2007-12-29,2010-08-31,2010-08-31,https://patents.google.com/patent/US7785669B2/en
US7769493B2,System and method for controlling flow characteristics ,King Fahd University Of Petroleum And Minerals,"Moustafa Elshafei, Ashraf Yousef Dasa",2008-03-19,2008-03-19,2010-08-03,2010-08-03,https://patents.google.com/patent/US7769493B2/en
US7780148B2,Vortex generating sand and snow fence ,University Of South Florida,James H. Kirby,2005-05-05,2006-05-05,2010-08-24,2010-08-24,https://patents.google.com/patent/US7780148B2/en
US7799568B2,Authentication of products using molecularly imprinted polymers ,The Johns Hopkins University,"Harry K. Charles, Jr., George M. Murray",2003-10-07,2004-10-04,2010-09-21,2010-09-21,https://patents.google.com/patent/US7799568B2/en
US7791260B2,Gas-fed hollow cathode keeper and method of operating same ,The Regents Of The University Of Michigan,"Alec Gallimore, Joshua Rovey",2006-07-26,2007-07-26,2010-09-07,2010-09-07,https://patents.google.com/patent/US7791260B2/en
US7793570B2,Tension locking tool ,Brigham Young University,"Christopher Andrew Mattson, Brian G. Winder, Allen Boyd Mackay, Joseph O. Jacobsen, Peter A. Halverson, Spencer Frazer",2007-04-17,2008-04-16,2010-09-14,2010-09-14,https://patents.google.com/patent/US7793570B2/en
US7790431B2,Methods and materials for the production of shikimic acid ,Board Of Trustees Operating Michigan State University,John W. Frost,2003-09-24,2004-09-24,2010-09-07,2010-09-07,https://patents.google.com/patent/US7790431B2/en
US7787696B2,Systems and methods for adaptive sampling and estimating a systematic relationship between a plurality of points ,University Of North Carolina At Charlotte,"Robert G. Wilhelm, Robert M. Edgeworth",2000-08-28,2001-06-08,2010-08-31,2010-08-31,https://patents.google.com/patent/US7787696B2/en
US7798102B2,Growing system for aquatic animals ,University College Cork,"Gerasimos C. Mouzakitis, Eimear Helen McCarron, Gavin Burnell",2004-05-14,2005-05-12,2010-09-21,2010-09-21,https://patents.google.com/patent/US7798102B2/en
US7794474B2,Endovascular flexible stapling device ,The Trustees Of Columbia University In The City Of New York,"Robert E. Michler, Shunichi Homma",1996-08-22,2002-03-21,2010-09-14,2010-09-14,https://patents.google.com/patent/US7794474B2/en
US7781164B2,Method for diagnosing renal diseases or predispositions ,"University Of Pittsburgh - Of The Commonwealth System Of Higher Education, Wake Forest University","Thomas C. Hart, Patricia Suzanne Hart, Michael Gorry, Anthony J. Bleyer",2002-10-23,2005-04-23,2010-08-24,2010-08-24,https://patents.google.com/patent/US7781164B2/en
US7795430B2,Reversibly reducible metal complexes as electron transporting materials for OLEDs ,"The University Of Southern California, Universal Display Corporation","Robert Walters, Raymond Kwong, Mark E. Thompson",2005-01-10,2009-07-09,2010-09-14,2010-09-14,https://patents.google.com/patent/US7795430B2/en
US7794702B2,Mesenchymal stem cells as a vehicle for ion channel transfer in syncytial structures ,"The Trustees Of Columbia University In The City Of New York, The Research Foundation Of State University Of New York","Michael R. Rosen, Richard B. Robinson, Ira S. Cohen, Peter Brink",2003-01-15,2003-01-15,2010-09-14,2010-09-14,https://patents.google.com/patent/US7794702B2/en
US7785776B2,Genotyping by amplicon melting curve analysis ,"Idaho Technology, Inc., University Of Utah Research Foundation","Carl T. Wittwer, Cameron Gundry, Richard David Abbott, Derek Allen David",2002-05-13,2003-05-08,2010-08-31,2010-08-31,https://patents.google.com/patent/US7785776B2/en
US7771426B2,Bone treatment instrument and method ,University Health Network,"Shane Burch, Brian C. Wilson, Stuart K. Bisland",2003-10-24,2004-10-22,2010-08-10,2010-08-10,https://patents.google.com/patent/US7771426B2/en
US7800279B2,Thermo-buckled micro actuation unit made of polymer of high thermal expansion coefficient ,Tamkang University,Lung-Jieh Yang,2006-01-20,2007-01-16,2010-09-21,2010-09-21,https://patents.google.com/patent/US7800279B2/en
US7802920B2,Static-pressure gas bearing mechanism ,"Smc Corporation, Tohoku University","Soichi Sato, Takashi Abe, Eiko Miyasato, Migaku Takahashi, Masakiyo Tsunoda",2005-11-11,2006-10-25,2010-09-28,2010-09-28,https://patents.google.com/patent/US7802920B2/en
US7795401B2,Modified hemoglobin with allosteric effector conjugated ,National Chung Cheng University,"Kuang-Tse Huang, Yen-Lin Lin",2006-09-06,2006-09-06,2010-09-14,2010-09-14,https://patents.google.com/patent/US7795401B2/en
US7786343B2,Transgenic plants expressing recombinant barley alanine aminotransferase ,The Governors Of The University Of Alberta,"Allen G. Good, Virginia L. Stroeher, Douglas G. Muench",1996-02-14,2002-12-17,2010-08-31,2010-08-31,https://patents.google.com/patent/US7786343B2/en
US7786508B2,High operating temperature split-off band infrared detectors ,"Georgia State University Research Foundation, Inc.","A.G. Unil Perera, Steven G. Matsik",2006-09-01,2007-09-04,2010-08-31,2010-08-31,https://patents.google.com/patent/US7786508B2/en
US7777199B2,System and method for capturing image sequences at ultra-high framing rates ,Wichita State University,"Viswanathan Madhavan, Ala Hijazi",2004-09-17,2004-09-17,2010-08-17,2010-08-17,https://patents.google.com/patent/US7777199B2/en
US7790673B2,Methods and compositions relating to cystatin C ,New York University,Efrat Levy,2003-12-12,2006-06-12,2010-09-07,2010-09-07,https://patents.google.com/patent/US7790673B2/en
US7767202B2,Modulation of systemic immune responses by transplantation of hematopoietic stem cells transduced with genes encoding antigens and antigen presenting cell regulatory molecules ,The Johns Hopkins University,"Drew M. Pardoll, Linzhao Cheng, Yan Cui, Curt I Civin, Katherine Whartenby",2001-03-16,2002-03-18,2010-08-03,2010-08-03,https://patents.google.com/patent/US7767202B2/en
US7790451B2,HSV with a Musashi promoter regulating γ34.5 and ribonucleotide reductase expression ,Keio University,"Takahito Yazaki, Ryuichi Kanai, Takeshi Kawase, Hideyuki Okano",2005-10-28,2006-09-14,2010-09-07,2010-09-07,https://patents.google.com/patent/US7790451B2/en
US7799867B2,"Material for curable solvent-based topcoating material, and coating material and coating film comprising or formed from the same ","Nissan Motor Co., Ltd., The University Of Tokyo","Kohzo Ito, Jun Araki, Tatsuya Suzuki, Masahiko Yamanaka, Kentarou Watanabe",2005-10-06,2006-10-05,2010-09-21,2010-09-21,https://patents.google.com/patent/US7799867B2/en
US7772884B2,Capacitive coupling type level shift circuit of low power consumption and small size ,Industry-University Cooperation Foundation Hanyang University,Oh-Kyong Kwon,2006-02-14,2007-01-22,2010-08-10,2010-08-10,https://patents.google.com/patent/US7772884B2/en
US7800807B2,Electrochromic mirror ,"Kabushiki Kaisha Tokai-Rika-Denki-Seisakusho, National University Corporation Nagoya University","Junichi Nakaho, Masaharu Hattori, Atsushi Yamaguchi, Nagahiro Saito, Takahiro Ishizaki, Osamu Takai",2007-06-26,2008-06-23,2010-09-21,2010-09-21,https://patents.google.com/patent/US7800807B2/en
US7794944B2,Eubacterial tmRNA sequences and uses thereof ,University Of Utah Research Foundation,Brice Felden,1999-04-07,2008-06-27,2010-09-14,2010-09-14,https://patents.google.com/patent/US7794944B2/en
US7803748B2,Nanoparticles for protein drug delivery ,"Gp Medical, Inc., National Tsing Hua University","Hsing-Wen Sung, Yu-Hsin Lin, Hsiang-Fa Liang, Hosheng Tu",2004-10-05,2007-07-26,2010-09-28,2010-09-28,https://patents.google.com/patent/US7803748B2/en
US7784370B2,Powdery/granular material flowability evaluation apparatus and method ,Kyoto University,"Shuji Matsusaka, Hiroaki Masuda, Yanbin Jiang, Masatoshi Yasuda",2005-04-21,2006-04-19,2010-08-31,2010-08-31,https://patents.google.com/patent/US7784370B2/en
US7799453B2,Fuel cell with electroosmotic pump ,"The Board Of Trustees Of The Leland Stanford Junior University, Honda Motor Co., Ltd.","Juan Santiago, Jonathan Posner, Friedrich B. Prinz, Tibor Fabian, John Eaton, Suk-Won Cha, Cullen Buie, Daejoogn Kim, Hideaki Tsuru, Jun Sasahara, Tadahiro Kubota, Yuji Saito",2004-08-04,2004-08-04,2010-09-21,2010-09-21,https://patents.google.com/patent/US7799453B2/en
US7772390B1,Lipid mediated nucleic acid synthesis ,The Regents Of The University Of California,David W. Deamer,2006-07-18,2007-07-18,2010-08-10,2010-08-10,https://patents.google.com/patent/US7772390B1/en
US7786316B2,Metalloprotein inhibitors ,The Regents Of The University Of California,"David T. Puerta, Seth M. Cohen, Jana A. Lewis",2004-04-29,2009-07-15,2010-08-31,2010-08-31,https://patents.google.com/patent/US7786316B2/en
US7800746B2,Method for identifying refractive-index fluctuations of a target ,"Northwestern University, Northshore University Healthsystem","Vadim Backman, Yang Liu, Young Kim, Hemant Roy, Michael Goldberg, Randall Brand, Prabhakar Pradhan, Hariharan Subramanian",2006-08-11,2007-08-13,2010-09-21,2010-09-21,https://patents.google.com/patent/US7800746B2/en
US7805175B2,Microarray bioprobe device integrated with a semiconductor amplifier module on a flexible substrate ,Chung Hua University,"Jium Ming Lin, Li-Chern Pan, Po-Wei Lin",2006-06-22,2006-10-11,2010-09-28,2010-09-28,https://patents.google.com/patent/US7805175B2/en
US7794707B2,"ACE2 activation for treatment of heart, lung and kidney disease and hypertension ",University Health Network,"Joseph Penninger, Michael A. Crackower",2002-06-19,2003-06-19,2010-09-14,2010-09-14,https://patents.google.com/patent/US7794707B2/en
US7799518B2,"Nucleic acid molecules and proteins for the identification, assessment, prevention, and therapy of ovarian cancer ","Millennium Pharmaceuticals, Inc., Board Of Regents, University Of Texas System","Wilson O. Endege, Donna Ford, Manjula Gannavarapu, Karen Glatt, Sebastian Hoersch, Shubhangi Kamatkar, John E. Monahan, Robert Schlegel, Yong Yao Xu, Xumei Zhao",2003-10-07,2004-10-07,2010-09-21,2010-09-21,https://patents.google.com/patent/US7799518B2/en
US7767393B2,Expression profile of prostate cancer ,The Regents Of The University Of Michigan,"Arul M. Chinnaiyan, Mark A. Rubin, Arun Sreekumar",2001-08-02,2006-01-31,2010-08-03,2010-08-03,https://patents.google.com/patent/US7767393B2/en
US7767711B2,"Polyphenol proteasome inhibitors, synthesis, and methods of use ","University Of South Florida, Mcgill University, The Hong Kong Polytechnic University","Q. Ping Dou, Tak-Hang Chan, David M. Smith",2003-01-24,2007-06-20,2010-08-03,2010-08-03,https://patents.google.com/patent/US7767711B2/en
US7767653B2,Enhancement of immune response to vaccine by interferon alpha ,The Board Of Trustees Of The University Of Illinois,Federico A. Zuckermann,2000-11-09,2007-10-30,2010-08-03,2010-08-03,https://patents.google.com/patent/US7767653B2/en
US7803912B2,Increasing the stability of recombinant adult human apohemoglobin ,"William Marsh Rice University, Wisconsin Alumni Research Foundation","John S. Olson, George N. Phillips, JR.",2004-09-15,2007-03-14,2010-09-28,2010-09-28,https://patents.google.com/patent/US7803912B2/en
US7785553B2,Reducing explosive potential of ammonium nitrate ,University Of Kentucky Research Foundation,Darrell N. Taulbee,2007-03-14,2008-02-22,2010-08-31,2010-08-31,https://patents.google.com/patent/US7785553B2/en
US7791730B2,Surface plasmon resonance meter ,National Taiwan University,"Chih-Kung Lee, Shu-Sheng Lee, Chih-Hsiang Sung, Yi-Hao Chen",2008-08-29,2009-04-13,2010-09-07,2010-09-07,https://patents.google.com/patent/US7791730B2/en
US7781638B2,Photocatalyst-induced reduction of semivolatile organic chemicals absorbed in solid materials ,University Of North Dakota,"Evguenii I. Kozliak, Wayne Seames",2004-08-20,2005-08-22,2010-08-24,2010-08-24,https://patents.google.com/patent/US7781638B2/en
US7804586B2,Method and system for image processing for profiling with uncoded structured light ,Sheffield Hallam University,"Marcos A. Rodrigues, Alan Robinson, Lyuba Alboul",2004-02-05,2005-02-03,2010-09-28,2010-09-28,https://patents.google.com/patent/US7804586B2/en
US7795145B2,Patterning crystalline compounds on surfaces ,"Basf Aktiengesellschaft, The Board Of Trustees Of The Leland Stanford Junior University","Marcos Gomez, Peter Erk, Frauke Richter, Zhenan Bao, Shuhong Liu",2006-02-15,2006-02-15,2010-09-14,2010-09-14,https://patents.google.com/patent/US7795145B2/en
USRE41578E1,Micro electrochemical energy storage cells ,Ramot At Tel-Aviv University Ltd.,"Menachem Nathan, Emanuel Peled, Dan Haronian",1998-10-22,2007-10-03,2010-08-24,2010-08-24,https://patents.google.com/patent/USRE41578E1/en
US7804640B1,Composite cavity for enhanced efficiency of up-conversion ,"University Of Central Florida Research Foundation, Inc.","Michael Bass, Dennis G. Deppe",2007-05-24,2008-05-21,2010-09-28,2010-09-28,https://patents.google.com/patent/US7804640B1/en
US7799706B2,Neutral beam-assisted atomic layer chemical vapor deposition apparatus and method of processing substrate using the same ,Sungkyunkwan University Foundation For Corporate Collaboration,"Geun-young Yeom, Byoung-Jae Park, Sung-Woo Kim, Jong-Tae Lim",2008-02-11,2008-02-14,2010-09-21,2010-09-21,https://patents.google.com/patent/US7799706B2/en
