US7563613B2,Detoxification and decontamination using nanotechnology therapy ,University Of Florida,"Donn M. Dennis, Charles R. Martin, Timothy E. Morey, Richard E. Partch, Dinesh O Shah, Manoj Varshney",2001-04-03,2005-08-01,2009-07-21,2009-07-21,https://patents.google.com/patent/US7563613B2/en
US7587282B2,Statistical methods for analyzing biological sequences ,"Board Of Regents, The University Of Texas System","Rama Ranganathan, Steve W. Lockless",1999-10-06,2006-03-13,2009-09-08,2009-09-08,https://patents.google.com/patent/US7587282B2/en
US7582655B2,Antineoplastic compounds ,University Of Saskatchewan,"Jonathan R. Dimmock, Umashankar Das",2005-11-22,2006-11-22,2009-09-01,2009-09-01,https://patents.google.com/patent/US7582655B2/en
US7589255B2,"DWF4 polynucleotides, polypeptides and uses thereof ",The Arizona Board Of Regents On Behalf Of The University Of Arizona,"Ricardo Azpiroz, Sunghwa Choe, Kenneth A. Feldmann",1999-02-11,2006-01-17,2009-09-15,2009-09-15,https://patents.google.com/patent/US7589255B2/en
US7579429B2,Cyclic alkyl substituted glycolides and polylactides therefrom ,Board Of Trustees Of Michigan State University,"Gregory L. Baker, Feng Jing, Milton R. Smith, III",2005-12-16,2006-12-15,2009-08-25,2009-08-25,https://patents.google.com/patent/US7579429B2/en
US7572952B2,Transgenic plants with tocopherol methyltransferase ,University And Community College System Of Nevada,"Dean DellaPenna, Jr., David K. Shintani",1997-07-25,2003-09-30,2009-08-11,2009-08-11,https://patents.google.com/patent/US7572952B2/en
US7572891B2,Kidney-specific tumor vaccine directed against kidney tumor antigen G-250 ,The Regents Of The University Of California,"Arie Belldegrun, Cho-Lea Tso",2000-02-14,2001-02-13,2009-08-11,2009-08-11,https://patents.google.com/patent/US7572891B2/en
US7571600B2,Method and apparatus for reducing pollutants in engine exhaust ,West Virginia University,"Nigel N Clark, Christopher M. Atkinson",2004-11-19,2005-11-15,2009-08-11,2009-08-11,https://patents.google.com/patent/US7571600B2/en
US7572601B2,Compositions and methods for determining oocyte development potential ,Northwestern University,"Xingqi Zhang, Edmond Confino, Ralph R. Kazer",2004-10-15,2005-10-17,2009-08-11,2009-08-11,https://patents.google.com/patent/US7572601B2/en
US7585936B2,Protein expression ,"Queensland University Of Technology, Dairy Australia Limited","Mark S. Turner, Philip M. Giffard",2003-10-24,2004-10-22,2009-09-08,2009-09-08,https://patents.google.com/patent/US7585936B2/en
US7559869B2,Limited slip differential with friction using a pressure generating device ,Sungkyunkwan University Foundation For Corporate Collaboration,Chang Sung Seok,2004-02-11,2005-02-07,2009-07-14,2009-07-14,https://patents.google.com/patent/US7559869B2/en
US7582425B2,Atlastin ,The Regents Of The University Of Michigan,"John K. Fink, Xinping Zhao",2001-09-21,2003-02-11,2009-09-01,2009-09-01,https://patents.google.com/patent/US7582425B2/en
US7579009B2,Whole bacterial cells as immune modulator ,University College London,"Graham McIntyre, John Lawson Stanford, Cynthia Ann Stanford, Oscar Adelmo Bottasso",2002-09-06,2003-09-05,2009-08-25,2009-08-25,https://patents.google.com/patent/US7579009B2/en
US7579969B2,Systems and methods for creating and using a conditioning signal ,The Trustees Of Columbia University In The City Of New York,Yannis Tsividis,2005-10-19,2006-10-06,2009-08-25,2009-08-25,https://patents.google.com/patent/US7579969B2/en
US7557097B2,"Structural, behavioral characterization, and synthesis of attractants for migratory lamprey ",Regents Of The University Of Minnesota,"Peter W. Sorensen, Thomas R. Hoye, Jared M. Fine, Vadims Dvornikovs, Jizhou Wang, Lance A. Vrieze",2004-11-20,2004-11-20,2009-07-07,2009-07-07,https://patents.google.com/patent/US7557097B2/en
US7560234B2,Detection of ochratoxin A producing fungi ,University College Cork—National University Of Ireland Cork,"Alan Dobson, John O'Callaghan",2003-02-12,2005-08-11,2009-07-14,2009-07-14,https://patents.google.com/patent/US7560234B2/en
US7595194B2,Isolation of mammalian CNS glial-restricted precursor cells ,University Of Utah Research Foundation,"Mahendra S. Rao, Margot Mayer-Proschel",1997-05-07,2006-05-01,2009-09-29,2009-09-29,https://patents.google.com/patent/US7595194B2/en
US7576192B2,Rapid and sensitive assay for the detection and quantification of coregulators of nucleic acid binding factors ,Saint Louis University,Tomasz Heyduk,2001-08-13,2006-12-12,2009-08-18,2009-08-18,https://patents.google.com/patent/US7576192B2/en
US7557184B2,Isolated staphylococcus DNAX subunit and use thereof ,The Rockefeller University,"Michael E. O'Donnell, Dan Zhang, Richard Whipple",1998-01-27,2002-10-28,2009-07-07,2009-07-07,https://patents.google.com/patent/US7557184B2/en
US7588907B2,Ubiquitin mediated fluorescence complementation assay ,The Regents Of The University Of Michigan,Tom Kerppola,2005-06-02,2006-06-02,2009-09-15,2009-09-15,https://patents.google.com/patent/US7588907B2/en
US7563595B2,Nucleic acids encoding functional splice variants of the α7 nicotinic acetylcholine receptor subunit and methods for producing the encoded proteins ,University Of South Florida,"Javier Cuevas, Emily Severance",2002-11-08,2003-11-07,2009-07-21,2009-07-21,https://patents.google.com/patent/US7563595B2/en
US7589080B2,"β-cyclodextrin compositions, and use to prevent transmission of sexually transmitted diseases ",The Johns Hopkins University School Of Medicine,James E. Hildreth,2000-03-08,2006-11-27,2009-09-15,2009-09-15,https://patents.google.com/patent/US7589080B2/en
US7572573B2,Maskless photolithography for etching and deposition ,University Of South Florida,David P. Fries,2001-06-27,2006-01-30,2009-08-11,2009-08-11,https://patents.google.com/patent/US7572573B2/en
US7572454B2,T helper cell epitopes ,"Csl Limited, The University Of Melbourne","David Charles Jackson, Souravi Ghosh, John Walker",1999-02-05,2007-06-19,2009-08-11,2009-08-11,https://patents.google.com/patent/US7572454B2/en
US7562693B2,Spraying apparatus for forming low-melting-point metal mold ,Chien Kuo Technology University,Tsuo Fei Mau,2006-08-04,2006-08-04,2009-07-21,2009-07-21,https://patents.google.com/patent/US7562693B2/en
US7563446B2,Methods and compositions for inducing autoimmunity in the treatment of cancers ,"Board Of Regents, The University Of Texas System",Alan J. Schroit,1997-12-31,2004-08-31,2009-07-21,2009-07-21,https://patents.google.com/patent/US7563446B2/en
US7585956B2,Quantitative trait loci and somatostatin ,The Texas A & M University System,"Li Cai, Jeremy Taylor, Kerrie-Ann Smyth, Brian Findeisen, Cathi Lehn, Sara Davis, Scott Davis",2002-03-04,2003-03-04,2009-09-08,2009-09-08,https://patents.google.com/patent/US7585956B2/en
US7595516B2,Optoelectronic circuit employing a heterojunction thyristor device to convert a digital optical signal to a digital electrical signal ,"The University Of Connecticut, Opel, Inc.","Geoff W. Taylor, Jianhong Cai",2002-10-25,2008-02-19,2009-09-29,2009-09-29,https://patents.google.com/patent/US7595516B2/en
US7575908B1,Immobilization method for producing active α1-acid glycoprotein ,Board Of Regents Of The University Of Nebraska,"David S. Hage, Hai Xuan",2005-04-19,2006-04-11,2009-08-18,2009-08-18,https://patents.google.com/patent/US7575908B1/en
US7569573B2,Diketo acids with nucleobase scaffolds: anti-HIV replication inhibitors targeted at HIV integrase ,"The University Of Georgia Research Foundation, Inc.","Vasu Nair, Guochen Chi, Vinod R. Uchil",2005-01-31,2007-06-19,2009-08-04,2009-08-04,https://patents.google.com/patent/US7569573B2/en
US7592987B2,Current-scaling active thin film transistor circuit structure for pixel of display device ,"Quanta Display, Inc., National Chiao Tung University","Pei-Ming Chen, Yen-Lin Wei, An-Chih Wang, Yen-Chung Lin, Jian-Zhi Huang, Chia-Feng Yang, Jiun-Shiau Wang, Han-Ping Shieh",2005-09-09,2006-03-02,2009-09-22,2009-09-22,https://patents.google.com/patent/US7592987B2/en
US7592451B2,Treatment for diabetes and obesity as well as method of screening compounds useful for such treatments ,New York University,"Young-Tae Chang, Fabio Piano",2005-06-23,2006-06-20,2009-09-22,2009-09-22,https://patents.google.com/patent/US7592451B2/en
US7574253B2,Signal processing using non-linear regression with a sinusoidal model ,Northwestern University,"Paul A. Edney, Joseph T. Walsh, Jr.",2003-09-26,2003-09-26,2009-08-11,2009-08-11,https://patents.google.com/patent/US7574253B2/en
US7579152B2,SENP1 as a marker of cancer development and target for cancer therapy ,"Board Of Regents, The University Of Texas System",Edward T. H. Yeh,2004-08-27,2005-08-29,2009-08-25,2009-08-25,https://patents.google.com/patent/US7579152B2/en
US7571648B2,Piezoelectric vibration angular velocity sensor ,"Seiko Epson Corporation, Rutgers, The State University Of New Jersey","Yook-Kong Yong, Mihir S Patel, Shigeo Kanna, Masako Tanaka",2007-05-23,2007-05-23,2009-08-11,2009-08-11,https://patents.google.com/patent/US7571648B2/en
US7565285B2,Detecting near-term suicidal risk utilizing vocal jitter ,"Marilyn K. Silverman, Vanderbilt University","Asli Ozdas, Marilyn K. Silverman, Stephen E. Silverman",2000-10-06,2006-11-14,2009-07-21,2009-07-21,https://patents.google.com/patent/US7565285B2/en
US7576580B2,Energy efficient clock deskew systems and methods ,University Of Connecticut,Lei Wang,2005-04-27,2006-04-26,2009-08-18,2009-08-18,https://patents.google.com/patent/US7576580B2/en
US7586456B2,Broadband antenna ,"Industrial Technology Research Institute, National Sun Yat-Sen University","Shih-Huang Yeh, Kin-Lu Wong, Yun-Wen Chi",2006-06-15,2006-08-14,2009-09-08,2009-09-08,https://patents.google.com/patent/US7586456B2/en
US7567149B2,Subwavelength waveguide and delay line with fractal cross sections ,The Hong Kong University Of Science And Technology,"Weijia Wen, Ping Sheng, Che Ting Chan, Lei Zhou, Bo Hou",2006-04-05,2006-04-05,2009-07-28,2009-07-28,https://patents.google.com/patent/US7567149B2/en
US7579343B2,Pyrrolo-thiazines and processes for the preparation and use thereof ,Board Of Trustees Of Michigan State University,"Rawle Hollingsworth, Li Gao",2005-09-08,2006-09-06,2009-08-25,2009-08-25,https://patents.google.com/patent/US7579343B2/en
US7572512B2,Sol-Gel composite AR coating for IR applications ,"University Of Central Florida Research Foundation, Lockheed Martin Missiles And Fire Control","Erik Brinley, Sudipta Seal, Edit Braunstein, Leslie Kramer",2006-03-02,2007-03-02,2009-08-11,2009-08-11,https://patents.google.com/patent/US7572512B2/en
US7560257B2,Diagnostic methods for age related macular degeneration ,"The Cleveland Clinic Foundation, Case Western Reserve University","Joe G. Hollyfield, Robert G. Salomon, John W. Crabb, Xiaorong Gu",2001-04-30,2008-03-06,2009-07-14,2009-07-14,https://patents.google.com/patent/US7560257B2/en
US7557096B2,Synthesis of combretastatin A-4 prodrugs and trans-isomers thereof ,"Arizona Board of Regents, a body corporate of the State of Arizona, acting for an on behalf of the Arizona State University","George R. Pettit, Monte R. Rhodes",1998-01-09,2007-10-08,2009-07-07,2009-07-07,https://patents.google.com/patent/US7557096B2/en
US7591100B2,Method of producing seed and plant containing vitamin B12 ,Hiroshima University,Kazuyoshi Sato,2002-06-12,2003-06-09,2009-09-22,2009-09-22,https://patents.google.com/patent/US7591100B2/en
US7564402B2,Information gathering using reflected satellite signals ,Drexel University,Bruce A. Einstein,2004-07-26,2005-07-22,2009-07-21,2009-07-21,https://patents.google.com/patent/US7564402B2/en
US7564916B2,Method for encoding a message using diagonally weighted space-time trellis code depending on bit feedback ,Seoul National University Industry Foundation,"Jae Hong Lee, Young Seok Jung",2005-03-05,2005-09-23,2009-07-21,2009-07-21,https://patents.google.com/patent/US7564916B2/en
US7579014B2,Mesoporous compositions for use in drug delivery ,Board Of Regents The University Of Texas System,"Ying Ma, Kenneth J. Balkus, Jr.",2001-02-19,2006-12-27,2009-08-25,2009-08-25,https://patents.google.com/patent/US7579014B2/en
US7596409B2,Cardiac shock electrode system and corresponding implantable defibrillator system ,The Johns Hopkins University,Ronald D. Berger,1999-06-07,2003-10-09,2009-09-29,2009-09-29,https://patents.google.com/patent/US7596409B2/en
US7563897B2,"Naphthalene diimide-Zn(II) complex having selectivity for pyrophosphate, preparation method thereof and detecting method of pyrophosphate using the same ",Ewha University-Industry Collaboration Foundation,"Ju Young Yoon, Ha Na Lee, Sook Kyung Kim",2007-04-18,2007-12-31,2009-07-21,2009-07-21,https://patents.google.com/patent/US7563897B2/en
US7582428B2,Methods and compositions for identifying anti-HCV agents ,The Board Of Trustees Of The Leland Stanford Junior University,"Jeffrey S. Glenn, Shirit Einav, Menashe Elazar",2003-08-22,2004-08-18,2009-09-01,2009-09-01,https://patents.google.com/patent/US7582428B2/en
US7569411B2,Metal MEMS devices and methods of making same ,The Regents Of The University Of California,"Noel C. MacDonald, Marco F. Aimi",2003-04-16,2007-01-22,2009-08-04,2009-08-04,https://patents.google.com/patent/US7569411B2/en
US7572836B2,Method of preparing a copolymer and using such as a dispersing agent for titanate-based ceramic colloids ,National Taiwan Normal University,"Kung-Chung Hsu, Chih-hao Chen, Yu-Ping Tsai, Wen-Cheng Wei",2005-09-13,2006-04-05,2009-08-11,2009-08-11,https://patents.google.com/patent/US7572836B2/en
US7586684B2,Solute characterization by optoelectronkinetic potentiometry in an inclined array of optical traps ,New York University,David G. Grier,2005-01-21,2005-01-21,2009-09-08,2009-09-08,https://patents.google.com/patent/US7586684B2/en
US7592506B2,Transgenic plants with altered levels of phenolic compounds ,The Ohio State University Research Foundation,"Erich Grotewold, Anusha P Dia, Edward L. Braun",2001-03-08,2006-12-22,2009-09-22,2009-09-22,https://patents.google.com/patent/US7592506B2/en
US7585420B2,Carbon nanotube substrates and catalyzed hot stamp for polishing and patterning the substrates ,William Marsh Rice University,"Yuhuang Wang, Robert H. Hauge, Howard K. Schmidt, Myung Jong Kim, W. Carter Kittrell",2004-12-16,2005-12-14,2009-09-08,2009-09-08,https://patents.google.com/patent/US7585420B2/en
US7566436B2,Counter current mixing reactor ,The University Of Nottingham,"Edward Henry Lester, Barry James Azzopardi",2004-02-11,2005-02-11,2009-07-28,2009-07-28,https://patents.google.com/patent/US7566436B2/en
US7560250B2,Soluble fusion proteins comprising heterologous polypeptides ,Ramot At Tel Aviv University Ltd.,"Nathan Nelson, Anat Lavi, Shani Leviatan",2004-08-11,2007-02-12,2009-07-14,2009-07-14,https://patents.google.com/patent/US7560250B2/en
US7577185B2,"Finger for symbol-rate weighting using in smart antenna system, and its application for demodulation apparatus and method ","Sas Technologies Co., Ltd., Industry-University Cooperation Foundation Hanyang University",Heung-Jae Im,2001-10-11,2004-04-01,2009-08-18,2009-08-18,https://patents.google.com/patent/US7577185B2/en
US7560491B2,Z-stilbenes derivatives and the pharmaceutical composition thereof ,"Taipei Medical University, National Health Research Institutes","Jing-Ping Liou, Jang-Yang Chang",2006-10-19,2007-01-19,2009-07-14,2009-07-14,https://patents.google.com/patent/US7560491B2/en
US7579006B2,Method of treating immune pathologies with low dose estrogen ,"Oregon Health And Science University, The United States Of America As Represented By The Department Of Veterans Affair",Halina Offner,2000-05-12,2008-04-03,2009-08-25,2009-08-25,https://patents.google.com/patent/US7579006B2/en
US7556967B2,Foldable polymers as probes ,Washington State University Research Foundation,"Alexander D. Q. Li, Wei Wang",2003-03-18,2007-04-24,2009-07-07,2009-07-07,https://patents.google.com/patent/US7556967B2/en
US7575904B2,Polymer grafting by polysaccharide synthases ,The Board Of Regents Of The University Of Oklahoma,Paul L. DeAngelis,1998-11-11,2005-07-11,2009-08-18,2009-08-18,https://patents.google.com/patent/US7575904B2/en
US7585675B2,Inhibition of HIV and SHIV replication with antisense interleukin-4 ,University Of Kansas Medical Center,"Opendra Narayan, Shilpa Buch",2005-11-15,2005-11-15,2009-09-08,2009-09-08,https://patents.google.com/patent/US7585675B2/en
US7588885B2,Use of biocistronic DNA constructs for identifying compounds that inhibit IRES-dependent translation ,Chung Yuan Christian University,"Tzong-Yuan Wu, Shin-Jhan Zeng, Ying-Ju Chen, Tsu-An Hsu, Shin-Ru Shih, Suey-Sheng Kao, Tzyy-Rong Jinn",2004-08-06,2007-07-23,2009-09-15,2009-09-15,https://patents.google.com/patent/US7588885B2/en
US7591094B2,Perforated multi-layer optical film luminaire ,The University Of British Columbia,Lorne A. Whitehead,2005-05-31,2005-05-31,2009-09-22,2009-09-22,https://patents.google.com/patent/US7591094B2/en
US7568181B2,System for building interactive calculations on web pages ,Loma Linda University,"J. Mailen Kootsey, Grant McAuley, Hua Liu",2002-02-25,2003-02-25,2009-07-28,2009-07-28,https://patents.google.com/patent/US7568181B2/en
US7557144B1,Modulation of protein expression using carbocyclic aryl alkenoic acid derivatives ,The Johns Hopkins University,"Pamela L. Zeitlin, Saul Brusilow",2000-03-11,2000-03-11,2009-07-07,2009-07-07,https://patents.google.com/patent/US7557144B1/en
USPP20336P3,Chestnut plant named ‘AU Encore’ ,Auburn University,"W. Alfred Dozier, JR., Joseph Daniel Norton, Curtis J. Hansen",2008-01-30,2008-01-30,2009-09-22,2009-09-22,https://patents.google.com/patent/USPP20336P3/en
US7572919B2,Heteroaryl-containing isoflavones as aromatase inhibitors ,The Ohio State University Research Foundation,"Robert W. Brueggemeier, Young-Woo Kim, John C. Hackett",2004-08-26,2005-08-26,2009-08-11,2009-08-11,https://patents.google.com/patent/US7572919B2/en
US7583024B2,Double-faced plasma display panel ,"Tsinghua University, Hon Hai Precision Industry Co., Ltd.","Pi-Jin Chen, Peng Liu, Li Qian, Yang Wei, Lei-Mei Sheng, You-Hua Lei, Liang Liu, Shou-Shan Fan",2004-06-16,2005-04-27,2009-09-01,2009-09-01,https://patents.google.com/patent/US7583024B2/en
US7575715B2,Methods for sterilizing medical devices using a hydrogen surface-mixed diffusion flame ,Nanyang Technological University,"David Tee Liang, Joo Hwa Tay, Tuti Mariana Lim, Dong Fei Li",2003-05-22,2003-05-22,2009-08-18,2009-08-18,https://patents.google.com/patent/US7575715B2/en
US7593209B2,MOV failure mode identification ,University Of South Florida,"Stelios Ioannou, Elias L. Stefanakos, Paris Wiley",2005-11-30,2008-05-23,2009-09-22,2009-09-22,https://patents.google.com/patent/US7593209B2/en
US7571565B2,Casing material and its use in crop cultivation ,University Of Warwick,"Ralph Noble, Leslie Bareham",2001-03-26,2007-04-12,2009-08-11,2009-08-11,https://patents.google.com/patent/US7571565B2/en
US7583167B2,High frequency magnetic thin film filter ,The Regents Of The University Of Colorado,"Zbigniew J. Celinski, Robert E. Camley",2004-03-09,2005-03-09,2009-09-01,2009-09-01,https://patents.google.com/patent/US7583167B2/en
US7569734B2,Method of using rhodium quinonoid catalysts ,Brown University,"William C. Trenkle, Julia L. Barkin, Seung Uk Son, Dwight A. Sweigart, Marcus D. Faust, Jr.",2005-11-30,2006-06-15,2009-08-04,2009-08-04,https://patents.google.com/patent/US7569734B2/en
US7596197B1,Gamma source for active interrogation ,The Regents Of The University Of California,"Ka-Ngo Leung, Tak Pui Lou, William A. Barletta",2005-08-05,2006-08-07,2009-09-29,2009-09-29,https://patents.google.com/patent/US7596197B1/en
US7595758B2,Compact DTV receiving antenna ,"Lite-On Technology Corp., National Sun Yat-Sen University","Kin-Lu Wong, Wei-Yu Li, Saou-Wen Su",2006-07-28,2006-11-16,2009-09-29,2009-09-29,https://patents.google.com/patent/US7595758B2/en
US7583381B2,Miniaturized fluorescence analysis system ,University Of Washington,"Denise M. Wilson, Andrew E. Moe",2004-08-31,2008-04-22,2009-09-01,2009-09-01,https://patents.google.com/patent/US7583381B2/en
US7588853B2,Direct methanol fuel cell having reduced crossover of methanol and comprising a layer of material for controlling the diffusion rate of fuel ,Sungkyunkwan University Foundation For Corporate Collaboration,"Chan-Hwa Chung, Woo-Jae Kim, Hoo-Gon Choi, Young-Kwan Lee, Sung-min Cho, Jae-Do Nam",2005-07-29,2006-03-31,2009-09-15,2009-09-15,https://patents.google.com/patent/US7588853B2/en
US7582310B2,"Biodegradable and bioactive glass-ceramics, and method for fabricating the same ",Seoul National University Industry Foundation,"Hyun Seung Yu, Kug Sun Hong, Hwan Kim, Dong Ho Lee, Choon Ki Lee, Bong Soon Chang, Deug Joong Kim, Jun Hyuk Seo, Jae Hyup Lee, Ki Soo Park",2002-09-02,2003-08-27,2009-09-01,2009-09-01,https://patents.google.com/patent/US7582310B2/en
US7572109B2,Thermopneumatic capillary micropump and manufacturing method thereof ,Ajou University Industry-Academic Cooperation Foundation,Sang Sik Yang,2007-04-11,2007-04-11,2009-08-11,2009-08-11,https://patents.google.com/patent/US7572109B2/en
USPP20323P2,Dianthus plant named ‘Heart's Desire’ ,Board Of Regents Of University Of Nebraska,Pamela S. Schweizer,2008-07-14,2008-07-14,2009-09-15,2009-09-15,https://patents.google.com/patent/USPP20323P2/en
US7588921B1,Messenger RNA profiling: body fluid identification using multiplex real time-polymerase chain reaction (q-PCR) ,"University Of Central Florida Research Foundation, Inc.","John Ballantyne, Jane Juusola",2004-09-22,2005-09-21,2009-09-15,2009-09-15,https://patents.google.com/patent/US7588921B1/en
US7595678B2,Switched-capacitor circuit ,"The Board Of Regents, University Of Texas System","Zhiheng Cao, Shouli Yan",2006-09-11,2007-09-11,2009-09-29,2009-09-29,https://patents.google.com/patent/US7595678B2/en
US7557197B2,Human soluble neuropilin-1 primary polyadenylation signal and uses thereof ,Oregon Health & Science University,"J. Timothy Stout, Trevor McFarland, Peter J. Francis, Binoy Appukuttan",2004-01-28,2005-01-28,2009-07-07,2009-07-07,https://patents.google.com/patent/US7557197B2/en
US7575871B2,Method of diagnosis and kit of parts therefor ,Aston University,"Martin Griffin, Brian Gibbons",2001-07-21,2002-07-18,2009-08-18,2009-08-18,https://patents.google.com/patent/US7575871B2/en
US7582452B2,Assay for species sources ,"Life Genetics Lab, Llc, Board Of Supervisors Of Louisiana State University And Agricultural And Mechanical College","Sudhir K. Sinha, Jaiprakash G. Shewale, Jerilyn A. Walker, Mark A. Batzer",2003-11-24,2003-12-17,2009-09-01,2009-09-01,https://patents.google.com/patent/US7582452B2/en
US7592313B2,Method of stimulating proliferation of regulatory T cells in a diabetic mammal ,Board Of Trustees Of The University Of Illinois,"Guoxing Zheng, Aoshuang Chen",2004-05-17,2005-05-12,2009-09-22,2009-09-22,https://patents.google.com/patent/US7592313B2/en
US7557118B2,"Preparation of fused polycyclic alkaloids by ring closure of azomethine ylides, novel compounds thereof and their use as chemotherapeutic agents ",The Australian National University,"Martin Gerhardt Banwell, Bernard Luke Flynn",1997-05-02,2005-03-07,2009-07-07,2009-07-07,https://patents.google.com/patent/US7557118B2/en
US7579330B2,Methods of treating various cancers using melanoma differentiation associated protein-7 ,The Trustees Of Columbia University In The City Of New York,Paul B Fisher,1996-08-16,2007-11-06,2009-08-25,2009-08-25,https://patents.google.com/patent/US7579330B2/en
US7572909B2,Method for the preparation of 2-halo-2′-deoxyadenosine compounds from 2′-deoxyguanosine ,Brigham Young University,"Morris J. Robins, Zlatko Janeba, Paula Francom",2002-09-25,2003-09-25,2009-08-11,2009-08-11,https://patents.google.com/patent/US7572909B2/en
US7592440B2,Methods of obtaining active antisense compounds ,"Isis Pharmaceuticals, Inc., University Of Utah","Susan M. Freier, Olga Matveeva, Alexander Tsodikov, Michael C. Giddings, Jacqueline R. Wyatt",2000-05-09,2003-10-15,2009-09-22,2009-09-22,https://patents.google.com/patent/US7592440B2/en
US7588912B2,Compositions and methods for preventing and treating anthrax diseases ,"Regents Of The University Of California, Philadelphia Health And Education Corporation","Richard Rest, Michael Karin, Jin Mo Park",2004-10-12,2005-10-12,2009-09-15,2009-09-15,https://patents.google.com/patent/US7588912B2/en
US7583383B2,Biological property check device using light ,Nihon University,Sadao Omata,2003-09-30,2004-09-30,2009-09-01,2009-09-01,https://patents.google.com/patent/US7583383B2/en
US7592163B2,Highly active xylose reductase from Neurospora crassa ,"The Board Of Trustees Of The University Of Illinois, Biotechnology Research And Development Corporation","Huimin Zhao, Ryan Woodyer, Michael Simurdiak, Wilfred A. van der Donk",2004-06-15,2008-05-19,2009-09-22,2009-09-22,https://patents.google.com/patent/US7592163B2/en
US7579012B2,Targeting of triacylglycerol synthase gene for tuberculosis treatment ,"University Of Central Florida Research Foundation, Inc.","Pappachan E. Kolattukudy, Tatiano Sirakova, Vinod S. Dubey, Jaiyanth Daniel",2005-12-07,2006-11-20,2009-08-25,2009-08-25,https://patents.google.com/patent/US7579012B2/en
US7579146B2,Nucleic acid cloning ,Trustees Of Boston University,"Kevin A. Jarrell, Vincent W. Coljee, William Donahue, Svetlana Mikheeva",1999-01-05,2001-06-29,2009-08-25,2009-08-25,https://patents.google.com/patent/US7579146B2/en
US7589220B2,Inhibitors of the anandamide transporter ,University Of Connecticut,"Alexandros Makriyannis, Andreas Goutopoulos, Chen Li",1998-06-09,2004-07-26,2009-09-15,2009-09-15,https://patents.google.com/patent/US7589220B2/en
US7569521B2,"Method of producing biaxially textured substrates and related articles, devices and systems ","University Of Florida Research Foundation, Inc.","David Paul Norton, Seh-Jin Park",2004-12-01,2004-12-01,2009-08-04,2009-08-04,https://patents.google.com/patent/US7569521B2/en
