US7066032B2,Pressure converter ,Educational Foundation Nihon University,"Yoshihiko Maeno, Koichi Yabe",2001-07-31,2002-03-13,2006-06-27,2006-06-27,https://patents.google.com/patent/US7066032B2/en
US7023220B2,Method for measuring nm-scale tip-sample capacitance ,The Ohio State University,"Jonathan P. Pelz, David T. Lee, Bharat Bhushan",2002-06-04,2004-10-19,2006-04-04,2006-04-04,https://patents.google.com/patent/US7023220B2/en
US7063944B1,"Human methionine synthase reductase: cloning, and methods for evaluating risk of, preventing, or treating neural tube defects, cardiovascular disease, cancer, and down's syndrome ",Mcgill University,"Roy A. Gravel, Rima Rozen, Daniel Leclerc, Aaron Wilson, David Rosenblatt",1998-01-16,2000-01-19,2006-06-20,2006-06-20,https://patents.google.com/patent/US7063944B1/en
US7046099B2,Temperature compensated oscillator ,"Poseidon Scientific Instruments Pty Ltd, The University Of Western Australia","Eugene Nikolay Ivanov, Michael Edmund Tobar, John Gideon Hartnett",2001-10-30,2004-04-30,2006-05-16,2006-05-16,https://patents.google.com/patent/US7046099B2/en
US7067486B2,Acetylcholinesterase-derived peptides and uses thereof ,Yissum Research Development Company Of The Hebrew University Of Jerusalem,"Hermona Soreq, Varda Deutch, Dan Grisaru, Amiram Eldor, deceased",1999-05-31,2001-11-30,2006-06-27,2006-06-27,https://patents.google.com/patent/US7067486B2/en
US7033768B2,Reverse two-hybrid systems ,"The General Hospital Corporation, The John Hopkins University","Marc Vidal, Jef D. Boeke, Ed Harlow",1995-04-11,2001-12-21,2006-04-25,2006-04-25,https://patents.google.com/patent/US7033768B2/en
US7026881B2,Wideband variable frequency voltage controlled oscillator ,Information And Communications University Educational Foundation,"Yong Hak Kim, Chul Soon Park",2003-07-01,2004-01-13,2006-04-11,2006-04-11,https://patents.google.com/patent/US7026881B2/en
US7038844B2,High power 938 nanometer fiber laser and amplifier ,The Regents Of The University Of California,"Jay W. Dawson, Zhi Ming Liao, Raymond J. Beach, Alexander D. Drobshoff, Stephen A. Payne, Deanna M. Pennington, Wolfgang Hackenberg, Domenico Bonaccini Calia, Luke Taylor",2003-09-29,2003-09-29,2006-05-02,2006-05-02,https://patents.google.com/patent/US7038844B2/en
US7022670B1,Neurotrophin NT-7 from carp ,Hong Kong University Of Science & Technology,"Nancy Yuk-yu Ip, Kwok On Lai",1998-09-22,1998-09-22,2006-04-04,2006-04-04,https://patents.google.com/patent/US7022670B1/en
US7058551B2,High-speed dynamics computation for link system ,The University Of Tokyo,"Yoshihiko Nakamura, Katsu Yamane",2001-07-30,2002-06-05,2006-06-06,2006-06-06,https://patents.google.com/patent/US7058551B2/en
US7041483B2,Expression modulating sequences ,The University Of Queensland,"Joseph Attila Rothnagel, Xue-Qing Wang",2000-06-13,2001-06-13,2006-05-09,2006-05-09,https://patents.google.com/patent/US7041483B2/en
US7030701B2,Transimpedance amplification apparatus with source follower structure ,Information And Communications University Educational Foundation,"Dong Yun Jung, Sang-hyun Park, Chul Soon Park",2002-12-16,2003-12-16,2006-04-18,2006-04-18,https://patents.google.com/patent/US7030701B2/en
US7053067B2,Chlamydia oligosaccharides ,The University Of Washington,"Cho-Chou Kuo, Albertina F. Swanson, Sen-itiroh Hakomori, Noriko Takahashi",1996-07-25,2003-12-11,2006-05-30,2006-05-30,https://patents.google.com/patent/US7053067B2/en
US7033991B2,Inhibiting furin with polybasic peptides ,Board Of Supervisors Of Louisiana State University And Agriculture And Mechanical College,"Iris Lindberg, Angus Cameron, Jon Appel, Richard Houghten",2001-07-16,2001-07-16,2006-04-25,2006-04-25,https://patents.google.com/patent/US7033991B2/en
US7026511B2,Synthesis of N-vinylformamide ,"University Of Pittsburgh, Snf Sa","Eric J. Beckman, Toby M. Chapman, Cedrick Favero, Christopher C. Capelli, Harold E. Swift, William Eamon Carroll",2002-08-30,2004-02-27,2006-04-11,2006-04-11,https://patents.google.com/patent/US7026511B2/en
US7067257B2,Thyrotropin-releasing hormone analogues and their therapeutic applications ,University Of Florida,Laszlo Prokai,2002-04-19,2003-04-21,2006-06-27,2006-06-27,https://patents.google.com/patent/US7067257B2/en
US7060682B2,"Receptor recognition factors, protein sequences and methods of use thereof ",The Rockefeller University,"James E. Darnell, Jr., Christian W. Schindler, Xin-Yuan Fu, Zilong Wen, Zhong Zhong",1992-03-19,2003-08-12,2006-06-13,2006-06-13,https://patents.google.com/patent/US7060682B2/en
US7063824B1,Beneficiation of zircon ,University Of Pretoria,"Willem Johannes De Wet, deceased",1999-06-07,2000-06-06,2006-06-20,2006-06-20,https://patents.google.com/patent/US7063824B1/en
US7029906B2,Carbonyl stress-ameliorating agents ,"Toshio Miyata, Kiyoshi Kurokawa, Tokai University Education System",Toshio Miyata,1999-12-20,2000-12-15,2006-04-18,2006-04-18,https://patents.google.com/patent/US7029906B2/en
US7049489B2,Genes for controlling floral development in orchid ,National Cheng Kung University,"Hong-Hwa Chen, Wen-Chieh Tsai, Wen-Huei Chen",2002-10-25,2003-10-21,2006-05-23,2006-05-23,https://patents.google.com/patent/US7049489B2/en
US7048603B2,Method for manufacturing organic light-emitting diodes ,National Cheng Kung University,"Yean-Kuen Fang, William Lee, Jyh-Jier Ho, Shyh-Fann Ting, Shih-Fang Chen, Hsin-Che Chiang",2002-12-09,2003-11-25,2006-05-23,2006-05-23,https://patents.google.com/patent/US7048603B2/en
US7052859B2,MUCIN 4 expression as a marker for pancreatic cancer ,The Board Of Regents Of The University Of Nebraska,"Surinder K. Batra, Randall E Brand, Jöerg Ringel, Grit Faulmann, Matthias Löhr, Grish C. Varshney",2000-12-08,2002-10-24,2006-05-30,2006-05-30,https://patents.google.com/patent/US7052859B2/en
US7022484B2,Methods for treating neuropathological states and neurogenic inflammatory states and methods for identifying compounds useful therein ,"Board Of Regents, The University Of Texas System","Karin Westlund High, Giulio Taglialatela",2000-06-08,2001-06-08,2006-04-04,2006-04-04,https://patents.google.com/patent/US7022484B2/en
US7067804B2,Atmospheric pressure ion lens for generating a larger and more stable ion flux ,The University Of British Columbia,"David D. Y. Chen, Donald J. Douglas, Bradley B. Schneider",2000-05-22,2001-05-22,2006-06-27,2006-06-27,https://patents.google.com/patent/US7067804B2/en
US7067702B2,Process for preparing vinyl substituted beta-diketones ,The Johns Hopkins University,"Glen E. Southard, George M. Murray",2004-05-25,2005-05-12,2006-06-27,2006-06-27,https://patents.google.com/patent/US7067702B2/en
US7063842B2,Compounds and methods for inhibiting the interaction between α-catenin and β-catenin ,Mcgill University,"Orest W Blaschuk, Barbara J Gour",1997-04-10,2003-02-13,2006-06-20,2006-06-20,https://patents.google.com/patent/US7063842B2/en
US7045352B2,Converting diploidy to haploidy for genetic diagnosis ,The Johns Hopkins University,"Bert Vogelstein, Kenneth W. Kinzler, Nickolas Papadopoulos, Hai Yan",1999-10-08,2002-08-02,2006-05-16,2006-05-16,https://patents.google.com/patent/US7045352B2/en
US7049066B2,Diagnosis and treatment of myocardial failure ,The Regents Of The University Of Colorado,"Michael R. Bristow, Leslie A. Leinwand, Wayne Minobe, Koichi Nakao, Koichiro Kinugawa",1997-01-30,2001-10-01,2006-05-23,2006-05-23,https://patents.google.com/patent/US7049066B2/en
US7029680B1,Delivery of immunogenic molecules vis HBsAg particles ,"Yissum Research Development Company Of The Hebrew University Of Jerusalem, Jorg Reimann","Jörg Reimann, Yechezkel Barenholz, Dvorah Diminsky, Reinhold Schirmbeck",1998-02-03,1999-02-02,2006-04-18,2006-04-18,https://patents.google.com/patent/US7029680B1/en
US7031570B2,Device and method of temperature compensating optical component ,National Taiwan University Of Science And Technology,"Chow-Shing Shin, Chiu-Hao Lin, Chia-Chin Chiang, Shien-Kuei Liaw, Yu-Chang Tseng, Hsuan-Chen Chen",2002-12-30,2003-11-13,2006-04-18,2006-04-18,https://patents.google.com/patent/US7031570B2/en
US7063601B1,Internal magnetic-force polishing system ,"Sejong University Industry-Academy Cooperation Foundation, Jeong-Du Kim",Jeong-Du Kim,2005-01-19,2005-01-19,2006-06-20,2006-06-20,https://patents.google.com/patent/US7063601B1/en
US7043874B2,Substrate and method for growing shiitake mushrooms [Lentinus edodes (Berk.) singer] and new shiitake strain ,Carmel-Haifa University Economic Corp. Ltd.,"Solomon P. Wasser, Viktor T. Bilay",2003-11-12,2003-11-12,2006-05-16,2006-05-16,https://patents.google.com/patent/US7043874B2/en
US7037651B2,Genetic marker test for lupus ,"Cedars-Sinai Medical Center, The Regents Of The University Of California","Betty P. Tsao, Rita M. Cantor, Jerome I. Rotter",1999-03-29,2001-07-18,2006-05-02,2006-05-02,https://patents.google.com/patent/US7037651B2/en
US7050717B2,System and method of all optical label swapping using two-stage optical wavelength converters ,The Regents Of The University Of California,Daniel J. Blumenthal,2000-09-06,2001-09-07,2006-05-23,2006-05-23,https://patents.google.com/patent/US7050717B2/en
US7038010B2,Agents and methods for promoting bone growth ,"Northeastern Ohio Universities College Of Medicine, Temple University","Gary B. Schneider, Steven N. Popoff, Fayez Safadi",2000-11-09,2001-11-09,2006-05-02,2006-05-02,https://patents.google.com/patent/US7038010B2/en
US7023673B2,Superconducting shielded core reactor with reduced AC losses ,The University Of Chicago,"Yung S. Cha, John R. Hull",2002-12-23,2002-12-23,2006-04-04,2006-04-04,https://patents.google.com/patent/US7023673B2/en
US7052837B2,Histoplasma capsulatum catalase sequences and their use in the detection of Histoplamsa capsulatum and histoplasmosis ,The Board Of Trustees Of The University Of Arkansas,"Clayton H. Johnson, J. Lyndal York, Joan E. McEwen",2001-03-13,2002-03-13,2006-05-30,2006-05-30,https://patents.google.com/patent/US7052837B2/en
US7038112B2,Fatty acid elongases ,Miami University,"Jan G. Jaworski, Martha Ann Post-Beittenmiller, James Todd",1997-06-03,2001-06-18,2006-05-02,2006-05-02,https://patents.google.com/patent/US7038112B2/en
US7041495B2,"Pregnancy up-regulated, nonubiquitous CaM kinase ",The Trustees Of The University Of Pennsylvania,"Lewis A. Chodosh, Heather P. Gardner",2000-12-21,2001-12-21,2006-05-09,2006-05-09,https://patents.google.com/patent/US7041495B2/en
US7060262B2,Stimulating neutrophil function to treat inflammatory bowel disease ,The Washington University,"Brian K. Dieckgraefe, Joshua Korzenik",1999-02-12,2002-10-01,2006-06-13,2006-06-13,https://patents.google.com/patent/US7060262B2/en
US7033766B2,Construction and screening of lantibody display libraries ,University Of Maryland Office Of Technology Commercialization,J. Norman Hansen,2000-06-29,2001-06-29,2006-04-25,2006-04-25,https://patents.google.com/patent/US7033766B2/en
US7056501B2,Recombinant neospora antigens and their uses ,The Regent Of The University Of California,"Patricia A. Conrad, Bradd C. Barr, Mark L. Anderson, Karen W. Sverlow",1994-03-21,2004-07-26,2006-06-06,2006-06-06,https://patents.google.com/patent/US7056501B2/en
US7047752B2,Cooling systems ,Loughborough University Innovations Limited,"Harry Salt, Dennis Leslie Loveday",2000-10-14,2001-10-11,2006-05-23,2006-05-23,https://patents.google.com/patent/US7047752B2/en
US7038821B2,Scanning apparatus ,The University Of Reading,Alan Lettington,2001-07-20,2002-07-22,2006-05-02,2006-05-02,https://patents.google.com/patent/US7038821B2/en
US7049073B2,Double stranded nucleic acid biochips ,The University Of Chicago,"Boris Chernov, Julia Golova",2002-10-30,2002-10-30,2006-05-23,2006-05-23,https://patents.google.com/patent/US7049073B2/en
US7027386B2,Read-only optical recording medium with ZnO near-field optical interaction layer ,National Taiwan University,"Din-Ping Tsai, Yu-Hsuan Lin, Hsun-Hao Chang",2002-06-03,2002-12-30,2006-04-11,2006-04-11,https://patents.google.com/patent/US7027386B2/en
US7037901B1,Radiosensitization by indolocarbazole derivatives ,University Of California,Allan Y. Chen,2001-02-12,2002-02-12,2006-05-02,2006-05-02,https://patents.google.com/patent/US7037901B1/en
US7029911B1,AFC1 and RCE1: isoprenylated CAAX processing enzymes ,The Regents Of The University Of California,"Jasper D. Rine, Victor L. Boyartchuk, Matthew N. Ashby",1996-08-07,1998-10-02,2006-04-18,2006-04-18,https://patents.google.com/patent/US7029911B1/en
US7038041B2,Selective nuclear receptor-targeted systems for delivery of cytotoxins to cancer cells for targeted photodynamic therapy ,The Trustees Of Boston University,"Rahul Ray, Scott C. Mohr, Narasimha Swamy",2000-04-12,2001-04-12,2006-05-02,2006-05-02,https://patents.google.com/patent/US7038041B2/en
US7038827B2,Variable semiconductor all-optical buffer using slow light based on electromagnetically induced transparency ,The Regents Of The University Of California,"Connie J. Chang-Hasnain, Pei-Cheng Ku",2001-09-21,2005-03-28,2006-05-02,2006-05-02,https://patents.google.com/patent/US7038827B2/en
US7049133B2,Regulation of gene expression through manipulation of mRNA splicing and its uses ,Yissum Research Development Company Of The Hebrew University Of Jerusalem,"Raymond Kaempfer, Farhat Osman, Nayef Jarrous, Yitzhak Ben-Asouli",1998-09-07,2001-03-07,2006-05-23,2006-05-23,https://patents.google.com/patent/US7049133B2/en
US7022666B1,Method of inducing formation of kidney epithelia from mesenchymal precursors ,The Trustees Of Columbia University In The City Of New York,"Jonathan M. Barasch, Juan A. Oliver, Jun Yang",1999-05-04,2000-05-04,2006-04-04,2006-04-04,https://patents.google.com/patent/US7022666B1/en
US7025971B2,Treatment or prophylaxis of diseases caused by pilus-forming bacteria ,"Washington University, Siga Pharmaceuticals, Inc.","Scott Hultgren, Meta Kuehn, Zheng Xu, Derek Ogg, Mark Harris, Matti Lepisto, Charles Hal Jones, Jan Kihlberg",1993-11-18,2001-03-06,2006-04-11,2006-04-11,https://patents.google.com/patent/US7025971B2/en
US7052676B2,Methods for inhibition of HIV replication using a small molecule inhibitor ,The Regents Of The University Of Michigan,"David M. Markovitz, Brian R. Lane, Peter J. Polverini, Robert M. Strieter",2000-09-26,2001-09-20,2006-05-30,2006-05-30,https://patents.google.com/patent/US7052676B2/en
US7029888B2,Modified synthetases to produce penicillins and cephalosporins under the control of bicarbonate ,Board Of Trustees Of Michigan State University,"David R. Dilley, Dina K. Kadyrzhanova, Zhenyong Wang, Toni M. Warner",1999-10-06,2001-08-08,2006-04-18,2006-04-18,https://patents.google.com/patent/US7029888B2/en
US7041821B2,Synthetic molecules for labeling histidine-rich proteins ,The Regents Of The University Of California,"Roger Y. Tsien, Christina Hauser",2003-01-16,2004-01-16,2006-05-09,2006-05-09,https://patents.google.com/patent/US7041821B2/en
US7057730B2,Apparatus and method for direct measurement of absorption and scattering coefficients in situ ,The Texas A&M University System,"Edward S. Fry, George W. Kattawar, Deric J. Gray, Xianzhen Zhao, Zheng Lu",2002-11-15,2003-11-17,2006-06-06,2006-06-06,https://patents.google.com/patent/US7057730B2/en
US7045305B1,Methods and reagents for targeting organic compounds to selected cellular locations ,The Regents Of The University Of California,Javier Farinas,1998-04-08,1999-04-08,2006-05-16,2006-05-16,https://patents.google.com/patent/US7045305B1/en
US7041462B2,Conformational and topological protein regulation ,Regents Of The University Of California,"Vishwanath R. Lingappa, D. Thomas Rutkowski, Ramanujan S. Hegde",1999-12-15,2004-08-03,2006-05-09,2006-05-09,https://patents.google.com/patent/US7041462B2/en
US7067125B2,Antimicrobial polypeptides and methods of use ,University Of Florida Research Foundation,Jeffrey Daniel Hillman,1997-06-10,2002-09-04,2006-06-27,2006-06-27,https://patents.google.com/patent/US7067125B2/en
US7029696B2,Delivery and activation through liposome incorporation of diaminocyclohexane platinum(II) complexes ,"Board Of Regents, The University Of Texas System","Roman Perez-Soler, Abdul R. Khokhar",1996-12-06,2003-12-30,2006-04-18,2006-04-18,https://patents.google.com/patent/US7029696B2/en
US7041298B2,Proteolysis targeting chimeric pharmaceutical ,"California Institute Of Technology, Yale School of Medicine, The Regents Of The University Of California","Raymond J. Deshaies, Craig Crews, Kathleen M. Sakamoto",2000-09-08,2001-09-10,2006-05-09,2006-05-09,https://patents.google.com/patent/US7041298B2/en
US7063948B1,Uses of antibodies against AChE and peptides thereof ,Yissum Research Development Company Of The Hebrew University Of Jerusalem,"Hermona Soreq, Daniela Kaufer, Alon Friedman, Shlomo Seidman",1999-05-31,2000-05-31,2006-06-20,2006-06-20,https://patents.google.com/patent/US7063948B1/en
US7033755B2,Diagnostics and therapeutics for glaucoma ,"Alcon, Inc., University Of Iowa Research Foundation","Abbot F. Clark, John Fingert, Loretta McNatt, Edwin M. Stone, Wan-Heng Wang",2000-02-29,2001-02-28,2006-04-25,2006-04-25,https://patents.google.com/patent/US7033755B2/en
US7034978B2,"Optical function device using photonic crystal, variable wavelength optical filter and variable wavelength light source ","Fujitsu Limited, Japan As Represented By The President Of The University Of Tokyo","Tsuyoshi Aoki, Kazuaki Kurihara, Makoto Kuwabara",2003-03-20,2004-03-19,2006-04-25,2006-04-25,https://patents.google.com/patent/US7034978B2/en
US7067682B2,"6,7-Oxygenated steroids and uses related thereto ","Inflazyme Pharmaceuticals Ltd., The University Of British Columbia, The University Of Alberta","David L. Burgoyne, Yaping Shen, John M. Langlands, Christine Rogers, Joseph H L Chau, Edward Piers, Hassan Salari",1996-07-11,2003-11-06,2006-06-27,2006-06-27,https://patents.google.com/patent/US7067682B2/en
US7049461B1,Treatment of leukemia ,University Of Central Florida,"D. Howard Miles, Solodnikov Sergey Yurjevich, Krasnykh Olga Petrovna, Malanin Vladimir Vladmirovitch, Tatiana A. Korotkova",2001-06-08,2002-06-07,2006-05-23,2006-05-23,https://patents.google.com/patent/US7049461B1/en
US7049337B2,Derivatives of 2-aminotetralins and pharmaceutical analogs thereof exhibiting differential CNS receptor activity and behavior ,Wayne State University,Aloke K. Dutta,2000-05-19,2001-05-17,2006-05-23,2006-05-23,https://patents.google.com/patent/US7049337B2/en
US7060455B1,Broad specificity DNA damage endonuclease ,Emory University,"Paul W. Doetsch, Angela M. Avery, Balveen Kaur",1998-06-08,2000-11-28,2006-06-13,2006-06-13,https://patents.google.com/patent/US7060455B1/en
US7049071B2,Detection of DNA damaging agents ,University Of Manchester Institute Of Science And Technology,"Richard Maurice Walmsley, Wolf-Dietrich Heyer",1997-03-27,2002-09-16,2006-05-23,2006-05-23,https://patents.google.com/patent/US7049071B2/en
US7057055B2,Process for preparing a deuterated or tritiated compound ,The Regents Of The University Of California,"Robert C. Bergman, Steven R. Klei",2001-03-22,2005-10-04,2006-06-06,2006-06-06,https://patents.google.com/patent/US7057055B2/en
US7052865B1,Identification of genes having a role in the presentation of diabetic nephropathy ,"University College Dublin, National University Of Ireland, Dublin, Hibergen Limited","Hugh Redmond Brady, Catherine Mary Godson, Finian Mary Martin, Ruth Anne McMahon, Madeline Anne Murphy",1999-02-26,2000-02-28,2006-05-30,2006-05-30,https://patents.google.com/patent/US7052865B1/en
US7067351B2,Selectively-etched nanochannel electrophoretic and electrochemical devices ,The Regents Of The University Of California,"Michael P. Surh, William D. Wilson, Troy W. Barbee, Jr., Stephen M. Lane",2002-09-30,2004-06-08,2006-06-27,2006-06-27,https://patents.google.com/patent/US7067351B2/en
US7037720B2,Neuroepithelial stem cells and glial-restricted intermediate precursors ,University Of Utah Reseach Foundation,"Mahendra S. Rao, Margot Mayer-Proschel",1997-05-07,2001-12-19,2006-05-02,2006-05-02,https://patents.google.com/patent/US7037720B2/en
US7026886B2,Miniaturized microwave integrated circuit using complementary conducting surfaces ,National Chiao Tung University,"Ching-Kuang Tzuang, Chih-Chiang Chen",2003-10-09,2003-10-09,2006-04-11,2006-04-11,https://patents.google.com/patent/US7026886B2/en
US7038106B1,Detection of neural activity ,The University Court Of The University Of Glasgow,"Kim Kaiser, Philippe Rosay, James Douglas Armstrong",1998-06-06,1999-06-07,2006-05-02,2006-05-02,https://patents.google.com/patent/US7038106B1/en
US7022712B2,Solubilization of weak bases ,Arizona Board Of Regents On Behalf Of The University Of Arizona,Samuel H. Yalkowsky,2002-03-26,2003-03-26,2006-04-04,2006-04-04,https://patents.google.com/patent/US7022712B2/en
US7045293B2,Alteration of sequence of a target molecule ,The Regents Of The University Of Colorado,"Bruce Sullenger, Thomas R. Cech",1993-11-12,2004-03-12,2006-05-16,2006-05-16,https://patents.google.com/patent/US7045293B2/en
US7066988B2,Segmented plate for assembly within a confined area having limited access ,The Regents Of The University Of Colorado,"Victor Omark Méndez-Ferreira, Kenneth Morse",2003-08-19,2003-08-19,2006-06-27,2006-06-27,https://patents.google.com/patent/US7066988B2/en
US7064202B1,Camptothecin intermediates and prodrugs and methods of preparation thereof ,"University Of Kentucky Research Foundation, University Of Pittsburgh","Thomas G. Burke, deceased, Dennis P. Curran, Wu Du",2003-05-12,2004-05-12,2006-06-20,2006-06-20,https://patents.google.com/patent/US7064202B1/en
US7030156B2,Devices and methods for eliminating termite colonies ,"University Of Florida Research Foundation, Inc","Philip Frederick Brode, III, Garry Steven Garrett, Leo Timothy Laughlin, Randall Stryker Matthews, Dale Edwin Barker, Daniel James Kinne, Gary Eugene McKibben, Christopher Miles Miller, Timothy Robert Probst",2001-03-05,2002-06-17,2006-04-18,2006-04-18,https://patents.google.com/patent/US7030156B2/en
US7037507B2,T helper cell epitopes ,"Csl Limited, The University Of Melbourne","David Charles Jackson, Souravi Ghosh, John Walker",1999-02-05,2004-09-08,2006-05-02,2006-05-02,https://patents.google.com/patent/US7037507B2/en
US7067102B1,Method and apparatus for producing ozone ,Potchefstroom University For Christian Higher Education,Barend Visser,1999-02-24,2000-02-24,2006-06-27,2006-06-27,https://patents.google.com/patent/US7067102B1/en
US7026358B2,Oral general anesthetics and metabolitically resistant anticonvulsants ,University Of Virginia Patent Foundation,Milton L. Brown,2001-04-16,2002-04-15,2006-04-11,2006-04-11,https://patents.google.com/patent/US7026358B2/en
US7034773B1,Adaptive multifilar antenna ,University Of Surrey,"Simon Reza Saunders, Andreas-Albertos Agius",1998-02-16,1999-02-15,2006-04-25,2006-04-25,https://patents.google.com/patent/US7034773B1/en
US7034010B2,Use of recombinant gene delivery vectors for treating or preventing lysosomal storage disorders ,"Chiron Corporation, University Of Iowa Research Foundation","Beverly Davidson, Douglas J. Jolly, Sybille L. Sauter, Colleen S. Stein, Thomas W. Dubensky, Jr., Jason A. Heth",1999-05-28,2003-01-31,2006-04-25,2006-04-25,https://patents.google.com/patent/US7034010B2/en
US7037645B2,Methods for identification of CDS8+ suppressor molecules ,Duke University,"Dani P. Bolognesi, Michael L Greenberg, Simon F Lacey, Georgia D Tomaras, Kent J. Weinhold",2000-03-16,2002-02-06,2006-05-02,2006-05-02,https://patents.google.com/patent/US7037645B2/en
US7024078B2,"Fiber device with high nonlinearity, dispersion control and gain ",University Of Rochester,Wayne H. Knox,2003-11-03,2004-11-02,2006-04-04,2006-04-04,https://patents.google.com/patent/US7024078B2/en
US7049102B1,Multi-gene expression profile ,Board Of Trustees Of Leland Stanford University,"Russell N. Van Gelder, Mark E. Von Zastrow, Jack D. Barchas, James H. Eberwine",1989-09-22,2000-11-15,2006-05-23,2006-05-23,https://patents.google.com/patent/US7049102B1/en
US7067630B2,Transmembrane serine protease overexpressed in ovarian carcinoma and uses thereof ,The Board Of Trustees Of The University Of Arkansas System,"Timothy J. O'Brien, Lowell J. Underwood",1999-03-03,2003-06-05,2006-06-27,2006-06-27,https://patents.google.com/patent/US7067630B2/en
US7064206B1,Highly lipophilic camptothecin intermediates and prodrugs and methods of preparation thereof ,"University Of Kentucky Research Foundation, University Of Pittsburg","Dennis P. Curran, Wu Du, Thomas G. Burke, deceased",2003-05-12,2004-05-12,2006-06-20,2006-06-20,https://patents.google.com/patent/US7064206B1/en
US7060855B2,Asymmetric phosphinoselenoic chloride and method for producing the same ,Gifu University,"Toshiaki Murai, Tsutomu Kimura",2003-02-24,2004-02-24,2006-06-13,2006-06-13,https://patents.google.com/patent/US7060855B2/en
US7034201B2,Developmental animal model of temporal lobe epilepsy ,University Of Prince Edward Island,"Tracy Doucette, Henriette Husum Bak-Jensen, Melissa Perry, Catherine Ryan, R. Andrew Tasker",2003-12-04,2003-12-04,2006-04-25,2006-04-25,https://patents.google.com/patent/US7034201B2/en
US7026413B2,"Biopolymers and biopolymer blends, and method for producing same ",Regents Of The University Of Minnesota,"Friedrich Srienc, Aaron S. Kelley, Nikolaos Mantzaris",1999-09-09,2004-01-29,2006-04-11,2006-04-11,https://patents.google.com/patent/US7026413B2/en
US7053100B2,Therapeutic nucleosides ,"Emory University, Inc.",Dennis C. Liotta,1991-03-06,2004-07-09,2006-05-30,2006-05-30,https://patents.google.com/patent/US7053100B2/en
US7049409B2,Heregulin-like factor antibodies ,"Human Genome Sciences, Inc., Georgetown University Medical Center","Paul E. Young, C. Richter King, Mia Hijazi, Steven M. Ruben",1997-06-17,2003-07-01,2006-05-23,2006-05-23,https://patents.google.com/patent/US7049409B2/en
